title,agency,date,links,标题,来信日期,信件内容,回复日期,回复单位,回复内容
业主车辆无法进小区,上海市虹口区人民政府江湾镇街道办事处,2023-08-30,https://xfb.sh.gov.cn/xinfang/yjzj/feedback/feedbackshow?id=C0ADBC2517E74575A59AA911665A3F6A,业主车辆无法进小区,2023-08-15,领导好，我要投诉上海市虹口区新市南路515弄新电小区物业违反《民法典》第275条，即私自将小区地面公共车位（非原始车位）租给部分业主作固定车位用。新南居委代表街道告知，小区停车问题以业委会立的规章为准则，不参考民法典。首先作为基层物业对部分业主的侵权问题，其次作为上级街道不知法，不懂法，碰到民生问题就和稀泥的工作态度。在各路投诉无门后，只能在这里寻求政府领导帮助！谢谢！,2023-08-30,上海市虹口区人民政府江湾镇街道办事处,江网字（23）第36号任女士：您于2023年8月15日反映（网[2023]000199309）小区停车问题。我们于2023年8月15日受理，并发出受理告知书。经了解，街道工作人员联系了小区所属的鑫洪物业，物业表示小区有400余户业主，地面公共部位用于停车，约有七十余个车位，停车资源严重不足，矛盾突出。针对您反映的问题，小区“机动车停车方案”由小区业委会拟定并于2020年5月26日征询小区全体业主并通过，物业按照征询通过后的方案进行管理。关于小区保安工作态度问题，街道相关部门已督促物业服务好小区业主，耐心与居民沟通，做好相关解释工作。如不服本处理意见，可自收到本处理意见书之日起30日内向虹口区人民政府信访办提出复查申请。上海市虹口区人民政府江湾镇街道办事处2023年8月30日
恒大江湾华庭房屋漏水问题,上海市虹口区人民政府江湾镇街道办事处,2023-08-30,https://xfb.sh.gov.cn/xinfang/yjzj/feedback/feedbackshow?id=950BBFCB3B794151A9938D53F65EE2BF,恒大江湾华庭房屋漏水问题,2023-08-03,"本人反映,我现在居住的房子有楼上漏水的问题，每天一遍一遍的跟物业反映，物业每次来就是告知现在的物业师傅找不到漏水点，原本的开发商装修的师傅也以拿不到欠款为由不来帮楼上进行检查维修，导致现在我家因为天花板漏水的问题把房屋的新风系统烧坏掉了，新风系统的电箱还在继续往里面滴水，这真的是一个很大的安全隐患问题，因为房屋构造的问题，外面不熟悉的师傅没办法确定漏水点，一定是需要恒大原本的师傅来才可以，希望领导能看到，能帮帮我们",2023-08-30,上海市虹口区人民政府江湾镇街道办事处,江网字（23）第35号窦女士：您于2023年8月7日反映（网[2023]000190368）现在居住的房子有楼上漏水的问题，多次向物业反应，物业每次来就是告知找不到漏水点，原本的开发商装修的师傅也以拿不到欠款为由不来检查维修，导致现在您家因为天花板漏水的问题把房屋的新风系统烧坏掉了，新风系统的电箱还在继续往里面滴水，有很大的安全隐患。因为房屋构造的问题，外面不熟悉的师傅没办法确定漏水点，一定是需要恒大原本的师傅来才可以。要求解决漏水问题。我们于2023年8月7日受理，并发出受理告知书。经了解，街道相关部门的工作人员联系了小区物业，物业表示您家天花板渗水属自用部位，楼上2501室属二次装修，经前期双方协商并达成一致意见，由第三方防水公司对漏水问题进行责任认定，并根据认定结果进行后续维修。通过沟通，现2501室同意配合漏水施工，更改管道重新铺设。街道将继续督促物业公司加强小区管理，积极化解业主矛盾，为小区业主创造良好的生活环境。如不服本处理意见，可自收到本处理意见书之日起30日内向虹口区人民政府信访办提出复查申请。上海市虹口区人民政府江湾镇街道办事处2023年8月30日
出租房的乱象,上海市虹口区人民政府广中路街道办事处,2023-08-30,https://xfb.sh.gov.cn/xinfang/yjzj/feedback/feedbackshow?id=15781DB41D2E407DA1D24131AD0F2E1F,出租房的乱象,2023-08-16,"本人反映，出租房的乱象本人认为，2023年5月31日，由于急着需要住房，我签下了怡景大厦一套房屋，从6月1日至12月15日，8月9日通知“房东""退租，而“房东""咄咄逼人说必须按“合同”，此合同无合法性，1:违章建筑，在客厅用三合板隔开空间，过道堆满易燃物品，存在严重消防安全隐患，依据消防安全管理规定，此屋不可以出租，2:程序不合法，签订合同，房东始终未见。本人要求，1·责任部门整改违建；2·退还租金和押金。",2023-08-30,上海市虹口区人民政府广中路街道办事处,告知书刘同志：您好！您于2023年8月16日信访反映“由于急着需要住房，于2023年5月31日签下了怡景大厦一套房屋，8月9日通知房东退租，而其说必须按合同，另外房东在客厅用三合板隔开空间，过道堆满易燃物品，存在严重消防安全隐患，认为此合同无合法性，此屋不可以出租，要求，第一，责任部门整改违建，第二，退还租金和押金。”的事项已收悉。经执法人员现场查看，认定无群租现象，已告知住户半夜保持安静，以免打扰他人造成邻里纠纷。另，针对您提出的要求退还租金和押金之事宜，建议可与合同方自行协商。特此告知。广中路街道办事处2023年8月29日
票务退费事宜,上海市徐汇区消费者权益保护委员会,2023-08-30,https://xfb.sh.gov.cn/xinfang/yjzj/feedback/feedbackshow?id=8C09F57834A44793928CB4C25D65EC97,票务退费事宜,2023-07-19,在摩天轮票务购买演唱会门票，实付2728，要求全额退款。,2023-08-30,上海市徐汇区消费者权益保护委员会,信访事项处理意见书张**同志：您反映的信访事项已受理。经研究，现答复如下：收到信访材料后，我委联系双方了解情况，您已收到退款2079元，经营者表示可以再退还130元服务费，您已知晓。本意见即为最终意见。感谢您对徐汇区消保委工作的关心、理解和支持。上海市徐汇区消费者权益保护委员会2023年8月4日
就近入学问题,上海市徐汇区教育局,2023-08-30,https://xfb.sh.gov.cn/xinfang/yjzj/feedback/feedbackshow?id=4CE2E11523FD4CC3A1F37655E3B03F1D,就近入学问题,2023-08-17,本人反映，我孩子户籍对口上海市徐汇区某小学。本人认为，按就近原则，我们的情况明显是与政策不相符的，应对口距离最近的另一所小学。本人要求，有关部门解决此事。,2023-08-30,上海市徐汇区教育局,信访事项处理意见书刘女士：您反映的信访事项已受理。经研究，现答复如下：经查，教育部办公厅就做好城市义务教育招生入学工作指出：“鉴于一些地方人口分布和学校布局具有不均匀性、街区形状具有不规则性，就近入学并不意味着直线距离最近入学。要充分考虑可能影响公平的各关键要素，确定相对科学的划片规则，确保适龄儿童、少年整体上相对就近入学。片区确定后，应在一段时期内保持相对稳定。”我区坚持以《中华人民共和国义务教育法》和上海市的有关政策法规为依据，根据区域教育布局调整、常住人口的变化，结合义务教育优质均衡发展区创建、公建配套学校建设、紧密型学区集团建设等要求，对本区义务教育事业发展做出整体规划，确保符合条件的适龄儿童接受义务教育。您所在的居委目前实行对口入学，列入上海市徐汇区某小学的招生范围，该校的学额可以满足您所在居委适龄儿童接受义务教育的需求。“十四五”期间，我区将加快义务教育优质均衡发展的步伐，进一步满足居民的教育需求。感谢您对徐汇教育工作的关心、理解和支持。上海市徐汇区教育局2023年8月22日
再生资源回收中转站,上海市徐汇区绿化和市容管理局,2023-08-30,https://xfb.sh.gov.cn/xinfang/yjzj/feedback/feedbackshow?id=E324FE9ABE1744A0A4AA3F50332687A9,再生资源回收中转站,2023-08-21,徐汇区近几年却少再生资源回收站，这导致了再生资源的浪费，环境的污染，以及小区垃圾分类工作人员不能很好的处理各类垃圾，和资源利用最大化。我希望政府重视此事，我是一名从事废品回收十几年的工作者希望能帮美丽徐汇出份力办好此事,2023-08-30,上海市徐汇区绿化和市容管理局,"石**同志：您好！您于2023年8月21日提出的建议事项收悉。目前,徐汇区已搭建11处可回收物中转站、886个服务点，基本满足了居民可回收物交投需求。下一步，我区将按照市绿容局要求、进一步规范和优化站点布局，再次感谢您对徐汇区资源回收事业的关心。特此告知。上海市徐汇区绿化和市容管理局2023年8月24日"
再生资源回收站,上海市徐汇区绿化和市容管理局,2023-08-30,https://xfb.sh.gov.cn/xinfang/yjzj/feedback/feedbackshow?id=7928DB4243CC4C32AB0321554C44F4A9,再生资源回收站,2023-08-19,"本人反映,徐汇区缺少再生资源回收站本人认为,徐汇区可以在政府部门的帮助下多设几个再生资源回收站，这样方便了居民也保护了环境本人要求,希望有关领导重视，我本人也是从业多年的再生资源回收者，我希望能帮社会出一份力",2023-08-30,上海市徐汇区绿化和市容管理局,"简复告知书石**同志：您好！您于2023年8月19日信访反映的事项收悉。目前,徐汇区已搭建11处可回收物中转站、886个服务点，基本满足了居民可回收物交投需求。下一步，我区将按照市绿容局要求、进一步规范和优化站点布局，再次感谢您对徐汇区资源回收事业的关心。特此告知。上海市徐汇区绿化和市容管理局2023年8月24日"
小区门口乱停车现象,上海市徐汇区人民政府斜土路街道办事处,2023-08-30,https://xfb.sh.gov.cn/xinfang/yjzj/feedback/feedbackshow?id=66D5B79645FA4EFBA024D2CE9B935708,小区门口乱停车现象,2023-07-27,本人反映，居住小区门口乱停车现象，而且是整天整天的占用人行通道，本人认为，违规占用人行通道需要管理并贴罚单 本人要求，尽快解决,2023-08-30,上海市徐汇区人民政府斜土路街道办事处,郑**同志：您反映的信访事项已受理。经研究，现答复如下：您反映家住小区门口乱停车占用人行通道现象。要求，尽快解决。经查，您来信反映情况基本属实。街道管理办工作人员安排第三方施工单位在被占停放机动车区域设立隔离路桩，确保行人正常通行。目前，该路段已经消除违章停车（机动车）情况。感谢您对斜土信访工作的关心、理解和支持。上海市徐汇区人民政府斜土路街道办事处2023年8月11日
上海锐赏文化传播有限公司胡乱收取手续费,上海市徐汇区消费者权益保护委员会,2023-08-30,https://xfb.sh.gov.cn/xinfang/yjzj/feedback/feedbackshow?id=A4A93907D2ED4BFC8609FAFF92059209,上海锐赏文化传播有限公司胡乱收取手续费,2023-07-26,本人在上海锐商文化传播有限公司网络平台摩天轮app购买演唱会门票，发现加价严重，于是跟客服沟通于后选择取消订单，但手续费较高。要求全额退款。,2023-08-30,上海市徐汇区消费者权益保护委员会,信访事项处理意见书李*同志：您反映的信访事项已受理。经研究，现答复如下：收到信访材料后，我委联系双方了解情况，您未接听电话，经营者表示同意退订单764元及服务费48元，您可以联系客服办理退费。本意见即为最终意见。感谢您对徐汇区消保委工作的关心、理解和支持。上海市徐汇区消费者权益保护委员会2023年8月7日
票务退费,上海市徐汇区消费者权益保护委员会,2023-08-30,https://xfb.sh.gov.cn/xinfang/yjzj/feedback/feedbackshow?id=9D593EED0E8A48BE9CB8E75B4A1A2E83,票务退费,2023-07-22,购买的演唱会门票，需要退票。,2023-08-30,上海市徐汇区消费者权益保护委员会,陈**同志：您反映的信访事项本机关已受理。经研究，现答复如下：收到信访材料后，我委联系双方了解情况，经营者承诺退款，您已知晓。本意见即为最终意见。感谢您对徐汇区消保委工作的关心、理解和支持。上海市徐汇区消费者权益保护委员会2023年8月7日
票务退款,上海市徐汇区消费者权益保护委员会,2023-08-30,https://xfb.sh.gov.cn/xinfang/yjzj/feedback/feedbackshow?id=CA8CE6DC0FF347C4974B0389588F6C05,票务退款,2023-07-18,购买的演唱会门票，收费不合理严重溢价，需要全额退款。,2023-08-30,上海市徐汇区消费者权益保护委员会,信访事项处理意见书朱**同志：您反映的信访事项已受理。经研究，现答复如下：收到信访材料后，我委联系双方了解情况，您表示已收到退款。本意见即为最终意见。感谢您对徐汇区消保委工作的关心、理解和支持。上海市徐汇区消费者权益保护委员会2023年8月4日
中环和润苑外墙西侧无名小道路灯,上海市杨浦区人民政府定海路街道办事处,2023-08-30,https://xfb.sh.gov.cn/xinfang/yjzj/feedback/feedbackshow?id=C7D19EDAEC05417D93DD941B3091A350,中环和润苑外墙西侧无名小道路灯,2023-08-14,中环和润苑小区西侧大门外有一条无名小道，这条小道有三个路灯不亮，黑灯瞎火给夜间出行带来很大安全隐患 。希望能得到有关部门的落实解决,2023-08-30,上海市杨浦区人民政府定海路街道办事处,***同志：您反映的信访事项本机关已受理。经研究，现答复如下：您反映中环和润苑小区西侧无名小路路灯不亮的事项。经了解，街道相关职能部门接信后立刻安排工作人员对该路段的路灯进行了修复，目前路灯已修好。感谢您对我们工作的关心、理解和支持。上海市杨浦区人民政府定海路街道办事处2023年8月28日
希望改造大整修,上海永业企业(集团)有限公司,2023-08-30,https://xfb.sh.gov.cn/xinfang/yjzj/feedback/feedbackshow?id=2B3F56E2C0EC4AE292EE9F46FE94F579,希望改造大整修,2023-07-12,本人反映前期白蚁横行，房屋主体结构为木质，有松动、掏空的迹象。昨日楼里一邻居地板松动坍塌，险些砸到楼下。望领导重视。本人认为老公房年久失修，白蚁蛀梁，有随时坍塌风险。本人要求立刻改造大整修。,2023-08-30,上海永业企业(集团)有限公司,李某同志：您反映的信访事项本机关已受理。经研究，现答复如下：您反映巨鹿路某弄某号白蚁事宜，认为老房失修有坍塌风险问题，要求解决白蚁虫蛀问题，希望能立即改造大整修。经查：1、我司工作人员于2023年7月18日上门排查白蚁虫蛀情况，该处房屋确实存在有白蚁虫蛀迹象，现场已经对排查出来的虫蛀点进行了加固和防治。经查阅报修记录，之前的居民报修也均对白蚁进行了灭杀及防治工作。2、您所说到的7月11日邻居地板坍塌一事，实际情况为邻居房屋存在有群租现象，擅自在室内安装了卫生设施，并伴有漏水情况，造成了下方木质结构内的腐蚀断裂造成平顶脱落。截止到7月17日该处灶间平顶内木梁、平顶、楼上木地板已经全部维修完毕。群租及擅自搭建卫生设施的行为，也在相关部门的联合整治下，责令其停止了群租、拆除了所有卫生设施。根据排查结果，房屋目前处于稳定的状态。对于您所提出的房屋大整修的诉求，经查阅了大修记录，距上次大修至今已经接近十年，同时小区管理人员对小区内的其他房屋也进行了排摸。综合考虑下，我们会再次向房屋主管部门提出大修申请。感谢您对上海永嘉置业管理有限公司工作的关心、理解和支持。上海永业企业(集团)有限公司2023年8月7日
医院窗口工作人员态度差,上海中医药大学附属龙华医院,2023-08-30,https://xfb.sh.gov.cn/xinfang/yjzj/feedback/feedbackshow?id=37B4C52121B84E24A297C056A4F39422,医院窗口工作人员态度差,2023-08-07,本人反映去上海龙华医院总院看病时，收费窗口工作人员的态度差。本人要求，希望医院对其进行处理，并让该工作人员对我当面道歉。,2023-08-30,上海中医药大学附属龙华医院,卞同志：您反映的信访事项医院已受理。经调查，现答复如下：我院工作人员已与您电话联系，约定待您8月下旬来院复诊时，将安排当事工作人员及负责人向您作解释沟通，感谢您对龙华医院工作的关心、理解和支持。 上海中医药大学附属龙华医院  2023年8月14日
要求加装加装减速带，反光镜,上海市浦东新区川沙新镇人民政府,2023-08-30,https://xfb.sh.gov.cn/xinfang/yjzj/feedback/feedbackshow?id=A4A81EBB83EE493F928EECE7FA1BA096,要求加装加装减速带，反光镜,2023-08-01,尊敬的领导，你们好，北张家宅一组仓库西边的位置存在严重视野盲区(由于电线杆和周围农户的农作物干扰，过往车辆甚至在经过时感觉不到这是个路口，从而不会减速）。为了杜绝路口隐患，所有大路口都设置了转弯的水泥墩子，强制大车右转必停，做的很好，体现了政府心系人民群众。我希望有关部门来实地看看，定期涂写地上的黄色警示字样，加装减速带，反光镜，消除我们牌楼村北张家宅的这个隐患！谢谢！,2023-08-30,上海市浦东新区川沙新镇人民政府,张同志：您于2023年8月1日信访反映的事项收悉。经查，您反映牌楼村北张家宅宅前路口存在安全隐患的问题，该道路为牌楼村1队宅村内道路，此村宅内电瓶车、自行车等出入较多，安装减速带可能对电瓶车等带来安全隐患，且道路紧邻民宅，在夜晚车辆通过会产生震动噪音。为此，针对您反映的问题，会在路口加深警示标线，并做好宣传引导，提醒村民在村宅内道路也需遵守交通规则，提高自身安全意识，路口注意減速慢行。上海市浦东新区川沙新镇人民政府2023年8月8日
共享单车胡乱停放,上海市浦东新区川沙新镇人民政府,2023-08-30,https://xfb.sh.gov.cn/xinfang/yjzj/feedback/feedbackshow?id=A69144BCDA114A30BC25BC6BBD1A4643,共享单车胡乱停放,2023-07-31,"本人反映，上下班高峰期间川沙地铁站附近共享单车随意摆放，造成交通严重拥堵以及安全隐患本人要求,要加强管理以及采取必要的处罚",2023-08-30,上海市浦东新区川沙新镇人民政府,张同志：您反映的信访事项本机关已受理。经研究，现答复如下：经查，在川沙路地铁站附近(华戴路川环南路)确实存在上下班高峰期间路人乱停放共享单车导致道路拥堵的情况。目前，针对以上情况，执法队员已约谈相关的共享单车公司，要求单车公司加大人力物力，加大地铁口共享单车的清运力度。安排第三方清运公司作为补充力量，对地铁口等点位加强巡查并对聚集的单车进行清运。川沙地铁口附近已派执法队员进行共享单车及电瓶车停放的管理及引导，也会加强巡查监管，对于造成拥堵和随意摆放的共享单车及时通知单车公司进行清运，保障路面畅通。上海市浦东新区川沙新镇人民政府2023年8月9日
关于加建人行上桥通道的建议,上海市浦东新区川沙新镇人民政府,2023-08-30,https://xfb.sh.gov.cn/xinfang/yjzj/feedback/feedbackshow?id=0F708B28261C4E97A9D701B17265E613,关于加建人行上桥通道的建议,2023-07-19,春桐路东端规划为断头路，春桐路与华东路川杨河桥之间规划为绿化带，春桐路与华东路川杨河桥落差约3米；因此，居民沿着春桐路往东无法步行到达华东路。本人建议，恳请政府考虑新建台阶或坡道等方式打通春桐路与华东路川杨河桥的步行连接，这样将极大的方便附近所有居民出行。除了方便居民，也方便幼儿园和中学的孩子上学。,2023-08-30,上海市浦东新区川沙新镇人民政府,杨同志：您反映的信访事项本机关已受理。经研究，现答复如下：经查，您所购在建商品房的配套道路为春桐路，因该道路连接的华东路土地性质为集体土地，根据相关规定目前不能建设通道，待建设华东路绿带时，我镇将协调区环保局一并予以解决，以方便居民出行。上海市浦东新区川沙新镇人民政府2023年8月8日
关于老旧小区新能源汽车充电,上海市浦东新区高桥镇人民政府,2023-08-30,https://xfb.sh.gov.cn/xinfang/yjzj/feedback/feedbackshow?id=DCFFB8EFCADF47ED9479B35C9676BC21,关于老旧小区新能源汽车充电,2023-07-28,  尊敬的领导同志，给您来信是想有个小建议，往您百忙中能抽个时间看一下。  关于老旧小区新能源充电桩建设建议，我希望在发展新能源汽车的同时，多发展一下配套的设施，比如老旧小区，能否在小区电力设备承受的情况下，装一部分，一部分可以1/2/3台或者更多，在承受的范围内建设一部分就可以。  当然可能有些事情是我这个位置或出发点想不到的，但是我觉得我有义务和责任在我能看到的前提下，提一下意见。  最后感谢百忙之中的您能看到我的建议。谢谢！,2023-08-30,上海市浦东新区高桥镇人民政府,邢同志：您于2023年7月28日信访反映的事项收悉。经了解，根据《上海市电动汽车充电设施建设管理暂行规定》第十九条：电动汽车用户在住宅小区有自有产权车位，或经车位产权人同意，在租赁期一年（含）以上的固定车位上安装充电设施的，物业服务企业应当予以支持和配合。目前老旧小区硬件配套设施不足，且小区车位产权属于全体业主共有，业主申请安装自建桩需召开业主大会投票决定，难度非常大。针对您提出的建议，结合相关的政策法规，根据老旧小区的实际情况，相关属地居委将会同物业、业委会商讨老小区公建桩建设（利用一部分全体业主共有停车位建设的，供全体业主共同使用的共享充电桩）的可行性，逐步排摸推进。特此告知。上海市浦东新区高桥镇人民政府2023年8月10日
关于商业配套设施问题,上海市浦东新区高桥镇人民政府,2023-08-30,https://xfb.sh.gov.cn/xinfang/yjzj/feedback/feedbackshow?id=C02150BF579545F7A25A878E57447753,关于商业配套设施问题,2023-07-25,"本人反映,靠近双江路地铁站周边的5个较大的回迁房小区，迎来了巨大的市区人流，原来配置的商业服务设施已经无法满足周边居民的生活需求。本人认为,可以适当增加周边商业配套设施的建设，满足周边居民的基本生活需求。本人要求,考虑凌桥居民的生活便利性，优化凌桥社区的规划用地的合理性，适当开发商业配套服务设施。",2023-08-30,上海市浦东新区高桥镇人民政府,阮同志：您信访反映的事项，我镇已收悉。现答复如下：经了解，你信访反映的地块已列入浦东新区土地储备项目，目前正在按照程序进行地块情况摸底等收储前期工作，待收储完成后进行后续开发建设。感谢您对党委、政府工作的支持和理解。上海市浦东新区高桥镇人民政府2023年8月9日
关于加建人行上桥通道的建议,上海市浦东新区川沙新镇人民政府,2023-08-30,https://xfb.sh.gov.cn/xinfang/yjzj/feedback/feedbackshow?id=1505171983D447FEA8FC40D230BA9273,关于加建人行上桥通道的建议,2023-07-19,本人反映：目前川沙镇北部川杨河北岸沿河目前正规划建设（西起顾唐路，东至华东路），工程名称为“春桐路，春桐路东端规划为断头路，春桐路与华东路川杨河桥之间规划为绿化带，春桐路与华东路川杨河桥落差约3米；居民沿着春桐路往东无法步行到达华东路。本人建议，恳请政府考虑新建台阶或坡道等方式打通春桐路与华东路川杨河桥的步行连接，这样将极大的方便附近所有居民出行。除了方便居民，也方便幼儿园和中学的孩子上学。,2023-08-30,上海市浦东新区川沙新镇人民政府,姚同志：您反映的信访事项本机关已受理。经研究，现答复如下：经查，您所购在建商品房的配套道路为春桐路，因该道路连接的华东路土地性质为集体土地，根据相关规定目前不能建设通道，待建设华东路绿带时，我镇将协调区环保局一并予以解决，以方便居民出行。上海市浦东新区川沙新镇人民政府2023年8月8日
