title,agency,date,links,标题,来信日期,信件内容,回复日期,回复单位,回复内容
安装充电桩,上海市闵行区虹桥镇人民政府,2023-09-01,https://xfb.sh.gov.cn/xinfang/yjzj/feedback/feedbackshow?id=4EC8D199D06C42869C7405132D743993,安装充电桩,2023-08-10,本人是闵行区天鸿公寓的业主，在购买天鸿公寓房屋后，希望能让新能源车安装充电桩。在找物业的过程，物业告知地库是开发商的，开发商不同意我们谁都没有权。最后如果不能安装请物业或者开发商告知原因，告知到底是什么原因，谁不同意安装充电桩，如果有原因那么是否有解决方案？是否能推动解决？是否能真正的为人民服务而不是呵斥业主，威吓业主。希望帮助广大业主解决问题。,2023-09-01,上海市闵行区虹桥镇人民政府,韩同志：2023年8月10日，您发送邮件至《市委领导信箱》，反映天鸿公寓地下车库权责不清，物业阻碍安装新能源车充电桩且态度蛮横，要求告知不能安装新能源车充电桩的具体原因并且推动解决安装新能源车充电桩的事项，我单位已收悉，现告知如下：经我镇房管所向天鸿公寓小区物业管理单位上海铭寰物业公司进行了解，天鸿公寓地下车库产权为开发商上海天鸿房地产开发公司所有。截至目前，天鸿公寓地下车库未有安装新能源车充电桩的情况，上海天鸿房地产开发公司告知地下车库用电总容量仅供原始规划设计的地下车库用电设备所使用，现地下车库用电容量无法满足增加用电设备，故目前尚无法满足业主加装新能源车充电桩的需求。我镇房管所已将相关情况告知天鸿公寓业委会和金虹大厦居委会，建议业委会、居委会充分考虑业主诉求，通过多方沟通制定解决方案，您也可以直接向业委会、居委会提出相关意见建议。您反映物业工作人员态度很差的事项，我镇房管所已督促该物业加强对人员的教育培训，增强服务意识。特此告知。
物业问题,上海市闵行区梅陇镇人民政府,2023-09-01,https://xfb.sh.gov.cn/xinfang/yjzj/feedback/feedbackshow?id=C970DE1466DA464BB41EEC0FD6F17A0D,物业问题,2023-07-07,"本人反映,小区物业公司强占马路私修停车场，小区门禁强制本小区住户强制录人脸识别，不录人脸信息不给进小区。本人认为,该小区物业该行为已经违法，望领导体谅民生给予解决问题。",2023-09-01,上海市闵行区梅陇镇人民政府,马同志：您反映的小区物业公司管理等信访事项已受理。现答复如下：关于小区进出使用人脸识别的问题。经了解，为保障小区居民安全和整治群租等需要，根据村规民约的约定，从7月1日起，实施人脸识别的出入方式，希望小区居民积极配合，如有特殊情况可以与物业协商解决。另，关于物业占马路私建停车场的问题。经了解，为整治关于违法停车和偷倒建筑垃圾等行为需要，目前该路段作为村物业延伸段管理。感谢您的理解支持和配合！特此答复。
业委会改选,上海市闵行区七宝镇人民政府,2023-09-01,https://xfb.sh.gov.cn/xinfang/yjzj/feedback/feedbackshow?id=3FCEFB00E11A4D1184EECA1630BAF994,业委会改选,2023-08-07,万兆家园小区的业委会换届工作，改选小组已经于2023年7月17日投票公布，然而，新入选的业主至今尚未进入改选小组公布名单，也未能够进入改选小组工作，未开展任何工作，据说是正在进行资格审查，还有老业委会未入选改选小组的人到居民家里进行胡乱考察，不知道想干什么，拖拉不作为。严重耽误业委会的换届工作进度，要求老业委会尽早退出工作，由改选小组成员开展换届工作。,2023-09-01,上海市闵行区七宝镇人民政府,薛同志：你于2023年8月7日写给区信访办的网上信访件（编号：网[2023]000192xxx）已转至七宝镇。你反映：万兆家园（南区）业委会换届工作程序拖沓，现要求尽快开展换届工作的问题。经本机关调查了解，现答复如下:关于你信访反映的问题，经了解，2023年7月7日，万兆家园（南区）居委会已通过微信公众号、楼道微信群等，发布了“上海市闵行区万兆家园（南区）业主委员会换届改选小组中业主代表产生方式公告；7月17日，开箱统计结果产生业主代表候选人；7月30日，按照相关流程及投票数高低，综合执法队及第三方检测公司，依次对换届改选小组中的业主代表人员进行资格认定。目前，小区居委会已将《换届改选小组成员名单的公示》张贴于小区公示栏内，根据该公示，于8月21日之前听取业主反馈意见。同时，镇房管所、社区办、居委会将根据相关法律法规对该小区业委会换届改选工作的监督和指导下有序进行，确保小区全体业主的切身利益。特此告知。
公交延伸建议,上海市闵行区交通委员会,2023-09-01,https://xfb.sh.gov.cn/xinfang/yjzj/feedback/feedbackshow?id=0E52517C4FF5472E8B10CC04E903ADE9,公交延伸建议,2023-08-16,我家住浦江镇浦江宝邸125弄，离浦江二小浦涛路校区直线距离2公里，平时只能电瓶车接送孩子上下学，为了解决极端天气下孩子的送行问题。我也曾经咨询过交通委该问题，交通委的同志研究了一天，建议我们坐浦江9路B线，且不说这个公交站台离我家1公里（已经完成去学校的一半路程），步行到公交站台也需要20分钟，而且这趟公交车绕路，车程要20分以上，况且浦江9路B线30分钟才发一趟车，极端天气下想去2公里之外的二小，至少花费50分钟以上的时间才能去学校，确实不是一个很好的公交方案。目前浦江15路终点站到浦连路汇驰路，只需要延长一站即可到浦江二小浦涛路校区，就可以解决该问题，同时也可以尽量少的调整公交线路，又不影响现有的路线，希望政府帮忙想出一个好的办法来解决孩子的接送问题。,2023-09-01,上海市闵行区交通委员会,钱同志：    关于您反映“小区离浦江二小浦涛路校区直线距离2公里，建议政府帮忙想出一个好的办法来解决孩子的接送问题”的诉求我委于2023年8月17日受理。经核实，结合浦江镇教育部门的要求，区交通管理部门专门开通了浦江9路B线，更好地保障浦江二小浦涛路校区学生上下学的出行需求。目前，市民可在小区门口（浦江宝邸站）乘坐浦江15路至（江文路召楼路站）同站换乘浦江9路B线到达浦江二小。您的建议已记录备案，现阶段，公交资源尚属于有限资源，主要功能是保障广大市民的基本出行需求。受制于政府财政保障、道路状况、交通组织、司售人员等的有限性和局限性，无法做到点对点的开通或调整线路。我们将统筹考虑道路状况、交通组织等多方面的因素，尽可能用有限的公交资源服务好最广大群众的基本出行需求。特此告知。
建议徐汇区康健园内部维修拆除围墙,上海市徐汇区绿化和市容管理局,2023-09-01,https://xfb.sh.gov.cn/xinfang/yjzj/feedback/feedbackshow?id=C822ADE5471E4AEBB42D998E417AA0D0,建议徐汇区康健园内部维修拆除围墙,2023-08-28,康健园是一座历史悠久的公园了，但公园内部设计已经不符合居民现代生活了。1.公园内部无集中儿童无动力游玩设施，全部都是收费，公益性很差。2.关闭时间早，开放时间晚，无法满足周边居民使用。3.灯光昏暗。建议:1.围墙打开，24小时开放，照明整修。撤掉门卫，减小日常运维成本。2.内部增加儿童恭喜无动力设施。周围儿童日常茶余饭后的活动和互动空间。3.公园周围都是老破小，邻里几乎没有互动空间，建议能尽快实施。,2023-09-01,上海市徐汇区绿化和市容管理局,张**同志：您反映的信访事项本机关已受理。经研究，现答复如下：您建议康健园围墙打开、24小时开放、增加儿童游乐设施等内容。本机关认为，康健园拟定于2024年进行提升改造，项目主要涉及沿冠生园路一侧围墙打开，增加夜间照明和监控系统，实现24小时开放；针对儿童游乐设施，调整现有的游乐项目，增加无动力、免费的游乐设施；公园改造将会根据周边居民群众的使用要求和生活习惯，重新划分功能区域，进一步合理布局，满足群众需求。感谢您对绿化市容工作的关心、理解和支持。上海市徐汇区绿化和市容管理局2023年8月29日
孩子入园问题,上海市嘉定区江桥镇人民政府,2023-09-01,https://xfb.sh.gov.cn/xinfang/yjzj/feedback/feedbackshow?id=3E0DAF7582DF4B40A5C41971D0F8EB18,孩子入园问题,2023-08-08,来信反映其孩子无法就读幼儿园问题，求处。,2023-09-01,上海市嘉定区江桥镇人民政府,吕同志：您信访反映的事项，已收悉。现将有关情况回复如下：经了解，镇教委已告知您可于明年申请插班转园，您表示知悉。建议您关注相关报名信息，及时办理插班转园申请。特此函复。上海市嘉定区江桥镇人民政府2023年8月9日
小区绿化带内有很多白色垃圾,上海市嘉定区菊园新区管理委员会,2023-09-01,https://xfb.sh.gov.cn/xinfang/yjzj/feedback/feedbackshow?id=C6DB9465F2BB4833B49156FFAA6AD5D0,小区绿化带内有很多白色垃圾,2023-08-10,本人反映小区绿化带内有很多白色垃圾，希望及时清理。,2023-09-01,上海市嘉定区菊园新区管理委员会,刘同志：您反映的信访事项已受理。经研究，现答复如下：经嘉盛居委会核处，与物业公司沟通，已安排保洁部门工作人员对小区绿化带进行清理。同时，居委要求物业公司后续加强日常巡查，并及时做好清理工作。感谢您对我们工作的理解和支持。嘉定区菊园新区管理委员会2023年8月11日
医保卡被停用,杨浦区医疗保障局,2023-08-31,https://xfb.sh.gov.cn/xinfang/yjzj/feedback/feedbackshow?id=D5A4E088BC534CC1A6FB2A4AF45AF141,医保卡被停用,2023-07-18,本人七月十七日去医院就医，被告知医保卡被停用，但本人未收到过任何通知，于是前往兰州路杨浦区医保事务中心进行申诉，工作人员告知因药配太多了，本人要求立即恢复医保卡正常使用。,2023-08-31,杨浦区医疗保障局,***同志：您反映的信访事项本机关已受理。经核实，现答复如下：经查：2023年6月25日，市医疗保障局监督检查所向参保人发出门急诊就诊和医疗费用异常审核告知书，收件地址为上海市虹口区***。在参保人未完成审核的情况下，市医疗保障局监督检查所于7月6日改变其医保卡门急诊医疗费用结算方式。参保人于7月17日赴医院就诊时被告知医保卡结算方式改变，同日赴我局后工作人员告知需携带相关材料接受审核。7月18日参保人再次赴我局，经审核个别药品存在超量配药。鉴于参保人系首次审核，未发现恶意骗保证据，且审核时段涉及疫情防治特殊时期，我局于7月21日将审核情况提交市医疗保障局监督检查所，同日市医疗保障局监督检查所已恢复您医保卡实时结算方式。感谢您对我们工作的理解和支持。杨浦区医疗保障局2023年8月23日
个人开个文具店需要什么条件，请指导，有灵活就业补贴吗，想了解,上海市杨浦区人力资源和社会保障局,2023-08-31,https://xfb.sh.gov.cn/xinfang/yjzj/feedback/feedbackshow?id=C680D32466D14F5BB0C083582F553B43,个人开个文具店需要什么条件，请指导，有灵活就业补贴吗，想了解,2023-08-19,个人开个文具店需要什么条件，请指导，有灵活就业补贴吗，想了解一下，怎么申请呢？,2023-08-31,上海市杨浦区人力资源和社会保障局,***同志：您好！您于2023年8月19日信访咨询的事项收悉，现回复如下：具有本市常住户籍，认定为市就业困难人员，并办理灵活就业登记备案手续的人员可以申请“就业困难人员”灵活就业社会保险费补贴，具体受理部门为街道社区事务受理服务中心。如需了解创业补贴申请事宜，可以关注“海纳百创”微信公众号的“创资讯”中的“创政策”栏目。特此告知。上海市杨浦区人力资源和社会保障局2023年8月30日
关于在建商务楼侵犯住户隐私权投诉,上海市规划和自然资源局,2023-08-31,https://xfb.sh.gov.cn/xinfang/yjzj/feedback/feedbackshow?id=7FED90BB344A4789836B549E8335A9AD,关于在建商务楼侵犯住户隐私权投诉,2023-08-16,"本人反映,浦东新区昌邑路607弄北边空地在建商务楼外墙系全玻璃幕墙，由于距离7号楼太近，建成后住户个人隐私不受保护。本人认为,商务楼设计及建造应充分考虑周边居民的生活权益。本人要求,在玻璃外墙加装隐私防护措施避免居民家中被窥视。",2023-08-31,上海市规划和自然资源局,信访事项答复意见书汤*同志：您反映“浦东新区昌邑路607弄北边空地在建商务楼外墙系全玻璃幕墙，由于距离7号楼太近，建成后住户个人隐私不受保护”的信访事项已受理。经研究，现答复如下：经查，浦东新区昌邑路607弄与北面拟建建筑间距为35米多，远大于技术规定要求的24米。该项目已通过专业部门出具的玻璃幕墙广反射影响分析报告。感谢您对规划资源工作的关心、理解和支持。上海市规划和自然资源局2023年8月30日
请求出具查阅沪土（86）征批字第88号档案的相关证明,上海市规划和自然资源局,2023-08-31,https://xfb.sh.gov.cn/xinfang/yjzj/feedback/feedbackshow?id=A1768DD39CA14345B067F9EC463DA984,请求出具查阅沪土（86）征批字第88号档案的相关证明,2023-08-15,"根据上海市城建档案馆档案调阅利用规定，各部门经过会议及经过多方沟通，答复为通过信访途径提出申请以获取档案查阅的相关证明。本人要求,请求贵局出具同意查阅沪土（86）征批字第88号档案的相关证明。",2023-08-31,上海市规划和自然资源局,信访事项答复意见书宋**同志：您反映的信访事项已受理。经研究，现答复如下：经核，同意您查阅沪土（86）征批字第88号文件，您可凭此信访答复意见书及身份证明至上海市城建档案馆（长宁区宋园路16号）查询。感谢您对规划资源工作的关心、理解和支持。上海市规划和自然资源局2023年8月24日
毕业生进沪就业工作,上海市教育委员会,2023-08-31,https://xfb.sh.gov.cn/xinfang/yjzj/feedback/feedbackshow?id=036DB8FBAD31427A90405194284811B3,毕业生进沪就业工作,2023-07-11,咨询签约“中介机构的正式员工”是否可以申请落户。,2023-08-31,上海市教育委员会,信访事项处理意见书网民：         您好！         您反映的信访事项已受理。经研究，现答复如下：         经市人社局认定的本市优质人力资源服务机构，其自招的人员经承诺后，可纳入本市非上海生源普通高校应届毕业生落户受理范围。         感谢您对我们工作的关心、理解与支持。                                                                                                             上海市教育委员会                                                                                                                  2023年8月4日
关于小区停车的建议,上海市静安区人民政府彭浦新村街道办事处,2023-08-31,https://xfb.sh.gov.cn/xinfang/yjzj/feedback/feedbackshow?id=886F497D422B45BBA52ED662635B1632,关于小区停车的建议,2023-08-15,本人向物业申请停车位未果，建议小区晚上的空余车位可以合理安排，满足租户的停车需求。,2023-08-31,上海市静安区人民政府彭浦新村街道办事处,居民同志：您好！停车难问题是当前老旧小区面临的普遍问题。经了解，您所在小区对除已享受包月停车的居民车辆以外，实行临时停车收费标准。为缓解小区停车难问题，小区居委会、业委会及物业公司也在积极研究进一步优化小区停车方案。感谢您对党和政府工作的关心、理解和支持。 
酒水仓库扰民问题,上海市静安区人民政府芷江西路街道办事处,2023-08-31,https://xfb.sh.gov.cn/xinfang/yjzj/feedback/feedbackshow?id=AE4C36715E504FEAA8ADE0B6C24EB4EA,酒水仓库扰民问题,2023-08-19,本人反映，小区内的酒水仓库占用公道，将酒水乱放，既占道路，工人的说话声玻璃瓶的碰撞噪音不断。本人要求消除扰民的情况。,2023-08-31,上海市静安区人民政府芷江西路街道办事处,孙霞同志：您反映的信访事项本机关已受理。经研究，现答复如下：收到您的信访件，我单位立即将情况与辖区居委会进行沟通核实。居委会工作人员就该事项与酒水仓库负责人已进行宣传协商沟通，要求他们不得占用公道，仓库工人夜间不要噪音扰民。之后，工作人员上门和您进行了沟通、解释并得到您的理解。感谢您对党和政府工作的关心、理解和支持。上海市静安区人民政府芷江西路街道办事处2023年8月29日
关于拖欠工资问题,上海市浦东新区康桥镇人民政府,2023-08-31,https://xfb.sh.gov.cn/xinfang/yjzj/feedback/feedbackshow?id=E1BE341ECE044E00AF1EA0D88ECD5FC9,关于拖欠工资问题,2023-06-03,"本人反映,2022年7月份工作结束后剩余工钱多次讨要，都以不会少你工钱进行拖欠至今。本人认为,公司已恶意拖欠。本人要求,公司立即支付剩余工钱。",2023-08-31,上海市浦东新区康桥镇人民政府,信访事项处理意见书李同志：您好！您信访反映“公司拖欠装修工资”的事项收悉。经了解，我镇相关部门已联系该公司，经沟通协调，该公司承诺于10月31日支付剩余工资。同时我镇相关部门于7月31日与您联系沟通，您表示已知悉。特此回复。上海市浦东新区康桥镇人民政府2023年7月31日
关于人才公寓问题,上海市金山区住房保障和房屋管理局,2023-08-31,https://xfb.sh.gov.cn/xinfang/yjzj/feedback/feedbackshow?id=7C30DD5FB3FD4E99A59274EA98FED15D,关于人才公寓问题,2023-08-16,反映金山区朱泾镇没有配套人才公寓，可租的房屋太少且过于破旧，希望领导予以重视。,2023-08-31,上海市金山区住房保障和房屋管理局,周同志：      您好！您反映的信访事项已受理。经研究，现答复如下：      经查，目前朱泾镇已供应公租房为朱泾名园项目，共计25套房源，优先用作人才公寓，计划2024年供应水尚华庭公租房项目，共计22套房源，优先满足人才住房需求，后续也将推出更多的配建公租房项目，满足各类人才住房需求，推动职住平衡。     感谢您对住房保障和房屋管理工作的关注。
关于公交站点设置问题,上海市金山区交通委员会,2023-08-31,https://xfb.sh.gov.cn/xinfang/yjzj/feedback/feedbackshow?id=E08D0832A6D44A6E926F6053A2BDEBAA,关于公交站点设置问题,2023-08-09,反映金山205公交改成金山中部环线后，医院门口没有设置公交站点（缺失站点车棚），好多医院看病的病人直接在路口等车，碰到下雨天非常不便。,2023-08-31,上海市金山区交通委员会,吴同志：      您好，您来信反映的信访事项我委已受理。经研究，现答复如下：      收到来信后，我委相关部门即联系属地政府、相关公交企业前往现场勘查。因金山中部环线（原205路）首末站进行了调整，公卫中心站由首末站调整为途经站，临时停靠点设置在柘东路上。针对您提到的医院门口缺失候车亭的问题，下阶段我们将把原候车亭移至申康二路柘东路以北50米处，方便医院门口上下车的市民，改善市民候车环境。      感谢您对金山交通工作的关心、理解和支持。
配套道路车道划分不合理,上海市宝山区住房保障和房屋管理局,2023-08-31,https://xfb.sh.gov.cn/xinfang/yjzj/feedback/feedbackshow?id=853C2CBE944F4D4BB63C0587AB9E4B9E,配套道路车道划分不合理,2023-07-16,反映宝山区联谊路新建道路车道划分不合理，车道实际划分为左拐单独车道，直行及右拐一条车道，导致大量右拐车辆被堵，明显不合理。建议车道应如此划分，左拐+直行一条车道，右拐一条车道。,2023-08-31,上海市宝山区住房保障和房屋管理局,梁同志：您于2023年7月16日致信反映宝山区联谊路新建道路车道划分不合理的来信已收悉，现答复如下：经施工单位现场踏勘，您反映的情况属实，目前已进行划线修改。特此回复上海市宝山区住房保障和房屋管理局          2023年8月23日
关于楼道堆物,上海市宝山区月浦镇人民政府,2023-08-31,https://xfb.sh.gov.cn/xinfang/yjzj/feedback/feedbackshow?id=05839AE2C32C414FA3E612A2C0547AF1,关于楼道堆物,2023-08-22,反映中冶尚园33号1101室门口长期堆放杂物，要求有关部门处理。,2023-08-31,上海市宝山区月浦镇人民政府,林倩霞：您好！您于2023年8月22日致信反映中冶尚园33号1101室门口堆物问题的事项收悉。经了解，中冶尚园居委、小区物业人员在8月23日已上门处置，并对住户进行文明宣传，现问题已解决。特此告知。上海市宝山区月浦镇人民政府2023年8月25日
关于高境镇共康路向东过共和新路后的马路段缺乏日常维护的问题,上海市宝山区高境镇人民政府,2023-08-31,https://xfb.sh.gov.cn/xinfang/yjzj/feedback/feedbackshow?id=5C3C9CFDD11342459CE6EE8B72E980D2,关于高境镇共康路向东过共和新路后的马路段缺乏日常维护的问题,2023-08-17,反映宝山区高境镇的共康路向东过共和新路后的马路段缺乏日常维护，车辆经过高低不平。要求相关部门给予修缮。,2023-08-31,上海市宝山区高境镇人民政府,唐杰：您于2023年8月17日反映宝山区高境镇的共康路向东过共和新路后的马路段缺乏日常维护，车辆经过高低不平，要求相关部门给予修缮的来信收悉。经研究，现答复如下：我镇已及时安排施工人员对该路段坑洼的地方进行修补，并对两边的护柱进行了维护。特此回复。 上海市宝山区高境镇人民政府                                                               2023年8月24日
