title,agency,date,links,标题,来信日期,信件内容,回复日期,回复单位,回复内容
景平苑小区前往嘉定江桥万达、普陀桃浦新村等地公共交通出行不便,上海市道路运输管理局,2023-10-10,https://xfb.sh.gov.cn/xinfang/yjzj/feedback/feedbackshow?id=21BD4F6150BD4C789207FD028583CC33,景平苑小区前往嘉定江桥万达、普陀桃浦新村等地公共交通出行不便,2023-08-28,"本人反映, 景平苑小区前往嘉定江桥万达、普陀桃浦新村等地公共交通出行不便本人认为,应当开设一条连通华漕景平苑小区附近途径嘉定江桥万达，至嘉定江桥区块或者普陀桃浦区块的公交线路，有助于居民上下班出行，沿途途径地铁站及大商场地块，也能带动路途较远的工作路线，更能促进日常生活消费，提升区和区，小区和商场之间的联动性，提高居民生活质量，增强生活幸福指数。本人要求,增设的公交线路，首班车时间为早5:30左右，末班车时间为晚22:30左右，有利于扩大出行的选择性，带动居民乘车。",2023-10-10,上海市道路运输管理局,郁同志：  您好！您关于公交行业的来信已收悉，经研究，现将处理意见答复如下：  根据本市公交线网优化调整相关规定，本市公交线路走向调整和站点迁移，需纳入公交线路线网调整计划，通过前期调研、相关部门会商、网上公示征询意见等流程，最终确定优化方案并实施。  您的建议我们将留作参考，在后续线网优化工作中，根据客流、道路等情况作统筹考虑。  感谢您对本市道路运输行业的关心和支持！                             上海市道路运输管理局                                    2023年9月18日
公交978问题,上海市道路运输管理局,2023-10-10,https://xfb.sh.gov.cn/xinfang/yjzj/feedback/feedbackshow?id=C1FE22119D5C4E9B99B66A5BD329801C,公交978问题,2023-08-28,"本人反映,公交车978改路线问题。本人认为,978改路线后我们这里一辆公交车都没了，对老百姓出门都不方便了。公交“村村通”铺就村民幸福路。不能只是喊口号！本人要求,恢复公交978的公交站点。",2023-10-10,上海市道路运输管理局,周同志：  您好！您关于公交行业的来信已收悉，经研究，现将处理意见答复如下：  根据公交线网计划网上公示内容，公交978路调整后将行驶三林路、长清路、凌兆路、济阳路回原线。此次调整可便于相关乘客同站换乘浦东37路，同时公交978路将在凌兆路济阳路口双向设置公交中途停靠站，满足市民换乘轨道交通8号线的需求。  感谢您对本市道路运输行业的关心和支持。                                 上海市道路运输管理局                                        2023年9月12日
本人报名驾校，突然和我说倒闭了,上海市道路运输管理局,2023-10-10,https://xfb.sh.gov.cn/xinfang/yjzj/feedback/feedbackshow?id=52267689DE6D48DC8411C63A9328DAA4,本人报名驾校，突然和我说倒闭了,2023-09-06,本人在上海福龙驾驶员培训有限公司这边花了4580学习驾照，合同也有，但是目前联系不到对方公司（上海福龙驾驶员培训有限公司），9月5日收到消息对方拖欠教练工资以后不能学习，我就打电话给教练，教练说此公司倒闭了，我也不能预约学习驾照！本人随后联系负责人和客服，一直联系不到。目前的情况是无法学习驾照也联系不到他们公司人！退款也不能退。在大上海发生这种事情，我也是醉了。,2023-10-10,上海市道路运输管理局,徐同志：  您好！您关于驾培行业的来信已收悉，经研究，现将处理意见答复如下：  经查，您因对驾校教学进度有异议而进行投诉。接到来信后我们高度重视，第一时间联系驾校沟通核实。目前，驾校已为您安排教练继续学车。  感谢您对本市道路运输行业的理解和支持。                      上海市道路运输管理局                              2023年9月22日
关于人行道非机动车停车位划线的建议,上海市道路运输管理局,2023-10-10,https://xfb.sh.gov.cn/xinfang/yjzj/feedback/feedbackshow?id=C600C4B21EB9488FBBD10D7034FFE210,关于人行道非机动车停车位划线的建议,2023-09-07,在本市中心城区，很多人行道比较窄，我所看到的人行道上非机动车停车位一般都是简单的划一下长方型，造成多数车辆都是并排停放，车辆超出划线三分之一左右，因此，给行人行走带来不便，(特别是面对面交换）。为此建议:在有些人行道已经很窄的情况下，采用斜线划每辆车的停车位，促使骑车人自觉按斜杠格子停在划线内，改变目前一律长方型划法，造成行人行走，轮椅车推行不方便的状况。,2023-10-10,上海市道路运输管理局,胡同志：  您好！您关于停车行业的来信已收悉，经研究，现将处理意见答复如下：  根据《上海市非机动车安全管理条例》第二十四条规定：“区人民政府应当根据非机动车道路停放点设置规范，编制本区非机动车道路停放点的设置规划，指定专门管理部门落实非机动车道路停放点的设置工作，并组建专门管理队伍，加强非机动车道路停放点的日常管理。”  本市交通、道路运输部门积极发挥行业指导的作用，于2021年制定发布了《上海市慢行交通规划设计导则》，指导各区以慢行交通规划设计导则为指引，以需求为导向，因地制宜做好非机动车停放设施设置工作，统筹考虑停放设施的便捷度与舒适度等需求，更好的为市民出行提供服务。  下一步，市区管理部门将依照《上海市城市道路管理条例》、《上海市非机动车安全管理条例》等地方性法规和政府规章，根据自己的职责分工规范落实人行道上的非机动车停放点设置工作，切实提升人行道的行走畅通与安全。  感谢您对本市道路运输行业的关心和支持。                            上海市道路运输管理局                                 2023年9月14日
23路公交车 间隔时间过久,上海市道路运输管理局,2023-10-10,https://xfb.sh.gov.cn/xinfang/yjzj/feedback/feedbackshow?id=61539203382C4B12B1E87130B91F2B8A,23路公交车 间隔时间过久,2023-08-28,本人反映，23路公交车，间隔时间过久，每辆车次有20分钟的时间，不方便市民出行。本人认为，现在坐公交车，都是老年人居多，让老年人在公交车车站苦等一辆公交车20分钟，实在过久。本人要求，适当缩短23路公交车间隔时间，确保市民正常出行，谢谢市局领导,2023-10-10,上海市道路运输管理局,任同志：  您好！您关于公交行业的来信已收悉，经研究，现将处理意见答复如下：  经核实，您反映的公交23路，核定配车25辆，实际出车25辆，高峰时段间隔4-8分钟，低谷时段间隔14-20分钟，符合行业标准。后续，管理部门将督促线路所属公交企业科学调度，均衡班次间隔，满足市民出行需求。  感谢您对本市道路运输行业的关心和支持。                                 上海市道路运输管理局                                       2023年9月12日
驾校突然倒闭,上海市道路运输管理局,2023-10-10,https://xfb.sh.gov.cn/xinfang/yjzj/feedback/feedbackshow?id=02FEB614D3D44E16AEFDAA3D2CB3DB6E,驾校突然倒闭,2023-09-04,"本人反映,您好，我前段时间报了一家驾校［上海福龙驾驶员培训有限公司］我在9.4日得到了该驾校已经卷钱跑路的消息，目前大量学员和教练都联系不到相关负责人，也没有收到相应的处理通知，所有地址都已经人去楼空了本人认为,该公司收了数百名学员的报名费但是突然消失是有诈骗嫌疑的本人要求,目前报警和投诉也均没有任何处理消息，不知道这里是否有办法能帮助到我们",2023-10-10,上海市道路运输管理局,程同志：  您好！您关于驾培行业的来信已收悉，经研究，现将处理意见答复如下：  经查，您因对驾校教学进度有异议而进行投诉。接到来信后我们高度重视，第一时间联系驾校沟通核实。目前，驾校已为您安排教练继续学车。  感谢您对本市道路运输行业的关心和支持！                                上海市道路运输管理局                                     2023年9月21日
S2迪斯尼辅路段路面病害严重，危及行车安全,上海市道路运输管理局,2023-10-10,https://xfb.sh.gov.cn/xinfang/yjzj/feedback/feedbackshow?id=71D4E2F20AB94AAFBA1A518FA58E5D89,S2迪斯尼辅路段路面病害严重，危及行车安全,2023-08-25,本人反映，S2市区向临港方向迪斯尼辅路段地面数个凹陷大坑，路面病害严重。本人认为，为减少交通事故及保证行车，同时为前往迪斯尼和临港方向的旅客一个较安全的行车体验，需对该段辅路进行修整或二次沥青摊铺。本人要求，尽快修复该路段路面，保证安全与顺利通行。,2023-10-10,上海市道路运输管理局,张同志：  您好！您关于路政行业的来信已收悉，经研究，现将处理意见答复如下：  经核实，您反映的情况基本属实。路段管养单位已对相关点位进行应急维修，后续将采用热沥青进行常规修补。承办部门通过电话已反馈相关情况，您表示知晓。  感谢您对本市道路运输行业的关心和支持。                                    上海市道路运输管理局                                           2023年9月12日
表扬公交巴士二公司及古美环线,上海市道路运输管理局,2023-10-10,https://xfb.sh.gov.cn/xinfang/yjzj/feedback/feedbackshow?id=110215E5AED7458194C5B7014F239F44,表扬公交巴士二公司及古美环线,2023-09-11,9月11日16:40许搭乘公交古美环线和嘉公寓站上；古美路古龙路站下。由于下车匆忙且年岁已大，将随身携带的双肩包遗忘在车上，直到回到家才幡然醒悟。无奈只能求助12345市民热线获知巴士二公司电话，求助电话话务员接听后即刻联系古美环线调度室要求协助涉事驾驶员帮忙寻找。该车驾驶员到达终点站后，严格按常规工作流程一程一检及时发现我遗忘在车上的双肩包，即刻转送到调度室，调度室及时通知了我领回。巴士二公司和古美环线工作人员遇乘客求助想方设法、积极回应彰显了社会的正能量。在这里通过信件向他们表示衷心的感谢！祝好人一生平安！,2023-10-10,上海市道路运输管理局,王同志：  您好！您关于公交行业的来信已收悉，经研究，现将处理意见答复如下：  感谢您对公交从业人员规范服务的肯定。本市公交行业长期以来，以为乘客提供优质服务为宗旨，不断提升服务质量，方便市民出行。  您的来信我们已经转至相关公交企业，希望在企业内加强正面宣传和引导，并通过一定方式对相关工作人员的行为予以表彰和鼓励。  感谢您对本市道路运输行业的关心和支持。                            上海市道路运输管理局                                     2023年9月25日
关于学校办学问题,上海市浦东新区教育局,2023-10-10,https://xfb.sh.gov.cn/xinfang/yjzj/feedback/feedbackshow?id=A27935E3A1C74204AA0A8E80EF47C85B,关于学校办学问题,2023-09-05,小区居民对于对口中学的质量担忧，希望相关部门能就学校共同发展、加大集团优质教学资源投入，为孩子提供家门口优质的教育资源共同努力。,2023-10-10,上海市浦东新区教育局,赵同志：您反映的信访事项本机关已受理。现答复如下：您来信建议学校办学的问题。浦东新区积极推进学区化集团化办学、新优质学校集群发展、初中强校工程、城乡学校互助成长等举措，努力办好每一所家门口的学校，促进区域义务教育优质均衡发展。新区教育局高度重视该中学的发展，已将该中学加入教育集团，通过促进该中学与集团内优质资源紧密共享，推动学校实现更高水平的发展。学校将进一步健全家长、社区参与办学的有效机制，合理吸纳各方的建议和诉求，有效改进学校办学。您的建议将留作参考，感谢您对浦东教育工作的关心、理解和支持。此复。上海市浦东新区教育局2023年9月21日
滴滴不付劳务费,上海市道路运输管理局,2023-10-10,https://xfb.sh.gov.cn/xinfang/yjzj/feedback/feedbackshow?id=1D0CCEDC93944707A0862374037E0382,滴滴不付劳务费,2023-09-05,"本人反映,滴滴不付钱本人认为,从滴滴平台叫车平台就应该付钱本人要求,滴滴垫付",2023-10-10,上海市道路运输管理局,巴同志：  您好！您关于出租行业的来信已收悉，经研究，现将处理意见答复如下：  根据您反映的情况，承办部门及时与滴滴平台进行核实。经滴滴平台反馈，您的相关费用将于2023年10月底前完成垫付。相关情况承办部门已电话反馈您，您对此处理表示认可。  感谢您对本市道路运输行业的关心和支持！上海市道路运输管理局2023年9月21日
13号线西延长途径上海江桥大型动迁基地而不设站,上海市交通委员会,2023-10-10,https://xfb.sh.gov.cn/xinfang/yjzj/feedback/feedbackshow?id=D654B63DC29447D88CFE2E28C73C11D8,13号线西延长途径上海江桥大型动迁基地而不设站,2023-09-03,本人反映，13号线西延长线，规划时声明会在嘉定区和闵行区设站，终点站在2号线徐泾东站。但是规划出台以后，所有5个站点都设在闵行区，嘉定区无一站点，非常不合理。具体情况如下：1.13号线西延长线设站点5个，除了最长的站点经过虹桥动车所的4.369公里外，其他站点最小站间距仅0.996公里，平均间距1.07公里。而13号线西延长线所途径的金沙江西路星华公路路口，距离上一站金运路站1.5km，比其他几站平均距离都长，却未见设站。2. 金沙江西路星华公路路口南边，有上海最大的动迁基地之一绿地新江桥城一二三期，占地67万平方米，总户数4650户，有很多是支援外地知青返沪的动迁房；和老普陀区新湖明珠城为主的动迁基地水岸秀苑，2000多户。这些居民走路到13号线现有的金运路站，要走1.5-2公里，要花20分钟，非常不便。3. 2019年，绿地新江桥城居民曾在小区门口拉横幅，抗议大型动迁基地上空有飞机航道经过噪音很大，而且距离地铁站两公里要走半小时，出行不便。后来飞机航道计划做了调整，经过这个大型动迁基地的飞机有所减少，噪音降低。但是新规划的13号线西延长线却没有在途径的地方设站，这些动迁基地出行困难的问题，没有得到解决。本人认为，13号线规划不合理，原计划的在嘉定、闵行设站，最后变成了全部在闵行区设站，嘉定区的相关领导失职，没有为辖区内的居民争取到出行便利。本人要求，13号线西延长线应该在金沙江西路星华公路路口路附近加设一站，现在13号线西延伸线刚刚开始建设，成本并不会很高，但是却会大大增加附近大型动迁基地居民的出行便利。希望领导体恤广大动迁居民的难处，为艰难一生的中低收入的上海动迁居民谋取福利。,2023-10-10,上海市交通委员会,程同志：您反映的信访事项已受理。经研究，现答复如下：您建议上海地铁13号线西延长线在金沙江西路星华公路路口附近加设一站，从规划必要性角度看，华翔路以西为虹桥动车运用所，位于城市开发边界外，在星华公路金沙江西路路口设站，将形成单边服务，站点辐射能力较弱。从工程角度看，13号线西延伸站点设置与投资等已明确并获批复，目前工程已开工建设，暂不具备增设车站可能性。有关部门将通过完善地区公交配套，满足居民快捷出行的需求。感谢您对上海交通工作的关心、理解和支持。上海市交通委员会2023年9月19日
关于优化闵行区浦锦街道轨道交通的建议,上海市交通委员会,2023-10-10,https://xfb.sh.gov.cn/xinfang/yjzj/feedback/feedbackshow?id=0E1EABE2931442A89429B786CD0BE6DD,关于优化闵行区浦锦街道轨道交通的建议,2023-09-05,一，本人反映　　浦锦街道自2015年从闵行区浦江镇析出，虽行政区划归于闵行，但地理位置却位于浦东，行政和地理位置的错配造成了爹不疼娘不爱的尴尬境地，在轨道交通的规划上严重滞后，甚至不及原浦江镇。二，本人认为　　浦锦街道作为官方大力宣传的宜居单元，人口居住相对集中，市内通勤要求较高，但出行条件十分不便捷。目前仅有的8号线根本无法满足需求，早晚高峰的8号线挤到怀疑人生。　　但长久以来浦锦街道没有合理的轨交规划，全靠蹭其他区域的红利：往北蹭浦东轨交红利，在建的机场联络线距浦锦街道最近的站点为三林南站；往南甚至还要蹭奉贤的轨交红利，规划中的奉贤线站点设置，最近的点为江月路站；轨交24号线，曾相传最后一站是浦锦路站，但24号线属于远期规划，短期无法改善出行条件，且站点规划尚不可靠，有很大变动可能，网传已不再设立浦锦相关站点。　　即便如此，机场联络线的三林南站和奉贤线的江月路站对浦锦街道并无很大改善，因为这两站一个在北边的三林（便利前滩），一个在浦锦街道最南（便利浦江镇），然而夹在中间的，居民密集，迫切需要地铁浦锦街道却并站点，这无法解决居民出行的最后几公里的问题。　　线路图也可以明显看出，三林南和江月路站中间很长一段线路（绿色方框部分）却并无站点规划，但据本人不完全汇总，位于本区域当中的居民小区包含浦江坤庭（多期）、保利茉莉公馆（多期）、红醍半岛（多期）、华侨城（多期）、浦秀馨苑、浦秀苑、浦恒馨苑、中粮万科、一品漫城5期、翡翠别墅（多期）、上海桃花源（多期），桂鸿院，此外还有在建的华发建发漫云（多期），另有数个在建或预建动迁小区。这些居民住宅距离8号线在2.5公里左右，难以被8号线覆盖到，距在建的机场联络线的三林南站平均也在3公里以上。若奉贤线站点选址对该地区再不予以考虑，该区域将成为轨交真空地带，虽有多条轨交经过，但过而不停，如此多的小区居民的通勤需求，如此设计显然存在不足。此外区域内还有两个三甲医院，本区和外区都有来此看病需求。三，本人建议　　考虑居民出行需求，合理优化设置浦锦街道相关站点，完善该区域的轨道交通。,2023-10-10,上海市交通委员会,吴同志：您所提的建议本机关已受理。经研究，现答复如下：您建议优化闵行区浦锦街道轨道交通，您所提及的轨道交通24号线、奉贤线均为规划线路，目前尚处于前期方案研究阶段。我们将充分考虑您的建议，在下阶段工作中深化研究比选。感谢您对本市交通工作的关注与支持。上海市交通委员会2023年9月19日
试论27号线设立新场古镇站的必要性,上海市交通委员会,2023-10-10,https://xfb.sh.gov.cn/xinfang/yjzj/feedback/feedbackshow?id=AA7AF318660D4A9CAAF29DD4CEC10E14,试论27号线设立新场古镇站的必要性,2023-08-30,       为更好地串联陆家嘴金融中心、张江科学城、临港自贸区三大功能区，上海市交通委于6月19日针对轨道交通27号线正式启动规划方案招标。具体路线官方并没有发布。我此次写信的目的是：建议建设地铁27号线新场古镇站，以方便居民和游客更便捷地到达该地区，而非仅仅依赖新场站与16号线的换乘。下文将阐述我提出该建议的原因及其影响。       首先，新场古镇作为上海市的一个历史风貌保护区，具有丰富的文化遗产和旅游资源。然而，目前前往新场古镇的交通方式相对有限，主要依赖公共汽车和16号线的换乘，容易受到堵塞影响。这使得大量游客需在新场站下车后转乘其他交通工具，造成了不便和时间浪费。因此，通建地铁27号线能够直接将居民和游客送达新场古镇，提升了公共交通的便捷性和效率。地铁的建设可以在不破坏现有建筑的前提下，保护和传承该地区的文化遗产。通过精心设计的车站和装饰，地铁线路也可以成为当地的标志性景点之一，吸引更多游客前来参观和了解这个历史悠久的古镇。       其次，新场古镇位于上海市郊区，发展潜力巨大。近年来，随着城市建设的扩展，该地区的人口、商业和旅游业都在迅速增长。然而，目前的交通网络无法满足日益增长的交通需求。通建地铁27号线能够有效缓解交通压力，提高整体的流动性和出行效率，同时也对新场古镇周边地区的经济发展起到积极的促进作用。       此外，新场古镇附近还有一些必要的教育机构和医疗资源，如石笋中学、上海科技大学新场校区、新场镇人医院。新场派出所、新场镇政府等同样分布在其周围。这些机构对于该地区居民、学生及游客来说都具有重要意义。通建地铁27号线将为师生和居民提供更加便捷、快速的交通工具，提高了他们的生活质量和学习环境。       另外，新场古镇周边地区还有一些工业园区和企业。通建地铁27号线将为这些企业提供更加便利的公共交通网络，提高员工的出行便捷性和工作效率。这对于促进企业的发展和吸引更多人才来此工作具有积极影响。地铁的建设还能减少尾气排放，改善当地空气质量，提升居民生活质量，增强城市的可持续发展能力。       基于以上原因，我建议上海市交通委员会考虑在新场古镇附近通建地铁27号线。这将为居民、游客、学生和企业提供更加便捷、高效的公共交通选择，促进新场古镇及周边地区的经济和社会发展。希望您能重视该提案，对于新场古镇新建地铁的可行性进行进一步研究和评估，并为推动这一项目的实施提供您的支持。       衷心感谢您对于交通发展的持续关注。,2023-10-10,上海市交通委员会,钱同志：您反映的信访事项已受理。经研究，现答复如下：根据上海市城市总体规划(2017-2035)，轨道交通27号线为远期规划线路，目前尚处于前期方案研究阶段。我们将充分考虑您的建议，在下阶段工作中深化研究比选。感谢您对本市交通工作的关心、理解和支持。上海市交通委员会2023年9月15日
学校教育问题,上海市闵行区教育局,2023-10-10,https://xfb.sh.gov.cn/xinfang/yjzj/feedback/feedbackshow?id=015B1334BBF541B8AD546F83AC7C5C79,学校教育问题,2023-09-15,本人反映，小区按户均2人推算，小区将有100名适龄幼儿、儿童需要教育资源配套。加上已交付的小区，未来2年将陆续有3个小区、超过400位学龄幼儿、儿童产生强烈的入学需求。按照本区统筹区域分组情况以及就近入学原则，九星文来和碧林湾文来属于一校两区，九星文来未建立之前，针对我们小区优先统筹碧林湾校区属于合理安排。针对现在入学的整体需求，我们提出如下诉求:诉求1:更新适龄幼儿学前教育配套规划，保障2024年入园需求。2:加快落实地块教育规划，按原有官方公布信息建设9年制九星校区，并于2025年前建设完成；3:针对2024年拿到预售合同的业主，安排优先统筹碧林湾文来校区。,2023-10-10,上海市闵行区教育局,聂同志：您好！您关于小区配套学校建设和入学安排问题的来信收悉。现告知如下：九年制学校目前正在进行地块规划调整工作，由七宝镇实施。我局同步推进前期方案研究工作。待规划调整工作完成后，我局将启动项目前期手续办理工作，尽快推进项目开工。关于入学问题的相关诉求，已告知我局相关部门，供其在后续工作中参考。感谢您对闵行教育工作的理解和支持。特此告知。
