title,agency,date,links,标题,来信日期,信件内容,回复日期,回复单位,回复内容
关于电视台早新闻的建议,上海广播电视台,2023-09-13,https://xfb.sh.gov.cn/xinfang/yjzj/feedback/feedbackshow?id=934FF1F427E14CEC8F8505D31B27603C,关于电视台早新闻的建议,2023-08-06,诉求：龚市长：您好！在此向您反映大家都关心的，大热天实际温度。作为每天990频道七点早新闻，不少听众已养成习惯，每天按时收听，但播天气预报时，大家关注的上一天，徐家汇测出的实际温度不报，尤其是眼下大热天，尤其是老年人无从得知。至于空气质量现在不是冬季，北方还尚未供暖。为此本人反映市民热线，二十多天，上海广播电视台简复：加强管理。结果不了了之，民生无小事，尤其是市级电台是政府与人民群众的桥梁，更应起表率作用，对市民的合理诉求，认真汲取改进工作，大家希望早日在早新闻，能听到上一天徐家汇测出的实际温度。谢谢转发！,2023-09-13,上海广播电视台,黄同志：您反映的信访事项我台已受理（编号为：网[2023]000190025）。经了解，东方广播中心已与您进行了沟通。东方广播中心表示，作为主流媒体应当倾听观众的声音，针对您的建议予以采纳，将尝试在开场天气播报时增加昨日气象回报，同时保留空气质量的内容。感谢您对上海广播节目的关注和支持。此复。上海广播电视台2023年9月5日
泗泾镇北横港东路人行道乱停非机动车的问题,上海市松江区泗泾镇人民政府,2023-09-13,https://xfb.sh.gov.cn/xinfang/yjzj/feedback/feedbackshow?id=09CE7A2088D045CD9FF5380101FE1F5D,泗泾镇北横港东路人行道乱停非机动车的问题,2023-08-08,本人反映，泗泾镇北横港东路两侧，人行道上有非机动车停放划线，每天有大量非机动车停放。每天早高峰时，加上共享单车挪车作业，行人无法走人行道，存在安全隐患。本人要求，取消人行道非机动车停放划线。,2023-09-13,上海市松江区泗泾镇人民政府,简复告知书潘**同志：您好！您于2023年8月8日信访反映的事项收悉。经了解，为进一步缓解泗泾地铁站非机动车停车压力，故在邻近地铁站的横港公路泗陈公路以北两侧道路划设了非机动车停放区域。现已临时将横港公路恒泽路以南道路作为非机动车违规停放清理安置点，加强违停非机动车日常清理转移，保证人行道畅通。特此告知。上海市松江区泗泾镇人民政府2023年8月16日
小区无停车位分配停车难,上海市徐汇区人民政府凌云路街道办事处,2023-09-13,https://xfb.sh.gov.cn/xinfang/yjzj/feedback/feedbackshow?id=E116D78DC5064E22AC02DE8E391FC64B,小区无停车位分配停车难,2023-09-03,"本人反映,我的房子在梅陇十一村，但是小区停车位已满，我需要排队，但我不知道何时才会有停车位空出才能排进来，目前车子停在附近一个停车场，两天被扎了两次钉子，换了两次轮胎。 现在不知道车该停在哪里。 对生活造成了极大不方便以及经济压力。本人认为,小区需要给业主分配车位，而不是让业主到处找车位。这对生活造成极大不不便。本人要求,小区立刻安排停车位给业主。 目前小区停车位办理是业委会，业委会说暂无其他办法，只能排队。 且就算我投诉到12345最后分配下来也是分到居委，没有任何作用。 所以现在投诉到区政府的邮箱，希望能有有效的回应和解决办法，为人民群众排忧解难！谢谢！",2023-09-13,上海市徐汇区人民政府凌云路街道办事处,"答复意见书秦*同志：您反映的信访事项本机关已受理。经研究，现答复如下：经查,现梅陇十一村B块小区拥有划线车位433个，登记车辆665辆左右，车位与车辆严重倒挂。为了改善停车问题，小区业委会召开业主大会制定了《梅陇十一村B块机动车停放规则》，根据该规则第六条：“原则上包月停车系腾退一辆补办一辆，或有新开辟车位，按登记排队先后顺序给予解决。”现小区业主包月登记排队车辆数为30辆，您名下的车辆排至第28位。感谢您对凌云街道工作的关心、理解和支持。上海市徐汇区人民政府凌云路街道办事处2023年9月12日"
关于安装电梯政府补贴费用,上海市徐汇区住房保障和房屋管理局,2023-09-13,https://xfb.sh.gov.cn/xinfang/yjzj/feedback/feedbackshow?id=570E3D3D0E324F66849CEE9C8B3CBC64,关于安装电梯政府补贴费用,2023-08-22,"本人反映,徐汇区枫林街道中山南二路*弄*号2021年动工安装电梯，电梯于2022年正式启用，给居民生活带来极大方便，我们从内心感谢政府！但政府给予安装电梯的补贴费用至今还没有到位。本人要求,安装电梯的补贴资金尽快还给居民。",2023-09-13,上海市徐汇区住房保障和房屋管理局,答复意见书袁女士：您好，您要求安装电梯的补贴资金尽快还给居民的信访件（网[2023]000206022）已收悉。中山南二路*弄*号楼已经完成电梯加装，2022年10月拿到电梯使用许可证。《关于本市既有多层住宅加装电梯办理政府补贴资金有关事项的通知》沪财建[2020]28号文明确规定了政府补贴资金的申请方式和申请材料。经查，该项目政府补贴资金申请材料中有材料缺失，已经通知加梯代建单位尽快补齐材料为业主申请政府补贴资金。2023年8月23日下午，修缮科工作人员电话联系您核实相关诉求，并解释相关情况。感谢您对我局工作的理解和支持。上海市徐汇区住房保障和房屋管理局2023年8月30日
楼道卫生环境差,上海市嘉定区菊园新区管理委员会,2023-09-13,https://xfb.sh.gov.cn/xinfang/yjzj/feedback/feedbackshow?id=5DD83E9398AA4B9C9C3FF31E488A9542,楼道卫生环境差,2023-08-16,本人反映，小区的32号楼楼道的卫生环境很差，物业不是每天搞卫生，要求对保洁进行整改。,2023-09-13,上海市嘉定区菊园新区管理委员会,杨同志：您反映的事项已受理，现答复如下：经竹筱社区居委会核处，居委会已与物业公司沟通该情况，物业公司表示将加强楼道保洁工作人员的业务培训，同时增派保洁人员增加保洁巡查频次，确保保洁工作落实到位，保证楼道卫生环境整洁。感谢您对我们工作的理解和支持。嘉定区菊园新区管理委员会2023年8月18日
关于幼儿园转学问题,上海市浦东新区教育局,2023-09-13,https://xfb.sh.gov.cn/xinfang/yjzj/feedback/feedbackshow?id=D4DDC9C105D34B899B34318E7B7F6CAE,关于幼儿园转学问题,2023-08-21,"本市户口男童本学期申请转校就读，幼儿园拒绝了我们，让我们联系附近幼儿园转校本人认为,转入幼儿园继续进行学前教育，帮忙解决生活学习困难本人要求，本市户口儿童继续公办幼儿园幼儿园教育",2023-09-13,上海市浦东新区教育局,"梁同志：您反映的信访事项本机关已受理。现答复如下：您来信反映您孩子系本市户口，本学期想要申请转校就读未果，您希望解决本市户口孩子继续就读公办幼儿园的问题。按照《浦东新区幼儿园转学服务告示（2023年暑假）》由家长或监护人向幼儿园提出转学申请,家长或监护人可通过浦东教育网站“招生考试”栏（网址：http://www.pudong.gov.cn/jyj/）公示的信息，查询房产或户籍地址的对口幼儿园，并按时前往幼儿园申请办理转学登记手续，获取《转学相关证明材料收取凭证》。考虑到您实际的情况，我局有关处室工作人员已电话告知您后续处理情况，您表示知悉。感谢您对浦东教育工作的关心、理解和支持。此复。上海市浦东新区教育局2023年8月30日"
家中狗遗失,上海市松江区人民政府方松街道办事处,2023-09-13,https://xfb.sh.gov.cn/xinfang/yjzj/feedback/feedbackshow?id=BA041439666846D0A106C96EFFA486CD,家中狗遗失,2023-08-11,本人反映，家中的狗疑似被人牵走。本人要求，小区物业进行调查。,2023-09-13,上海市松江区人民政府方松街道办事处,简复告知书仲*同志：您好！您于2023年8月11日信访反映事项收悉。经了解，当日上午狗已被找到并领回。特此告知。上海市松江区人民政府方松街道办事处2023年8月14日
网站访问页面异常问题,国家税务总局上海市税务局,2023-09-13,https://xfb.sh.gov.cn/xinfang/yjzj/feedback/feedbackshow?id=D2D46776807B4DE4948D4232ACF48580,网站访问页面异常问题,2023-08-12,"本人反映,电子税务局网站私房出租发票代开项目里，显示访问页面异常。本人认为,尽快恢复功能。本人要求,",2023-09-13,国家税务总局上海市税务局,信访事项答复意见书倪某同志：您反映的信访事项已受理。经研究，现答复如下：您反映电子税务局私房出租发票代开功能访问页面异常。您希望尽快恢复相关功能。经查询系统日志信息，8月11日至8月12日下午，上海市电子税务局相关功能运行正常，页面访问异常可能为网络问题。8月18日上午，我们通过电话联系您，您在电话中反馈目前已可正常进入功能页面。我们已要求电子税务局热线坐席人员、运维人员提高敏感度，加强电子申报技术服务热线与电子税务局运维之间的衔接，提升问题响应速度。感谢您对本市税务工作的关心、理解和支持。国家税务总局上海市税务局2023年9月6日
绿植维护,上海市松江区人民政府方松街道办事处,2023-09-13,https://xfb.sh.gov.cn/xinfang/yjzj/feedback/feedbackshow?id=5BB7E6265AC640F4A21DCBAD9EC6F17D,绿植维护,2023-08-14,反映有些社区、道路绿植疏于修剪管理，影响美观，可能存在安全隐患，建议引起重视并及时处理。,2023-09-13,上海市松江区人民政府方松街道办事处,留作参考告知书***同志：您好！您所提的建议已收悉。我们已联合有关部门进一步加强巡查和管理，科学合理开展绿植修剪工作。感谢您对党和政府工作的关心、理解和支持。特此告知。上海市松江区人民政府方松街道办事处2023年8月15日
新能源车充电桩安装申请问题,上海市松江区泗泾镇人民政府,2023-09-13,https://xfb.sh.gov.cn/xinfang/yjzj/feedback/feedbackshow?id=9BE903AFB9304F718BB13CDE80371874,新能源车充电桩安装申请问题,2023-08-21,本人反映，所在泗泾镇新凯七村，申请安装新能源车充电桩遇到困难。本人要求，请有关部门协调。,2023-09-13,上海市松江区泗泾镇人民政府,简复告知书娄*同志：您好！您于2023年8月21日信访反映的事项收悉。《上海市电动汽车充电设施建设管理暂行规定》第十九条规定，“电动汽车用户在住宅小区有自有产权车位或经车位产权人同意，在租赁期一年以上的固定车位上安装充电设施的，物业服务企业应当予以支持和配合。”经了解，您所在的小区配套车位性质属公共配套，非产权车位，故暂时无法安装私有充电桩。目前，居委会已将公共充电桩安装事宜纳入社区计划议事商讨内容。特此告知。上海市松江区泗泾镇人民政府2023年8月29日
新南街路面修缮,上海市松江区新桥镇人民政府,2023-09-13,https://xfb.sh.gov.cn/xinfang/yjzj/feedback/feedbackshow?id=42A645D6DEB14922929A11DE225B681C,新南街路面修缮,2023-08-10,本人反映，新南街作为新桥镇中心区域主干道，两边商户林立，人流众多。马路边人行道坑坑洼洼，机动车道也比较颠簸，特别是人行道（恒宣路到新育路）一段，地上铺设的地砖缺失，下雨天路滑积水，十分不方便。本人建议，尽快修复。,2023-09-13,上海市松江区新桥镇人民政府,简复告知书王成同志：您好！您于2023年08月10日信访建议新南街路面修缮的事项收悉。经了解，该处路段人行道损坏路面已修复。特此告知。上海市松江区新桥镇人民政府2023年8月17日
优化道路方便居民通行,上海市松江区新桥镇人民政府,2023-09-13,https://xfb.sh.gov.cn/xinfang/yjzj/feedback/feedbackshow?id=ABDD943D13D344CB890BC4A1F7662D3A,优化道路方便居民通行,2023-08-11,晨星社区距离新桥火车站直线距离不到2公里，但相关道路窄小，无法驾车通过，车辆须开上高架桥绕一大圈才能到达新桥火车站。希望能够优化有关道路，方便居民出行。,2023-09-13,上海市松江区新桥镇人民政府,上海市松江区新桥镇人民政府信访事项答复意见书胡**同志：您所提的建议已收悉。经了解，新桥镇镇域内有沪昆铁路、金山铁路、沪杭高铁和沪苏湖铁路（在建）四条铁路线，在此过程中，铁路线见证了新桥的建设发展，也在发展中造成暂时的空间割裂、交通堵点等情况。从安全角度考虑，相关小路暂不具备优化改造以适应车辆通行的条件，目前晨星社区居民驾车前往新桥火车站仍需经过闵申路高架。感谢您对政府工作的关心、理解和支持。上海市松江区新桥镇人民政府2023年9月11日
洒水车作业影响路人,上海市松江区新桥镇人民政府,2023-09-13,https://xfb.sh.gov.cn/xinfang/yjzj/feedback/feedbackshow?id=CF2761C4720245ECB7E7515409EEB3E2,洒水车作业影响路人,2023-08-16,反映2023年8月16日上午8:25分左右，有轨电车新车公路站，一辆扫水车由东向西行驶，洒水车经过站台的时候，站台上都是人，扫水车依然喷水，溅人一腿。环境清扫固然重要，但经过人群时是不是能够暂时关停下洒水器。,2023-09-13,上海市松江区新桥镇人民政府,告知书金**同志：您好！您于2023年8月16日反映关于洒水车作业影响路人的信访事项收悉。新桥镇环卫所已对各洒水车操作人员进行服务规范教育的工作指导，针对遇到路边行人密集处将暂时关闭车辆洒水功能，避免影响路人正常通行。感谢您对政府工作的关心、理解与支持。特此告知。上海市松江区新桥镇人民政府2023年8月23日
关于孩子入学问题,上海市浦东新区教育局,2023-09-12,https://xfb.sh.gov.cn/xinfang/yjzj/feedback/feedbackshow?id=DCCAB5CCE9434AC88DAFA667AB50981D,关于孩子入学问题,2023-08-21,本人反映：我们是双职工家庭，我们夫妻独自抚养三个孩子。老大在读初一，老二在读五年级，虽是毕业班，但是属于九年一体制学校，现已被该校预备班录取。老三幼升小被另外的学校录取，我们夫妻二人只能有一个人负责接送问题。要求：根据我们的实际困难，我们希望调整孩子到同一个学校就读。,2023-09-12,上海市浦东新区教育局,张同志：您反映的信访事项本机关已受理。现答复如下：您来信反映二胎家庭孩子入学的问题。经我局工作人员与您电话联系，您表示问题已解决。感谢您对浦东教育工作的关心、理解和支持。此复。上海市浦东新区教育局2023年8月30日
关于公租房个人申请条件的建议,上海市嘉定区国有资产监督管理委员会,2023-09-12,https://xfb.sh.gov.cn/xinfang/yjzj/feedback/feedbackshow?id=006A24434B6449CFAF0D26C294E688F2,关于公租房个人申请条件的建议,2023-08-23,本人反映，公租房个人申请条件中，要求持有有效期内的《上海市居住证》，上海市大多外来人口的实际居住地都在上海内，但未申请居住证的人员仍旧很多，本人建议，对公租房申请条件进行适当放宽。,2023-09-12,上海市嘉定区国有资产监督管理委员会,卓同志：您反映的信访事项本机关已受理。经研究，现答复如下：上海市嘉定区公共租赁住房运营有限公司接到信访件后于8月25日与您进行了沟通，沟通中，工作人员向您详细介绍了关于《嘉定区公共租赁住房管理办法》中关于“申请条件”的相关内容，解释了申请公租房需“具有本市常住户口或持有有效期内《上海市居住证》，并已与本区单位签订一年以上（含一年）劳动或工作合同”的相关政策。您表示对政策已知晓，对回复满意。感谢您对我们工作的关心、理解和支持。上海市嘉定区国有资产监督管理委员会2023年8月31日
规划事项咨询,上海市嘉定区国有资产监督管理委员会,2023-09-12,https://xfb.sh.gov.cn/xinfang/yjzj/feedback/feedbackshow?id=D9914682C0F34521A4C0417BF6944226,规划事项咨询,2023-08-22,目前我居住的小区日常生活不论是买菜还是早餐等极其不方便，都要骑车到三公里左右的汽车城或更远的黄渡菜市场，对家里老人生活很不方便。看到政府对该地块的规划，想咨询一下该地块相关规划的具体落地情况以及时间表。,2023-09-12,上海市嘉定区国有资产监督管理委员会,吕同志：您反映的信访事项本机关已受理。经研究，现答复如下：经上海国际汽车城（集团）有限公司核实，目前该区域属于开发建设期，周边的公建配套正在逐步推进中，邻里中心等还未建设。据了解，目前安亭镇共有9家农贸市场，并有大润发、永辉、农工商、联华、比宜德等连锁品牌超市。此外，通过现场勘踏，该社区周边也开设了具备农副产品供应的商业网点，比如联华、如海、好又多超市，4家盒马邻里，5家生鲜超市，1家雨润优选，1家水果农场。根据《关于同意的批复》，在21BA地块规划有1500平方米的菜场。关于菜场何时建设需相关职能部门共同推进。以上情况，上海国际汽车城（集团）有限公司已与您进行了沟通解释。感谢您对我们工作的关心、理解和支持。上海市嘉定区国有资产监督管理委员会2023年8月28日
小区业务违规开放内部停车场,上海市嘉定区安亭镇人民政府,2023-09-12,https://xfb.sh.gov.cn/xinfang/yjzj/feedback/feedbackshow?id=DC4C2DA940374270B92B97CA70ACA560,小区业务违规开放内部停车场,2023-08-29,本人反映，小区物业没有知会业主的前提下，私自将业主的地下停车场开放给外来人员，本人认为该行为严重违反规定，本人要求立刻取消该决定，恢复小区内部停车场的定义。,2023-09-12,上海市嘉定区安亭镇人民政府,张同志：您好！接到您的来信后，安亭镇房管所立即与万科物业进行沟通。经过协调，小区地下车库停车位不对外开放，万科物业会加强小区封闭管理，门岗做好询问及登记工作，控制外来人员及车辆，确保小区车辆进出井然有序。感谢您对我们工作的关心、理解和支持。特此告知。上海市嘉定区安亭镇人民政府2023年9月6日
关于车位问题,上海市浦东新区高东镇人民政府,2023-09-12,https://xfb.sh.gov.cn/xinfang/yjzj/feedback/feedbackshow?id=752FDA75D65045B896B17085DAAC675D,关于车位问题,2023-08-19,"本人反映,我小区是93年回迁房，当时原拆居民享受固定车位模式，这种模式一直延续到现在。附近几个小区都已经取消了这种固定车位模式，问了物业说业委会不同意。本人认为,随着时代发展，车辆越来越多，采取先到先停的原则。本人要求,取缔这种不合理制度。",2023-09-12,上海市浦东新区高东镇人民政府,浦东新区高东镇人民政府信访事项简复告知书蔡先生：你反映建议小区取消固定停车位的事项，我镇已收悉。经镇房管办事处核实情况，现将情况答复如下：1、你所在小区停车位方案经小区业主大会表决通过，考虑到小区停车现状，目前该小区所有地面机动车固定车位暂时不变，其他车辆按照先到先停的原则，待小区条件成熟时取消地面固定车位。2、对于你提出取消固定车位的建议，该事项属小区业主自治管理范畴，该建议可以向小区业委会提出。感谢你对我镇工作的关心与支持。上海市浦东新区高东镇人民政府2023年8月29日
改进垃圾分类配套设施,上海市松江区泗泾镇人民政府,2023-09-12,https://xfb.sh.gov.cn/xinfang/yjzj/feedback/feedbackshow?id=ABD2D68F926142AC83E724E2283992C8,改进垃圾分类配套设施,2023-07-28,本人反映，泗泾镇金港花园垃圾分类点位处供居民洗手的水流较脏。本人要求，物业进行整改。,2023-09-12,上海市松江区泗泾镇人民政府,信访事项处理意见书刘**同志：您反映的信访事项收悉。现答复如下：经向属地居委会了解，小区垃圾分类点位处配备有固定水龙头供居民洗手，水流均为民用自来水。居委会将进一步加强对物业工作的监督管理。感谢您对本单位工作的关心、理解和支持。上海市松江区泗泾镇人民政府2023年8月14日
劳务纠纷,上海市松江区人力资源和社会保障局,2023-09-12,https://xfb.sh.gov.cn/xinfang/yjzj/feedback/feedbackshow?id=0E12747A28E14D35928FA7C5D45CD094,劳务纠纷,2023-08-16,本人反映，入职半年来派遣公司未与本人签订劳动合同，也未缴纳社会保险，劳动关系难以确认。本人要求，希望政府部门给予援助。,2023-09-12,上海市松江区人力资源和社会保障局,信访事项处理意见书郭**同志：您好！您反映劳务派遣公司未签订劳动合同的信访事项已收悉。经2023年8月22日松江区人社局与您先行联系，您表示已自行与公司补签相关合同，无需进一步处理。感谢您对我们工作的关心、理解和支持。上海市松江区人力资源和社会保障局2023年8月23日
小区停水,上海市松江区人民政府广富林街道办事处,2023-09-12,https://xfb.sh.gov.cn/xinfang/yjzj/feedback/feedbackshow?id=D1F72B9D9DE3431BA2A2DD4FE636F5A3,小区停水,2023-08-21,本人反映，所在小区物业以水管维护为由停水时间过长，影响居民生活。本人要求，有关部门出面解释。,2023-09-12,上海市松江区人民政府广富林街道办事处,告知书凤**同志：您好！您于2023年8月21日信访反映小区停水事项已收悉。经了解，该小区因总水管爆裂需停水抢修，停水日期2023年8月20日至8月31日，停水时间为夜间12点至凌晨5点，停水通知已张贴在楼道电梯箱内。特此告知。上海市松江区人民政府广富林街道办事处2023年8月28日
致嘉定区江桥医院三位医生的感谢信,上海市嘉定区卫生健康委员会,2023-09-12,https://xfb.sh.gov.cn/xinfang/yjzj/feedback/feedbackshow?id=6F84FA0EF318470996E8D7AB4CA06AC6,致嘉定区江桥医院三位医生的感谢信,2023-08-19,      家母于2023年8月4日挂号妇科门诊，主治医师闵医生在看诊过程中详细解读了患者的体检报告，在检查报告中抽丝剥茧迅速准确地找准了病因，对症施策。      8月14日患者开始住院治疗，科主任医生的医疗团队先从术前对患者开始心理建设和辅导，消除患者的术前恐慌和术后顾虑，接着耐心细致向患者说明和介绍手术过程和手术方案。术后向患者本人和家属用影像介绍了手术全过程。在术后查房期间，医疗团队数次向患者叮嘱介绍恢复期的注意事项。李医生的医疗团队真正地视病人为亲人，时时刻刻守护患者的健康，切切实实身体力行地为群众办了实事，办了好事。      目前，患者术后恢复良好，再次感谢江桥医院医生及医护人员的辛勤付出。  ,2023-09-12,上海市嘉定区卫生健康委员会,陆同志：您的来信收悉。感谢您对嘉定医疗卫生工作的支持和信任，您的表扬是我们努力的最大动力，我们将继续秉承专业的医疗精神，优化就医流程，提高服务质量，为每一位患者提供更为优质的医疗服务，提升患者就医体验及满意度。感谢您对嘉定卫生健康工作的关心、理解和支持。上海市嘉定区卫生健康委员会2023年8月23日
