title,agency,date,links,标题,来信日期,信件内容,回复日期,回复单位,回复内容
增设上学公交车,上海市闵行区教育局,2023-09-01,https://xfb.sh.gov.cn/xinfang/yjzj/feedback/feedbackshow?id=CD3465B35EDA44CE8E75ADB4B5A50DB4,增设上学公交车,2023-08-22,本人反映，闵行区昆阳路小学因为修整重建，学生需要去马桥文来外国语小学西校区上课，而学生都住在昆阳路小学附近。本人认为，每天有两百多名学生往返两个学校，应该有公共交通方便学生上下学。本人要求，增设往返马桥文来外国语小学西校区（上海市闵行区富杰路296号）到昆阳路小学（闵行区天星路258号）的公交车以方便学生上下学。,2023-09-01,上海市闵行区教育局,辛同志：您好。您关于“昆阳路小学因为修整重建，学生需要去马桥文来外国语小学西校区上课，建议增设往返马桥文来外国语小学西校区到昆阳路小学的公交车以方便学生上下学”的来信收悉。区、镇相关部门非常重视昆阳校区学生在富杰校区就读过程中的交通问题，由区交通委牵头，增设“马桥一路区间”路线，路线发车时间尽量与学校上学放学时间匹配，站点停靠也在学校就近的车站，解决学生上下学交通问题。感谢您对闵行教育工作的理解和支持。特此告知。
美丽家园改造,上海市闵行区梅陇镇人民政府,2023-09-01,https://xfb.sh.gov.cn/xinfang/yjzj/feedback/feedbackshow?id=0149EE90704349D6B27EF3C8701E6AF3,美丽家园改造,2023-08-11,"本人反映,1.小区多年停车难！树木绿化之多，夏季蚊蝇众多，浪费宝地停车！2.楼道始终有人拖线板接电给车充电，十分危险！一旦发生火灾，小区道路狭窄，消防车也难进小区！本人认为,看了周边的小区改造了美丽家园之后，整个小区的面貌都很好。我强烈建议积极改造一下，小区的道路可以拓宽，整个环境也会更好！本人要求,改造小区，提升居住舒适度！",2023-09-01,上海市闵行区梅陇镇人民政府,陈同志：您好！您于2023年8月11日信访建议小区美丽家园改造的事项已收悉。经了解，目前暂无美丽家园改造项目。感谢您提出的宝贵意见，我们也将在今后的工作中留作参考，并将不断提升工作质量，为居民创建和谐、舒适的生活环境，也为建设“宜居、宜商、宜业”的梅陇而努力。另，关于飞线充电的问题，小区近期已开展专项整治，后续将继续做好安全宣传，引导居民前往集中充电设备进行充电。感谢您对基层工作的关心、理解和支持。特此告知。
香樟树抗风加固,上海市闵行区绿化和市容管理局,2023-09-01,https://xfb.sh.gov.cn/xinfang/yjzj/feedback/feedbackshow?id=83D3DCC95ABA4991850593D51206B043,香樟树抗风加固,2023-07-26,本人反映，江川东路紫月路口到奉浦大桥下路段，去年道路和两旁人行道整体提升工程焕然一新。然而，工程对原有行道树香樟树采取的施工方式极不合理。第一，为了铺设地板砖，斩断了向四周延伸的根系，偌大的树冠搭配仅有不到1平米的树根范围，不稳定因素高。第二，在工程完成后，本人已经不止看到一课被吹倒的树，说明非台风情况下就存在倒伏。本人认为，本次台风不经过上海，所以先行查看，未雨绸缪，既可以减小树木损失，也可以避免伤亡。本人要求，尽快派专人前往查看，排除台风吹倒树伤人的危险因素（均为科技园工作人员，如不采取维护措施，应设置提示：请注意大风时勿靠近行道树）,2023-09-01,上海市闵行区绿化和市容管理局,欧先生：您来信反映关于《建议绿容局调研江川东路两侧香樟的抗风情况，采取台风加固措施》的信访事项已收悉，现答复如下：江川东路（紫月路—莘奉金高速）段行道树树种为香樟，原来行道树树穴内种植的扶芳藤地被。为提升人行道整体工程形象，2022年紫竹高新园区结合道路和两旁人行道整体提升，对该段行道树树穴进行了改造提升，用新型铸铁盖板替换原来树穴内的扶芳藤地被。为便于盖板覆盖，施工单位对香樟根系进行了修整，部分香樟因修整根系确实存在倒伏的隐患，现已要求行道树绿化养护单位采取安全维护措施，确保行道树安全稳定。目前，行道树养护单位已在第一时间采购成品钢支撑，对根系影响严重、公交站台附近以及种植在迎风面的香樟进行了四角支撑，绑扎加固措施已全部完成，共支撑加固150余株。后期，我局将加强管理，进一步落实行道树养护单位加强养护管理，加强巡查，在台风来临前期，根据台风级别，协调交通部门，做好人行道及非机动车道安全警示管控措施，确保行道树安全渡过汛期。感谢您对我区公园绿化的关注与支持。特此告知。
房屋摇晃,上海市闵行区人民政府江川路街道办事处,2023-09-01,https://xfb.sh.gov.cn/xinfang/yjzj/feedback/feedbackshow?id=0508F72CC4984446B033B22D56870F93,房屋摇晃,2023-08-21,本人岳父母家是闵行区江川街道瑞丽新村。因本人妻子最近生病所以住在自己父母家，本人有时候也来照顾。发现小区外只要有大点的车辆驶过整栋楼都在摇晃。刚开始在岳父家过夜睡着了也被吓醒，还以为地震了！不知道如果万一上海地震的话整栋楼会不会倒塌，本人就想了解一下这种摇晃是否正常？请政府下级部门来解释一下。感谢！,2023-09-01,上海市闵行区人民政府江川路街道办事处,王同志：您好！您反映只要有大型车辆在瑞丽小区外驶过，小区内24号整栋楼感觉都在摇晃，希望相关部门处理的事宜，现回复如下：经江川路街道社区管理办核查，瑞丽小区为江川路街道第三批次旧房改造范围，改造方式为抽户。针对您反映的房屋振动问题，街道在旧房改造实施前已对房屋进行过检测，该房屋满足正常情况下使用的安全需求。目前该小区正实施旧房改造，改造过程中也对房屋进行了修缮，待改造工程完毕后街道将再次对该处房屋进行评估，确保房屋安全。特此告知。
小孩小学转学,上海市青浦区教育局,2023-09-01,https://xfb.sh.gov.cn/xinfang/yjzj/feedback/feedbackshow?id=BD5805BA796F4B0796209C72FDB10574,小孩小学转学,2023-08-17,因工作以及家庭地址变更到青浦华新镇，小孩目前就读嘉定二年级，需转到华新地区的学校，转学所需材料已经递交华新镇社发办，社发办也回复已于七月份把转学申请名单给到学校，目前八月过半，学校还没给到确定消息是否可以转进，特在此请求帮助。,2023-09-01,上海市青浦区教育局,吴女士：您好！您来信反映的事项收悉。经了解，符合转学条件的学生，相关转学通知将会在八月底前陆续致电学生家长。经核实，您的孩子符合该校转学条件，目前您已收到通知，转学成功。                                       感谢您对青浦教育工作的关心、理解和支持。特此告知。
小区内物业管理事项,上海市奉贤区南桥镇人民政府,2023-09-01,https://xfb.sh.gov.cn/xinfang/yjzj/feedback/feedbackshow?id=0FB8BCC6D946458E8B05AA7043B2CCF0,小区内物业管理事项,2023-08-15,本人反映物业公司收了物业费没有尽到应尽的职责，本人车辆在半年内被小区内的电瓶车多次碰撞，向物业公司多次反映无果，至今无解决方案。本人要求物业公司维护好小区内的公共区域设施；需加强小区内的车辆管理工作。,2023-09-01,上海市奉贤区南桥镇人民政府,瞿先生：关于加强小区内的车辆管理的事项，南桥镇曙光社区第二居民委员已督促该区域业委会、物业公司加强小区公共区域的日常管理工作。与您沟通后，您表示知悉。感谢您对政府工作的关心、理解和支持。
关于完善庄行东部组团社区15分钟生活圈的建议,上海市奉贤区规划和自然资源局,2023-09-01,https://xfb.sh.gov.cn/xinfang/yjzj/feedback/feedbackshow?id=82082A25FFDA4B6F976C5ECF3BE65BF4,关于完善庄行东部组团社区15分钟生活圈的建议,2023-08-13,近期南桥150动迁基地正在建设，让本人感受到奉贤政府再次关注奉贤的西部开发。而在南桥的西部正是庄行的东部组团社区，那边有4个较为成熟的小区与城建学院，后期还会有奉发的小区和一大批社区规划。为此，本人建议奉贤区政府能对南桥老城与庄行镇（至少短期至庄行镇东面，长期至庄行镇中心）进行统一规划，将一个个孤零零的社区连成片，进而实现土地的集约利用。例如在庄行东部组团社区与南桥150动迁基地之间，沿解放西路西延伸规划一定的商业配套（综合商场、休闲运动场所、花米港湾公园等），以此完善社区居民15分钟生活圈，使庄行与南桥老城成为更加宜居的板块。,2023-09-01,上海市奉贤区规划和自然资源局,张同志：您好！根据《关于“十四五”期间全面推进“15分钟社区生活圈”行动的指导意见》和《2023年上海市“15分钟社区生活圈”行动方案》的工作要求，我区正全面推进“15分钟社区生活圈”行动。后续将围绕“五宜”目标愿景，结合庄行东部组团区域实际，进一步完善东部组团地区商业及社区公共服务配套。感谢您对党和政府工作的关心、理解和支持。
拆迁安置房汇金家园停车费物业费远高于同地区水平,上海市奉贤区庄行镇人民政府,2023-09-01,https://xfb.sh.gov.cn/xinfang/yjzj/feedback/feedbackshow?id=1D69A4903F824CD8992F09EC3D77B798,拆迁安置房汇金家园停车费物业费远高于同地区水平,2023-08-15,本人反映，上海市奉贤区庄行镇拆迁安置房“汇金家园”物业费在政府补助0.6元/平/月的情况下还向业主收取1.35元/平/月。本人认为，安置房是政府进行城市道路建设和其他公共设施建设项目时，对被拆迁住户进行安置所建的房屋。本人要求，对于动迁安置房来说，现在的停车费和物业费是不合理的，请把这个价格归于合理。,2023-09-01,上海市奉贤区庄行镇人民政府,王同志：您好！奉贤区庄行镇邬桥“汇金家园”小区的机动车停车位租赁费和小区物业管理服务费的标准是根据《前期变更公开选聘物业服务企业招标书》和《前期物业服务合同》文件规定，即：小区机动车停车位租赁费：露天机动车车位150元/月、车库机动车车位300元/月；小区物业管理服务费1.95元/月/平方米。以上各项取费标准均在上海市奉贤区住房保障和房屋管理局确认备案。庄行镇人民政府考虑到居住的均为动拆迁业主，故调整了收费标准，即：小区机动车停车位租赁费：露天机动车车位150元/月不变、地下车库机动车停车位调整为200元/月；小区物业管理服务费镇政府补贴0.6元/月/平方米，业主需缴纳1.35元/月/平方米。与您电话沟通后，您表示理解。感谢您对政府工作的关心和支持！
同心路359弄小区存在停车难、加装电梯难、美丽家园难的问题,上海市虹口区人民政府广中路街道办事处,2023-09-01,https://xfb.sh.gov.cn/xinfang/yjzj/feedback/feedbackshow?id=E53064309EB64AB089E66D6FA84331E9,同心路359弄小区存在停车难、加装电梯难、美丽家园难的问题,2023-08-18,"本人反映,同心路359弄存在“三难”问题，三者相互影响，具体包括：1.小区停车困难。目前小区车位严重不足，鉴于邻里关系，早期居民占据相对固定的车位，新住户只能等待新车位的释放；2.加装电梯困难。小区建成后，8号线启动建设并从小区正下方下穿，导致几乎整个小区无法加装电梯。同时，地铁震动、噪音不断扰民并没有得到解决，亦导致了房屋倾斜沉降，小区老龄化严重却难以得到安生；3.美丽家园困难。2023年同心路多处小区已进行美丽家园工程，然而针对并未平改坡的同心路359弄，仍然未能开工。本人认为,以上三个问题系相互作用，本可以在开展美丽家园工程的同时改造绿化及周边道路，重新划分停车位，并由市区出面与轨交沟通进行轨交加固或小区改造从而实现小区居民加装电梯心愿，若不能，也应针对噪音、震动、沉降等问题对小区居民予以赔偿。而目前从街道及居委会的动作来看，并未看到任何作为。本人要求,加快推进美丽家园工程，完善小区停车位建设及平改坡建设。",2023-09-01,上海市虹口区人民政府广中路街道办事处,告知书黄同志：您好！您于2023年8月18日信访反映的事项已收悉。经了解，同心路359弄由德律风物业管理，车位较少，停车需求较大，您可携带身份证、房产证、行驶证至物业办公室登记车位。小区正门侧面为建筑垃圾临时堆放点，物业表示会定期清运，尽量避免影响周边居民生活。另，贵小区“美丽家园”工程申请事宜已纳入本年度工作计划当中，在此期间请您耐心等待。特此告知。广中路街道办事处2023年8月31日
南桥镇阳光家园物业管理问题,上海市奉贤区南桥镇人民政府,2023-09-01,https://xfb.sh.gov.cn/xinfang/yjzj/feedback/feedbackshow?id=37F1CF7DBD204F0899FED0FA107E52B8,南桥镇阳光家园物业管理问题,2023-08-28,本人反映南桥镇阳光家园4号楼长期出现间歇性异响，多次与物业沟通，并未得到有效解决。本人认为楼道出现间歇性异响存在隐患，且半夜异响还存在噪音扰民。本人要求调查处理。,2023-09-01,上海市奉贤区南桥镇人民政府,沈先生：您好！经属地居委会向该小区物业公司了解，您所反映的楼道间歇性异响实为水箱产生的声响，物业公司表示已对该楼道水管、阀门实施更换，后续物业公司工程部将持续关注。感谢您对政府工作的关心、理解和支持。
咨询淞南镇图书馆开放时间,上海市宝山区淞南镇人民政府,2023-09-01,https://xfb.sh.gov.cn/xinfang/yjzj/feedback/feedbackshow?id=95444FDF818444FD932456A2929E413E,咨询淞南镇图书馆开放时间,2023-08-16,反映淞南镇图书馆搬迁快8个月，新地址还在装修没有公布开放时间。去新地址看了两次还是未开放。咨询何时能开放。,2023-09-01,上海市宝山区淞南镇人民政府,毛同志：您于2023年8月2日致信咨询图书馆开放时间的来信收悉。现将处理情况回复如下：经与淞南镇社区文化中心了解，目前由于该处场地需要装修，预计2023年年底开放。特此告知。上海市宝山区淞南镇人民政府                                              2023年8月17日
松江南站施工扬尘问题,上海市松江区人民政府永丰街道办事处,2023-09-01,https://xfb.sh.gov.cn/xinfang/yjzj/feedback/feedbackshow?id=66B3C03D5A774474A8433DC275508E87,松江南站施工扬尘问题,2023-08-17,本人反映松江南站施工现场扬尘问题，希望有关部门加强监管。,2023-09-01,上海市松江区人民政府永丰街道办事处,简复告知书朱*同志：您好！您反映的关于松江南站施工扬尘问题事项收悉。经了解，现答复如下：已督促施工单位自8月21日起落实相关措施，对进出工地车辆做好冲洗，洒水车定时进行路面喷洒作业，切实减少路面扬尘。特此告知。上海市松江区人民政府永丰街道办事处2023年8月25日
律师以人查房,上海市自然资源确权登记局,2023-09-01,https://xfb.sh.gov.cn/xinfang/yjzj/feedback/feedbackshow?id=AA31C6DB00DE45B786FBE83570A466DF,律师以人查房,2023-08-10,"本人反映,请问已知对方身份信息，律师能否查询登记在其名下的房产？如果可以，需要哪些手续？",2023-09-01,上海市自然资源确权登记局,王*同志：您好！您来信反映的事项本机关已受理。经研究，现答复如下：根据《不动产登记资料查询暂行办法》第四条规定，不动产权利人、利害关系人可以依照本办法的规定，查询、复制不动产登记资料。不动产权利人、利害关系人可以委托律师或者其他代理人查询、复制不动产登记资料。权利人查询、利害关系人申请查询不动产登记资料应当提交的材料等相关规定，详见《不动产登记资料查询暂行办法》第八条、第九条、第三章、第四章等。不动产的利害关系人可以申请以下列索引信息查询不动产登记资料：（一）不动产具体坐落位置；（二）不动产权属证书号；（三）不动产单元号。律师受当事人委托申请查询不动产登记资料的，除提交《不动产登记资料查询暂行办法》第八条、第九条规定的材料外，还应当提交律师证和律师事务所出具的证明材料。律师持人民法院的调查令申请查询不动产登记资料的，除提交上述办法第八条规定的材料外，还应当提交律师证、律师事务所出具的证明材料以及人民法院的调查令。有关不动产登记资料查询的问题您还可以拨打962988不动产登记热线咨询。特此告知。上海市自然资源确权登记局2023年8月22日
咨询怎样申请地形图,上海市测绘院,2023-09-01,https://xfb.sh.gov.cn/xinfang/yjzj/feedback/feedbackshow?id=44FE7AFB13E04A7EB6407408E6295312,咨询怎样申请地形图,2023-08-07,您好，单位厂区要做设计规划，需要厂区带红线地形图，请问怎样申请。是否需要到政府单位窗口办理？到哪个单位办理？地址是哪里？谢谢！,2023-09-01,上海市测绘院,王**同志：您好！您咨询如何申请地形图的相关事项我院已收悉。经研究，现答复如下：我院可根据相关规定提供地形图及地下综合管线图等，具体可在一网通办上查看申请流程，通过线上提交申请材料或者线下携带相关材料至我院测绘成果成图窗口（普陀区武宁路419号）办理的方式，获取相关地形图。感谢您对测绘工作的关心和支持。特此告知。上海市测绘院2023年8月17日
绕城高速（同济路富锦路）缺入口,上海市交通委员会,2023-09-01,https://xfb.sh.gov.cn/xinfang/yjzj/feedback/feedbackshow?id=83E24D29024A4FF5840B5202A9FF92F9,绕城高速（同济路富锦路）缺入口,2023-06-22,"本人反映,吴淞大桥至富锦路高架没有直接汇入绕城极为不方便去嘉定区上班出行。本人认为,可以在富锦路月浦段增加一个绕城高速入口方便出行。",2023-09-01,上海市交通委员会,肖同志：您反映的信访事项已受理。经研究，现答复如下：目前，我们已经启动了沿江通道西延伸段改建工程的建设。根据工程的总体方案，将在G1503公路-蕰川路以西设置一对西向出入口，服务沿线地区居民往嘉定方向的出行，G1503公路南侧出口已于去年11月份通车，北侧入口正在施工，我们将督促建设单位加快工程建设，争取十四五期间建成通车，早日方便沿线居民出行。感谢您对交通行业工作的关心、理解和支持。上海市交通委员会2023年8月2日
25号线沿诸光路设站建议,上海市交通委员会,2023-09-01,https://xfb.sh.gov.cn/xinfang/yjzj/feedback/feedbackshow?id=1ADEF0AE68224605BCC4E6CEE4F3D7D6,25号线沿诸光路设站建议,2023-07-18,尊敬的相关负责领导及有关部门：   目前，国家会展中心作为上海建设国际贸易中心的重要载体和进口博览会的永久举办地，其周边轨道交通建设非常滞后，已严重影响各项大型展会的举办和交通保障。现状2号线，17号线为东西向的轨交通道，已经无法满足大型展会举办期间及附近社区居民的日常交通出行需求。在建的13号西延伸项目，在建成后也仅仅只能解决北向的交通需求。我们诚挚呼吁有关领导和部门能够尽快推进25号线的选线和建设工作。我们相信，通过25号线沿诸光路南北向轨交通道的建设，将国家会展中心、徐泾南、松江九亭、闵行七宝连接成紧密发展的交通和经济纽带，不仅能够全面改善国家会展中心及南部地区的交通条件，也将为西虹桥区域内及周边经济的发展和城市功能的提升提供强有力地支撑。     西虹桥商务区徐泾南部地区居民          2023 年 7 月,2023-09-01,上海市交通委员会,张同志：您反映的信访事项已受理。经研究，现答复如下：根据上海市2035城市总规，远期规划有轨道交通25号线工程。目前工程处于前期方案研究阶段，线路走向和具体车站设置正在深化研究中。对于您提出的相关的建议，市相关部门将予以认真研究，依据线路功能定位、客流预测、技术要求、工程实施条件等因素综合统筹确定。感谢您对上海交通工作的关心、理解和支持。上海市交通委员会2023年8月3日
优化浦东北部轨交路线的建议,上海市交通委员会,2023-09-01,https://xfb.sh.gov.cn/xinfang/yjzj/feedback/feedbackshow?id=971C308D9F18428FB6FD3EAF6A4064D4,优化浦东北部轨交路线的建议,2023-07-12,"本人反映,上海轨交20号线东延伸，21号线的走线图，均经过浦东新区外高桥-金桥地区，涉及高桥镇、高行镇、高东镇、金桥镇这4个浦东新区北部的重要街镇。规划上涉及森兰地区中心、新展城、申江路地区中心、金桥副中心等重要地区节点。但现行公布路线上对高行集镇及近期规划的新展城等人员密集地照顾欠佳。本人要求,根据实际需求，从大局出发，重新审定路线。",2023-09-01,上海市交通委员会,朱同志：您反映的信访事项已受理。经研究，现答复如下：您反映上海轨交20号线东延伸，21号线的走线图，对高行集镇及近期规划的新展城等人员密集地照顾欠佳，我们将结合上海市多层次轨道交通网络规划在后续工作中研究参考。感谢您对上海交通工作的关心、理解和支持。上海市交通委员会2023年8月2日
反映新上车牌无法安装E T C问题,上海公共交通卡股份有限公司,2023-09-01,https://xfb.sh.gov.cn/xinfang/yjzj/feedback/feedbackshow?id=7FC4447DB1A94B0EA31311BAA3E48714,反映新上车牌无法安装E T C问题,2023-08-08,"本人反映,我妻子于今年6月30日新装的车牌无法安装E T C，安装部门告知我原车牌没有取消，所以不能安装。本人要求,管理部门协助解决此事。",2023-09-01,上海公共交通卡股份有限公司,赵同志：您好！您反映的新车无非安装ETC的问题已收悉。经研究，现答复如下：我司客服人员在收到您的留言后，第一时间与您取得了联系，并就您遇到的问题做了解释沟通，就您遇到的问题进行了答复并提出了解决办法，您已表示理解和认可。感谢您对我司业务的持续关注和支持，我们将不断探索和研究更高效的服务方式，尽可能为用户提供更便捷的服务。上海公共交通卡股份有限公司2023年8月16日
建议增设公交站点 志丹路水闸博物馆,上海市道路运输管理局,2023-09-01,https://xfb.sh.gov.cn/xinfang/yjzj/feedback/feedbackshow?id=3E21D99D250A4932B5CF18DD636696B8,建议增设公交站点 志丹路水闸博物馆,2023-07-27,本人反映，志丹元代水闸遗址交通不便，方圆数百米没有公交站点本人认为，元代水闸博物馆作为重要文化地标，是上海地区地理历史反映的重点建筑，吸引很多游客来参观学习，本人建议，在博物馆门口或附近增设公交站点，让老人们，腿脚不利索者，也能方便来此参观，借此更多弘扬上海地理和历史文化，让更多人了解上海古迹。,2023-09-01,上海市道路运输管理局,薛同志：  您好！您关于公交行业的来信已收悉，经研究，现将处理意见答复如下：  根据本市公交线网优化调整相关规定，本市公交线路走向调整和站点迁移，需纳入公交线路线网调整计划，通过前期调研、相关部门会商、网上公示征询意见等流程，最终确定优化方案并实施。  您的建议将留作参考，在后续线网优化工作中，根据客流、道路等情况作统筹考虑。  感谢您对本市道路运输行业的关心和支持。                                     上海市道路运输管理局                                           2023年8月16日
