title,agency,date,links,标题,来信日期,信件内容,回复日期,回复单位,回复内容
消防设施安全隐患,上海市虹口区人民政府广中路街道办事处,2023-11-03,https://xfb.sh.gov.cn/xinfang/yjzj/feedback/feedbackshow?id=371F35E188FB4F26BCCE046E8F76D00E,消防设施安全隐患,2023-10-16,根据广中路街道对我小区居民的承诺，待美丽家园工程改建完毕后，将会对那些老旧灭火器箱子进行维护保养工作。但实际美丽家园工程早已结束，并未对大楼危险的消防设施进行更换或者改造。要求，街道房办尽快给出实施的时间表，不要拖延时间，谢谢虹口区政府的督导。,2023-11-03,上海市虹口区人民政府广中路街道办事处,柳同志：您好！您于2023年10月16日信访反映的事项已收悉。经了解，现同心路116弄1号楼电梯正在大修，导致未能及时对灭火器箱子进行维护保养，同时物业承诺，将会于12月底之前对楼栋内所有灭火器箱子及灭火器进行保养维护工作。广中路街道办事处2023年10月30日
施工噪音扰民,上海市普陀区建设和管理委员会,2023-11-03,https://xfb.sh.gov.cn/xinfang/yjzj/feedback/feedbackshow?id=50AFCC1EAA124715949BEB4FDFF6CA04,施工噪音扰民,2023-09-26,本人反映，金沙江路泾阳路在施工，未来街区小区门口可能是在铺设过街管道，扩建管道上支撑有问题，车辆驶过噪音非常大，24小时扰民。本人认为，施工方做支撑有问题，监管不到位。很简单的事，请尽快解决。,2023-11-03,上海市普陀区建设和管理委员会,邢同志：您好！您反映的信访事项本机关已受理。经研究，现答复如下：收到您的来信后，我委即要求普陀区市政水务管理中心认真调处。经现场调查，您反映的情况属实。该路段为市北燃气公司正在进行泾阳路（金沙江路-同普路）燃气管道改造工程施工，因受交通限制，采取夜间一体化施工作业。根据反映事项，该中心于10月9日约谈了市北燃气公司，要求其督促施工单位上海电力安装第二工程有限公司严格遵守夜间施工要求，落实文明施工措施。即日起启动整改措施：一是施工时遵守夜间施工文明措施，钢板规范覆盖；二是优化施工方案，在不影响出行的前提下提前施工，尽快结束工程，早日还路于民；三是加强与掘路监理沟通，要求其进一步加强夜间巡查，重点关注晚上十点钟以后施工作业是否严格落实文明施工措施，尽最大努力减少因施工对居民生活的影响。感谢您对我们工作的关心、理解和支持。上海市普陀区建设和管理委员会2023年10月20日
关于房屋交付问题,上海市崇明区住房保障和房屋管理局,2023-11-03,https://xfb.sh.gov.cn/xinfang/yjzj/feedback/feedbackshow?id=AB66DC3E6AC0426C9C431F3066EB628E,关于房屋交付问题,2023-09-22,来信咨询崇明**项目的交付时间问题。,2023-11-03,上海市崇明区住房保障和房屋管理局,钱（先生/女士）：您好！您反映的信访事项已收悉。经研究，现答复如下：为维护购房人合法权益，区委区政府正以坚定的信心和决心，全力督促项目公司推进项目建设。按照施工计划排布，结合复工建设实际情况，房屋将在符合相关规矩后竣工交付。特此答复。
扫地车声音吵,上海市奉贤区金汇镇人民政府,2023-11-03,https://xfb.sh.gov.cn/xinfang/yjzj/feedback/feedbackshow?id=B5DBA8B99F2E4EB2A19EA8F951B15AD1,扫地车声音吵,2023-10-26,本人反映，金汇镇百团路198弄，最近几周每天清晨六七点都会被街上的那种小型扫地车工作时始终伴有的持续的滴滴警报声吵醒。 本人建议，协调一下这个打扫的时间，最好在8点半或者九点以后。 ,2023-11-03,上海市奉贤区金汇镇人民政府,李同志：您好！经金汇镇乐苑居民筹备组核实，您反映的小型扫地车是第三方特种清扫车辆，其工作操作时间是按照其行业操作规程，清扫车的音量分贝为出厂设置。感谢您对政府工作的支持与监督。
婚介公司纠纷,上海市徐汇区民政局,2023-11-03,https://xfb.sh.gov.cn/xinfang/yjzj/feedback/feedbackshow?id=FFFB57AF1C924DD88FCC070DD372FD6F,婚介公司纠纷,2023-10-25,"本人反映,上海未来可期婚姻介绍服务有限公司存在严重欺诈消费者行为。本人要求,退还我全款，我不追究赔偿。对该机构进行严查和监管，避免更多的消费者陷入骗局。对所有包含我个人信息的资料进行销毁，并承诺不再非法买卖及公开，否则追究赔偿。",2023-11-03,上海市徐汇区民政局,马**同志：您反映的信访事项本机关已受理。经研究，现答复如下：您反映上海未来可期婚姻介绍服务有限公司存在严重欺诈消费者行为，您要求上海未来可期婚姻介绍服务有限公司全额退费。本机关秉承着群众利益为先的原则，向上海未来可期婚姻介绍服务有限公司核实沟通。根据合同约定情况，公司最初表示需要扣除4800元和百分之30的违约金，退回其余费用。后经过本机关工作人员反复沟通协调、对接双方，最后该公司表示愿意退回扣除服务费4800元和百分之15的违约金以外的费用，并表示公司会有专人对接此事。感谢您对民政工作的关心、理解和支持。上海市徐汇区民政局2023年11月1日
空调外机噪音扰民,上海市静安区人民政府大宁路街道办事处,2023-11-03,https://xfb.sh.gov.cn/xinfang/yjzj/feedback/feedbackshow?id=1E1D88A9F0A8434C92D3341810EA38EB,空调外机噪音扰民,2023-09-14,"本人反映,大楼对面的空调外机发出声音严重影响居民的日常生活，噪音过于严重，白天都能听的非常明显，晚上导致靠近的房间无法住宿睡眠！本人要求,解决空调外机噪音问题，尽快处理，还居民安静的环境。",2023-11-03,上海市静安区人民政府大宁路街道办事处,居民同志：您反映的信访事项本机关已受理。经研究，现答复如下：您反映对面空调外机发出声音对居民生活造成了严重噪音干扰，影响正常休息。经了解，收到您反映的问题后，街道相关部门到实地查看，约谈当事人，当事人表示预计一个月内将对该处空调外机加装护罩，降低噪音。感谢您对社区工作的关心、理解和支持。
工程噪音扰民,上海市静安区建设和管理委员会,2023-11-03,https://xfb.sh.gov.cn/xinfang/yjzj/feedback/feedbackshow?id=064ED6C20E58463895F3677D6B298088,工程噪音扰民,2023-08-26,本人反映小区附近工程在早上六七点就开始施工，噪音扰民，通知施工会进行到明年，虽贴出告知早上不会使用大型机械制造噪音，使用小型机械。本人认为，市政工程虽为利民项目，为人民谋福利，但需要控制噪音尽可能减少扰民。本人要求，该项目减少噪音扰民。,2023-11-03,上海市静安区建设和管理委员会,居民同志：您来信反映的信访事项本机关已受理。现答复如下：经核实，该处为市排水公司的工程。收到您的来信后，我委第一时间将该情况与市排水公司做了沟通，要求施工单位尽可能通过使用环保静音的机械设备来减少噪声。另外，材料装卸、余土外运、沟槽修复等施工环节也尽可能少用机械，多用人工，最大限度减少对周边居民日常生活的影响。感谢您对我委工作的关心、理解和支持。
感谢信,上海市闵行区卫生健康委员会,2023-11-03,https://xfb.sh.gov.cn/xinfang/yjzj/feedback/feedbackshow?id=6DB049DCF68C4317AEA82B933A21AB2B,感谢信,2023-10-27,"本人反映,尊敬的上海市卫生局领导：我是本市的居民，今天写这封感谢信，主要是感谢闵行中心医院急诊科接诊医生（不知道接诊医生的姓名），抢救室医生，急诊科二楼病房主任以及他俩带领的全体医护人员团队表示衷心感谢，特此写这封感谢信。我89岁的老母亲于9月11日傍晚突然血压升高至180，呕吐，紧急送往家附近的闵行中心医院，急诊科医生检查后发现她高烧38.7℃，经血检肝功能指标高达1130，急诊医生诊断是肝衰竭，于是立即起身将我母亲送往抢救室救治。在急救室为我母亲治疗的医生当场开出病危告知，当时我脑子一片空白，感觉到恐怖。医生耐心跟我做科普解释，鉴于我母亲当时的危险状况，医生说一定会尽力抢救，尽管我拒绝一切创伤性抢救（不想让我母亲受痛苦）。抢救室这一晚上，让我感受到闵行医院的医生护士的素质真好，尤其对病人的态度，因为当时我母亲已经陷入意识模糊，不配合治疗，自己将吊水的针头拔掉，护士也没有怨言，一次次地重新给我母亲扎针。第二天（12号）上午我母亲被送入急诊室二楼病房，急诊病房主任带领的医生护士和护工团队，他们全心全意为病人服务而努力付出的精神让我感动！那种人性化的服务非常温暖我的内心。我母亲当时的情况是非常危险的，她当时意识模糊、不配合治疗、时常胡言乱语，不肯吃喝，还小便失禁，所以我当时的心情是非常着急的。进入病房第一位跟我沟通的医生非常有耐心地跟我解释母亲的病因，一位护士也是不厌其烦跟我解释我母亲的病情与注意事项，还有护工阿姨细心照顾我母亲，就像对待自己的长辈一样，真心让我感受到温暖与关怀。仅仅两天时间，在医生护士的精心治疗下，我母亲的肝功能就从1130下降了一半，当主任告诉我时我高兴的心情难以用语言表达，心里的一块大石头终于落地，因为我母亲有救了，她的病情有好转了。闵行中心医院的医生精湛的医疗技术一点不比上海市区的三甲 医院逊色！9月18号中午主任查房时跟我说，我母亲的肝功能已经降到130了，那个时候我内心感到非常温馨，仅仅一个星期就可以治愈她的肝衰竭，将我母亲从死亡线上拉回来，我感叹我们国家的医疗技术与医疗科技。9月21号我母亲出院的时候大小便还处于失禁的状态，但是她的生命威胁已经没有了， 生命体征是平稳的。虽然出院后我们又经过天山中医医院的康复治疗后，现在我母亲已经基本恢复健康，大小便也恢复正常了。但我今天要以真诚的心写信感谢上海闵行中心医院急症科的主任以及他们俩带领的医护团队，感谢他们挽救了我母亲的生命，真心感谢闵中心急诊科的医护工作者忠于职守，不辞辛苦的耐心与爱心！！",2023-11-03,上海市闵行区卫生健康委员会,周同志：您好！我院已接到您的信访表扬信，感谢您认可我院提供的医疗服务并高度赞扬我院医务人员。您在信中提到的表扬我院急诊科全体医护团队，我们将通过医院内网、微信公众号等形式对以上个人和集体进行红榜表彰。今后，我院将继续做好医疗救治工作，保持并不断提升医疗服务质量，为人民群众健康保驾护航！感谢您对我院工作的理解和支持！祝您和家人身体健康！万事如意！
关于门诊就医记录,上海交通大学医学院附属第九人民医院,2023-11-03,https://xfb.sh.gov.cn/xinfang/yjzj/feedback/feedbackshow?id=75C0835C61A34E6EA0121EC79C36FA56,关于门诊就医记录,2023-10-03,"本人反映,本人在2015年-2018年 在上海九院（西藏南路）整复外科多次就医 ，现在想要就医记录 。本人认为,法律规定 门诊就医记录至少保存15年，九院应该保存并提供给我我的就医记录本人要求,九院提供2015-2018年的所有门诊就医记录",2023-11-03,上海交通大学医学院附属第九人民医院,陆同志：您反映的信访事项已受理。经研究，现答复如下：您要求提供您在我院2015至2018年间的所有门诊就医记录。经了解，根据《医疗机构病历管理规定》第三章第十条规定：门（急）诊病历原则上由患者负责保管。根据您的姓名和身份证号码查询，您在2015至2018年期间，在我院激光美容、神经内科、消化内科和整复外科均有挂号记录，但鉴于当时我院实行的是手写门诊病史，病历本均按上级要求由患者自行保管，因此我院无法提供您的详细门诊病史记录，仅可以根据系统查询结果提供在此期间您的就诊记录，请您带好您的身份证原件来我院领取。以上答复内容已于2023年10月10日与您沟通，您表示接受。非常感谢您对我们工作的支持和理解！上海交通大学医学院附属第九人民医院2023年10月10日
社保转移,上海市人力资源和社会保障局,2023-11-03,https://xfb.sh.gov.cn/xinfang/yjzj/feedback/feedbackshow?id=63F6ECFF2CD24B7382AAA32811209F9A,社保转移,2023-10-14,本人反映，想将2013在上海上班缴纳社保转移出去，网上显示转出地无参保人关系，随申办一网申办打印不了凭据。,2023-11-03,上海市人力资源和社会保障局,胡同志：    您好！经查询社保系统，您于2013年4月--10月在******公司缴费，未办理过转移接续。2023年10月24日下午，工作人员电话联系您本人，您表示将广东的社保转回老家江西，但上海的转移出错，显示转出地无参保人员信息，且无法打印参保缴费凭证，无法办理转移。    后工作人员主动联系九江濂溪社保中心，经沟通同意您本人前去柜面申请，由当地直接发送转移联系函至上海社保，为您办理。    经协调，您于10月25上午去九江濂溪社保中心柜面申请成功。经查看，确已上网至上海社保，业务分配至青浦分中心已操作。同时对您网上无法操作转移显示出错问题，已上报运维平台由数据部门进行筛查。    此复。
九院食堂气体排放影响周围居民生活,上海交通大学医学院附属第九人民医院,2023-11-03,https://xfb.sh.gov.cn/xinfang/yjzj/feedback/feedbackshow?id=CEAE784E8D9644578DCC821BBCCD208A,九院食堂气体排放影响周围居民生活,2023-09-09,"本人反映, 位于制造局路的上海第九人民医院食堂高压气体排放未按规定接入合理的管道，直接排向一墙之隔的明珠家园2号楼。本人认为,影响周围居民群众正常生活，请有关部门检查、督促整改，谢谢！",2023-11-03,上海交通大学医学院附属第九人民医院,林同志：您反映的信访事项我院已受理。经研究，现答复如下：您来信反映我院食堂高压气体排放发出噪音，对周边居民日常生活有影响，来信要求核实并给予答复。收到您的来信，我院管理部门安排人员进行现场勘查，经核实产生噪音是由我院食堂蒸汽管道坏损造成，管理部门现已进行修理。目前我院食堂正在进行改造，给周边居民日常生活带来影响实在抱歉。后续医院管理部门将改进工作，进一步减少对周边居民的影响。2023年9月28日，我院工作人员与您沟通解释，也感谢您对我院工作的支持和监督。上海交通大学医学院附属第九人民医院2023年9月29日
确认业委会换届改选进展事宜,上海市松江区洞泾镇人民政府,2023-11-03,https://xfb.sh.gov.cn/xinfang/yjzj/feedback/feedbackshow?id=9BECB2DC149A4E5094CB9EE5CE8DDF9E,确认业委会换届改选进展事宜,2023-10-21,本人反映，于今年7月2日下午同多位业主，在业委会接待日向业委会提出查阅3项基础文件，包括《管理公约》、《业主大会议事规则》和《专项维修资金管理规约》，但当天只提供《专项维修资金管理规约》资料，其它未提供，同时也了解到本届业委会任期结束时间为2023年12月30日。本人认为，根据《上海市住宅物业管理规定》相关要求，小区业委会应该进入换届改选流程。本人要求，这届业委会提供《管理公约》、《业主大会议事规则》等两份资料，并确认业委会是否已经启动换届程序？若已启动，请告知业委会提出相关书面报告的日期，并提供相关资料。,2023-11-03,上海市松江区洞泾镇人民政府,简复告知书王同志：您好！您信访反映的关于确认业委会换届改选进展事宜的事项，已收悉。经了解，该小区的《管理公约》和《业主大会议事规则》可向小区业委会或者洞泾镇城市建设管理事务中心进行咨询。同时，该小区业委会近期已提供换届申请书面报告，但目前换届程序暂未启动。特此告知。上海市松江区洞泾镇人民政府2023年10月24日
社区民警离开业主群,上海市松江区洞泾镇人民政府,2023-11-03,https://xfb.sh.gov.cn/xinfang/yjzj/feedback/feedbackshow?id=6EA99720610842958C99A538D4292170,社区民警离开业主群,2023-10-23,本人反映，社区民警姚警官被移出所在楼道微信群。本人认为，年关将近，正是各种诈骗份子活跃的时间，将社区民警移出楼道微信群的做法不妥。本人要求，有关部门作出解释。,2023-11-03,上海市松江区洞泾镇人民政府,简复告知书赵*同志：您好！您于2023年10月23日信访反映的事项收悉。经了解，社区民警姚警官一直以来都较好的配合社区做好维稳、反诈宣传等相关工作，目前其正常开展社区警务工作。感谢您对社区工作的关心，后续居委会与社区民警将进一步加强协作，为社区提供更好的服务。特此告知。上海市松江区洞泾镇人民政府2023年10月26日
增设篮球场等运动设施的建议,上海市松江区人民政府中山街道办事处,2023-11-03,https://xfb.sh.gov.cn/xinfang/yjzj/feedback/feedbackshow?id=AE1A289FA8C94182AA0C12A6FB5D5279,增设篮球场等运动设施的建议,2023-10-23,本人反映，松江新城中山街道内居住着大量的年轻居民，加之又有很多青少年，但街道内，包括万达附近大草坪公园、九龙湖公园等这类大公园内，都没有一个篮球场和其他运动设施，而附近的学校内和其他单位内又不对外开放。本人要求，建议在公园内建设一些篮球场等运动设施，供市民和青少年运动，进一步提高青少年的综合体育素质。,2023-11-03,上海市松江区人民政府中山街道办事处,简复告知书傅女士：您好！您网信反映的关于增设篮球场等运动设施的建议事项已收悉。经了解，中山街道目前现有68处室外健身点，在光星路体育公园内有一处公共篮球场、两处市民健身房，均免费开放；并有106处经营性体育场馆，商务区附近部分场馆都有公益时间段开放，市民还可以通过“keepin中山”线上小程序参加体育活动积分兑换场馆消费券，进行体育健身。感谢您对社区文体工作的关心与支持。上海市松江区人民政府中山街道办事处2023年10月27日
空调外机噪音扰民,上海市静安区人民政府大宁路街道办事处,2023-11-03,https://xfb.sh.gov.cn/xinfang/yjzj/feedback/feedbackshow?id=43110B0FA0EB4EAF8E3067B0FF389C92,空调外机噪音扰民,2023-09-14,"本人反映,本人居住大楼对面安装的空调外机对本人居住区的居民生活造成了严重噪音干扰，影响正常休息。本人小区居委会工作人员在今年四五月份先后两次找到当事方，但对方一直推脱，现空调外机的噪音日益严重，问题迟迟不能解决。本人要求,尽早解决此问题，还本小区居民一个安静的生活环境。",2023-11-03,上海市静安区人民政府大宁路街道办事处,居民同志：您反映的信访事项本机关已受理。经研究，现答复如下：您反映对面空调外机发出声音对居民生活造成了严重噪音干扰，影响正常休息。经了解，收到您反映的问题后，街道相关部门立即到实地查看，并约谈了当事人，向其宣传相关法规，要求其采取措施避免扰民情况的发生。当事人表示预计一个月内将对该处空调外机加装护罩，降低噪音。感谢您对社区工作的关心、理解和支持。
完善道路清扫问题,上海市闵行区吴泾镇人民政府,2023-11-03,https://xfb.sh.gov.cn/xinfang/yjzj/feedback/feedbackshow?id=B46C37DBCB754811B966D54F4012B893,完善道路清扫问题,2023-10-20,您好，我反馈问题：上海市闵行区莲花南路（放鹤路-金都路）上，总是早上8点-9点，有清扫车辆占用非机动车道，导致上班人群无法正常通过（由于车辆形式缓慢），路过骑车人群很危险，建议车辆错开早高峰时间（早上7-9点），请重视一下，谢谢！,2023-11-03,上海市闵行区吴泾镇人民政府,周同志：您好！吴泾镇人民政府于2023年10月20日收到了您反映早高峰莲花南路（放鹤路-金都路）有清扫车辆占用非机动车道的事项。经向上海吴泾环卫综合服务有限公司了解，在条件允许的情况下公司将该路段作业时间适当调整，安排在每天早上6点前及9点半以后，避开早高峰时间，避免影响市民出行。感谢您对城市管理工作的关心、支持和理解。特此告知。
对系统提出建议,国家税务总局上海市奉贤区税务局,2023-11-03,https://xfb.sh.gov.cn/xinfang/yjzj/feedback/feedbackshow?id=E5D8CDACD9CB40BDBD5E8108105A60CB,对系统提出建议,2023-10-09,"本人要建议,个人所得税实名制2.0系统，升级为一年只需要点击一次邀请确认。",2023-11-03,国家税务总局上海市奉贤区税务局,留作参考告知书陈某某同志：您好！您来信反映的建议已收悉。该事项无需一月一确认，工作人员已电话告知您相关解决办法。您在试点过程中提出的问题与建议已向上级相关部门反馈，我们将在工作中予以参考，系统将在后期不断升级优化。感谢您对税收工作的关心、理解和支持。特此告知。国家税务总局上海市奉贤区税务局2023年10月18日
