title,agency,date,links,标题,来信日期,信件内容,回复日期,回复单位,回复内容
加装电梯相关问题,上海市徐汇区人民政府徐家汇街道办事处,2023-10-09,https://xfb.sh.gov.cn/xinfang/yjzj/feedback/feedbackshow?id=AEB5A392B4CA4FC6A6B75BE2D0F74408,加装电梯相关问题,2023-09-03,反映宜山路**弄*号加装电梯，自从5月底停工至今一直没有开工，希望领导重视，早日让居民能享受政府带来的福利。,2023-10-09,上海市徐汇区人民政府徐家汇街道办事处,高**同志：您反映的信访事项本机关已受理。您反映宜山路**弄*号加装电梯，自从5月底停工至今一直没有开工，希望领导重视，早日让居民能享受政府带来的福利。现答复如下：考虑到居民加装电梯的迫切需要和降低后续不可预见之风险，经街道与现代电梯公司和申湖公司沟通协商，8月25日申湖公司与现代电梯公司签订南丹小区既有多层住宅加装电梯工程项目移交协议，宜山路**弄*号加梯项目移交现代电梯公司管理。现代电梯公司派高级工程师和工程项目监理对宜山路**弄*号加梯项目现状进行了评估，并提出整改要求，9月份施工单位主要进行整改工作，下阶段10月份将进行外立面铝扣板的安装，现外立面材料已经进场。预计整个加梯工程春节前完工，街道加梯办、属地居委会持续跟进关注加梯工程进度，会同现代电梯公司将宜山路**弄*号加梯工程妥善完成，早日让居民们用上电梯。感谢您的关心、理解和支持。上海市徐汇区人民政府徐家汇街道办事处2023年10月9日
申请取消田林13村东北角凉亭建设,上海市徐汇区住房保障和房屋管理局,2023-10-09,https://xfb.sh.gov.cn/xinfang/yjzj/feedback/feedbackshow?id=7580BA5CB2984750AB1A665FB387CF9C,申请取消田林13村东北角凉亭建设,2023-08-29,上海徐汇区田林13村于2022年开展老旧小区改造工程，期间擅自改变地块属性，将位于最东北角的8号楼原本属于绿化带的地块，以老旧小区改造为名建筑违章建筑，将靠近8号楼很近的位置建筑钢结构水泥凉亭，正对居民卧室、卫生间，视觉上造成极大的不适，同时凉亭与8号楼之间的距离，建筑，向居委会了解未取得建设用地许可证和建设工程规划许可证而建设，该建筑建成后影响正常的视野、通风、采光、和日照，并对居民的卫生间，卧室内部情况充分曝光，建成后休息健身、聊天、溜狗等情况将严重影响正常的居民休息，如此近距离未来投入使用，会产生各类躁声，将白天黑夜不间断持续造成侵害。老旧小区的改造应当是在以居民的生活改善为出发点，而不是拍拍脑袋有空地想放什么就放什么。另，8号楼是本小区位于最北处的最后一栋，小区无东北门，不会产生走100米以上的距离到人家窗户下去纳凉的需求，小区位于中心地带有专门的活动区域，足够建设各类休闲涉老设施，小区200米内就有一个大型绿地。作为居委会、业主委员会应当正视问题，要将老旧小区“改的精准”“改的舒心”“改的实效”。特此正式推出诉求，停止建设田林13村东北角凉亭建造，恢复绿化带，维护原住居民正常生活权益。,2023-10-09,上海市徐汇区住房保障和房屋管理局,答复意见书徐女士：您的来信我单位已收悉，您反映小区于2022年开展老旧小区改造工程，将位于8号楼附近的绿化带，改造为违章建筑，建设凉亭等，该建筑建成后影响正常的视野、通风、采光、和日照，并对居民的生活和隐私造成困扰。希望停止建设田林十三村东北角凉亭，恢复绿化带，维护居民的正常生活权益。据核查，田林十三村目前正在进行田林十三村屋面及相关设施改造工程，按照上海市住宅修缮工程管理办法，设计单位在前期和三驾马车对接后，编制了修缮设计方案，并进行了修缮内容的确认和公示，您提出的特殊诉求经与三驾马车沟通协调，靠近居民家附近的凉亭移到尽量少影响居民生活的位置，原方案准备放置的健身器材取消，减少人员的聚集对附近居民造成的影响。感谢您对我局工作的理解和支持。上海市徐汇区住房保障和房屋管理局2023年9月15日
建议尽快启动完成宛南五村旧改,上海市徐汇区住房保障和房屋管理局,2023-10-09,https://xfb.sh.gov.cn/xinfang/yjzj/feedback/feedbackshow?id=3692977A5D4B42289139848E581589A0,建议尽快启动完成宛南五村旧改,2023-09-07,今年以来，宛南一二三四、六村龙华新村相继完成了小区旧改造整治，房屋立面和周围道路焕然一新。唯独夹心地带宛南五村迟迟没有动静，显得格外不协调不均衡。老小区年久失修极易造成安全隐患，建议政府尽早启动五村旧改，实现片区面子里子全面高质量改造提升。,2023-10-09,上海市徐汇区住房保障和房屋管理局,尤同志：您好！您提出宛南五村年久失修易造成安全隐患，要求有关部门尽快实施方案的建议事项收悉。经查，宛南五村已纳入2023年修缮计划，目前已取得开工审核单，在做临时设施搭设及车辆协调等施工进场准备工作，拟计划9月底进场施工。特此告知。上海市徐汇区住房保障和房屋管理局2023年9月11日
感谢信,上海市徐汇区住房保障和房屋管理局,2023-10-09,https://xfb.sh.gov.cn/xinfang/yjzj/feedback/feedbackshow?id=939BC9831EC44B729968C0B7C2149549,感谢信,2023-09-15,尊敬的各位上海市相关领导：你们好!本人怀着无比崇敬、感激的心情写下这封信，市政府各级领导真的是实实在在为人民服务。事由今年9月11日来信参与了‘上海市征集2024年为民办实事项目’的来信投稿，阐述了一些市民问题及建议。其中有小区出口人行道路坑洼雨天难行，没想到的是当天就有市政的工作人员来开建施工整修路面，着实让我切身感受了一把中国速度，上海速度，徐汇速度。加之最近几天上海接连阴雨，但是有了市府各级领导同志的关心和市政工作人员的努力，让市民的心情是阳光明媚的。路面修缮之后市民出行就有了安全保障，市民也更体会到了习总书记说的‘人民城市人民建，人民城市为人民’讲话精神。特此由衷的感谢‘中共上海市委、上海市人民政府’、‘中共徐汇区委、徐汇区人民政府’、‘ 上海市征集办’以及其他相关部门的同志，祝你们身体健康再往后的工作中一切顺利，更好的把上海这座城市建设成祖国的标杆。,2023-10-09,上海市徐汇区住房保障和房屋管理局,李**同志：您好！您于2023年9月15日的感谢信已收悉。感谢您对我局工作的理解和支持。特此告知。上海市徐汇区住房保障和房屋管理局2023年9月15日
徐汇区南交小区改建不合理,上海市徐汇区住房保障和房屋管理局,2023-10-09,https://xfb.sh.gov.cn/xinfang/yjzj/feedback/feedbackshow?id=F764B8CBBFAE4FAB83BCEB6DE44907A4,徐汇区南交小区改建不合理,2023-09-09,"本人反映,徐汇区南交小区改建方案极其不合理。原来8幢4层三门楼居民楼被改建成三栋11层小高层，但是仅有一幢楼安置原居民，导致安置楼尽然是2部电梯每层11户居民本人认为,这是有极大安全和消防管控隐患的。和上海国际大都市的地位也是背道而驰。作为一个利国利民的政府扶持项目，不应该这样仅仅是计算经济利益，进而不择手段的坑害上海市居民本人要求,能够从上海市的形象出发，从建筑安全居住安全的百年大计出发，更好地优化居民安置楼设计，不要求更多的户型面积之类的利益 而是希望方便居民生活，小区管理的角度，让居住在这小区的居民能够安居乐业，毕竟这个小区的居民绝大多数都是老人，只有二部电梯安置高达168户居民，影响进出安全。",2023-10-09,上海市徐汇区住房保障和房屋管理局,答复意见书薛先生：您反映问题的信访件已收悉，您反映南交小区重建工程给出的设计方案不合理，存在极大安全和消防管控隐患。答复如下：经查，南交小区旧住房更新改造项目中新建的三幢住宅建筑中均安置了原居民，并不存在仅有一幢楼安置原居民的情况。针对您所述的“2部电梯每层11户居民存在极大安全和管控隐患”的情况，根据《住宅设计标准》DGJ08-20、《上海市旧住房拆除重建设计导则》等建筑设计规范中关于电梯设置的要求，本项目电梯设置符合规范。感谢您对我们工作的关心、理解和支持。上海市徐汇区住房保障和房屋管理局2023年9月22日
华发小区监控问题,上海市徐汇区华泾镇人民政府,2023-10-09,https://xfb.sh.gov.cn/xinfang/yjzj/feedback/feedbackshow?id=1E2A0CB266D74CC3855B1CE253F7215F,华发小区监控问题,2023-08-19,本人反映华发路180弄华发小区从去年修路开始小区监控无法使用，我认为威胁到到小区安全，请求尽快恢复,2023-10-09,上海市徐汇区华泾镇人民政府,徐**同志：您反映的信访事项本镇已受理。您反映华发小区从去年修路开始小区监控无法使用要求尽快恢复。经研究，现答复如下：经了解，华发小区监控设施已纳入今年华泾镇技防设施改造项目，预计将于年底前进行统一更新。感谢您对本镇社区工作的关心、理解和支持。上海市徐汇区华泾镇人民政府2023年10月8日
小区车库质量问题,上海市宝山区建设和交通委员会,2023-10-09,https://xfb.sh.gov.cn/xinfang/yjzj/feedback/feedbackshow?id=31A9A948D83B4CD691E3ECB7D487D3A8,小区车库质量问题,2023-08-31,来信希望开发商尽快解决小区地下车库裂痕及墙体霉变等相关问题。      ,2023-10-09,上海市宝山区建设和交通委员会,江同志：您于8月31日反映宝山区海上菁英小区车库地面出现了裂缝、墙体霉变等相关问题，该来信我委已收悉。经调查，现答复如下：针对车库地坪开裂问题，经8月17日上海市建筑科学研究院有限公司（检测机构）现场查看，及9月1日我委现场协调，达成一致意见如下：9月由上海市建筑科学研究院有限公司出具车库地坪开裂分析报告，之后根据该分析报告制定2至3个整改维修方案，并根据方案制作2至3个维修样板区。待样板由业主观察检验2个月后，由业主代表选定最终方案，最后根据方案进行大面积维修。地库墙体霉变问题由本市梅雨季潮湿引起，非工程质量问题，后续将在地坪维修期间进行铲除修复。后续我委工作人员将持续保持事件跟进。感谢您对我们工作的关心、理解和支持。特此答复。上海市宝山区建设和管理委员会2023年9月13日
反映违章建筑和敲承重墙问题,上海市宝山区顾村镇人民政府,2023-10-09,https://xfb.sh.gov.cn/xinfang/yjzj/feedback/feedbackshow?id=EBB6BA9E51B44128B76840A7AC61D4C4,反映违章建筑和敲承重墙问题,2023-08-23,反映泰和西路3493弄南区83号101室违章建筑敲承重墙，要求查处。											,2023-10-09,上海市宝山区顾村镇人民政府,陈同志：您好！您于2023年8月23日反映泰和西路3493弄南区83号101室违章建筑敲承重墙，要求查处的来信已收悉。现答复如下：关于您反映该户破坏承重墙的问题，经镇综合行政执法队核实，前期接到您反映上述地址有损坏房屋承重结构的情况后，已联系第三方检测机构工作人员前往上述地址检测，目前经检测未发现损坏承重结构情况，出具承重结构检测报告。第三方检测机构为上海宝钢集团房屋质量检测站。关于您反映该户搭建违章建筑的问题，经镇综合行政执法队核实，该户天井处有存量违法建筑，镇综合行政执法队拟对该处附有违法建筑的房屋进行房产注记，相关资料已递交宝山区城管执法局审核。感谢您对我镇综合行政执法队工作的关心、理解和支持。特此回复。上海市宝山区顾村镇人民政府2023年9月8日
小区围墙外空地整改,上海市宝山区罗店镇人民政府,2023-10-09,https://xfb.sh.gov.cn/xinfang/yjzj/feedback/feedbackshow?id=E744B7D91C064FDDB421A050E1969249,小区围墙外空地整改,2023-09-01,信访人反映美罗家园鼎苑围墙外空地糟乱差，建议加强整治。,2023-10-09,上海市宝山区罗店镇人民政府,朱同志：您于2023年9月1日反映美罗家园鼎苑围墙外空地糟乱差，建议加强整治的事项已收悉。现答复如下：经了解，该地块（0319-07）位于杨南路南侧、罗智路西侧，西、北两面与鼎苑小区接壤，目前项目处于待立项状态。针对来信人反映的地块糟乱差问题，经罗星公司工作人员于2023年9月7日实地查看，存在有人员开垦种菜等问题。为保障周边小区居民的生活环境，9月20日、21日，罗星公司已安排工作人员对该地块进行了整治。感谢您对罗店镇环境整治工作的关心、理解和支持。特此告知。上海市宝山区罗店镇人民政府  2023年9月15日
小区充电桩安装问题,上海市宝山区杨行镇人民政府,2023-10-09,https://xfb.sh.gov.cn/xinfang/yjzj/feedback/feedbackshow?id=08728EEC8AF842249CE5E74FC694B7E8,小区充电桩安装问题,2023-08-25,宝启花园小区正在安装新能源车充电桩，离一楼卧室太近，要求留出安全距离。,2023-10-09,上海市宝山区杨行镇人民政府,王同志：您好！您于2023年8月25日反映宝启花园小区正在安装新能源车充电桩，离一楼卧室太近，要求留出安全距离的事项本机关已收悉，现将处理意见答复如下：经社建办、物业服务指导中心实地查看、核实了解相关情况，已建议小区物业从实际情况出发，在充电桩安装选址时，综合考虑多方因素，合理制定安装方案。目前，小区物业已搁置充电桩安装项目。之后，小区物业将与业委会、居委会、居民代表等通过召开联席会议的方式，共同商讨小区安装新能源充电桩的事宜，在选址上做好调研、征询工作后，逐步推进实施。感谢您对我们工作的关心、理解和支持。特此回复。上海市宝山区杨行镇人民政府2023年9月18日
产权登记问题,上海市静安区住房保障和房屋管理局,2023-10-09,https://xfb.sh.gov.cn/xinfang/yjzj/feedback/feedbackshow?id=F5534FC8342547FD9A4B6C15AE464F64,产权登记问题,2023-09-19,反映：该房屋为青云路350弄一期小区，办理两个车位产权车位登记，窗口经办人员告知缺少开发商提供的车位配比资料，无法办理登记，但小区内已多户业主已办理完成登记业务。要求确认是否能办理该业务。,2023-10-09,上海市静安区住房保障和房屋管理局,居民同志：您反映的信访事项，我单位已处理完毕。我单位接单后，于2023年9月21日10:30联系了您，对该问题进行了沟通解释。根据《上海市住宅物业管理区域机动车停放管理规定》沪房规范【2021】11号第四条，住宅物业管理区域内，建设单位所有的机动车停车位数量少于或者等于物业管理区域内房屋套数的，一户业主只能购买或者附赠一个停车位；超出物业管理区域内房屋套数的停车位，一户业主可以多购买或者附赠一个。该小区青云路350弄一期和二期为一个整体，有部分汽车库，尚未完成车位的分割。所以目前暂时只能购买一个车位。感谢您对我们工作的理解和支持。
预看房,上海市嘉定区建设和管理委员会,2023-10-09,https://xfb.sh.gov.cn/xinfang/yjzj/feedback/feedbackshow?id=67BA3658B3744B7590302A64F21FD312,预看房,2023-09-05,本人反映，2023 年 9 月 1 日 20:45 由开发商上海客户服务微信公众号上发出的《大境初呈 共鉴美好 |温馨告知函》的文章内容开放参观。本人认为，本次参观不具备预看房的前提条件，本人要求，必须要求开发商整改好所有质量问题后，再以正规流程向政府申报预看房。,2023-10-09,上海市嘉定区建设和管理委员会,余同志：您信访反映的事项已收悉，我委高度重视，现就您反映的情况答复如下：经核实，依据上海市建设工程安全质量监督总站《本市新建住宅工程“业主房屋质量预看房”制度(试行)》和《“业主房屋质量预看房”工作指南》等文件要求，我委第一时间约谈开发商，要求取消原定的预看房活动，并要求建设单位严格比对预看房工作的前提条件和实施要求，切实履行建设单位质量首要责任，抓紧完成相关工作，严格程序，做好充分准备组织开展好预看房工作。该项目已于9月13日至9月20日启动预看房，时间结束后，涉及部分业主没有看房的，我委也督促开发商进行一对一联系。感谢您对我们工作的理解和支持！特此回复。上海市嘉定区建设和管理委员会2023年9月25日
预看房存在问题,上海市嘉定区建设和管理委员会,2023-10-09,https://xfb.sh.gov.cn/xinfang/yjzj/feedback/feedbackshow?id=1DB9DBC3775A4D19B7BF27A9A4A007CF,预看房存在问题,2023-09-04,本人反映，2023 年 9 月 1 日 20:45 由开发商上海客户服务微信公众号上发出的《大境初呈 共鉴美好 |温馨告知函》的文章内容开放参观。本人认为，本项目并未完成分户验收及质量问题整改完毕，本次参观不具备预看房的前提条件。本人要求，开发商整改好所有质量问题后，再以正规流程向政府申报预看房。,2023-10-09,上海市嘉定区建设和管理委员会,吴同志：您信访反映的事项已收悉，我委高度重视，现就您反映的情况答复如下：经核实，依据上海市建设工程安全质量监督总站《本市新建住宅工程“业主房屋质量预看房”制度(试行)》和《“业主房屋质量预看房”工作指南》等文件要求，我委第一时间约谈开发商，要求取消原定的预看房活动，并要求建设单位严格比对预看房工作的前提条件和实施要求，切实履行建设单位质量首要责任，抓紧完成相关工作，严格程序，做好充分准备组织开展好预看房工作。该项目已于9月13日至9月20日启动预看房，时间结束后，涉及部分业主没有看房的，我委也督促开发商进行一对一联系。感谢您对我们工作的理解和支持！特此回复。上海市嘉定区建设和管理委员会2023年9月22日
关于房屋问题,上海市浦东新区祝桥镇人民政府,2023-10-09,https://xfb.sh.gov.cn/xinfang/yjzj/feedback/feedbackshow?id=1559AF095001412AA77D951446A0CAB1,关于房屋问题,2023-09-06,"本人反映,因婚后没有建过房，我跟女儿属无房无户，因此我同女儿一直在外租房住！本人恳求政府尽快解决我们这对母女的住处！",2023-10-09,上海市浦东新区祝桥镇人民政府,简复告知书袁同志：您好！您于2023年9月6日信访反映的事项收悉。目前，我镇正参照市、区两级农村房屋建设管理办法拟定镇级政策，待镇级农村房屋政策拟定出台后，将通知各村开放建房申请。特此告知。上海市浦东新区祝桥镇人民政府2023年9月15日
动迁补偿不足,上海市奉贤区庄行镇人民政府,2023-10-09,https://xfb.sh.gov.cn/xinfang/yjzj/feedback/feedbackshow?id=C462F60C6FB247F29DF25FAAA9D839FF,动迁补偿不足,2023-09-26,"本人反映,庄行镇世外周边道路动迁补偿不合理。本人要求,政府部门补足安置补偿。",2023-10-09,上海市奉贤区庄行镇人民政府,王同志：您好！庄行镇本着公开、公平、公正原则，根据相关法律规定，结合本镇实际情况，制定协议动迁补偿方案。与您电话联系，您表示知晓，感谢您对政府工作的理解和支持。
建议对会鼎路、蟠祥路加强交通管理,上海市公安局青浦分局,2023-10-09,https://xfb.sh.gov.cn/xinfang/yjzj/feedback/feedbackshow?id=F4DD95B81C614517B11B23B72993B51B,建议对会鼎路、蟠祥路加强交通管理,2023-09-11,本人反映，会鼎路及蟠祥路均为双向二车道，路窄并未设置路边停车，路边有违章停车现象。本人要求，不仅要全面加强附近的交通巡查且西虹桥区域应做到24小时日常巡查，最好在蟠祥路及会鼎路设置违章停车摄像头。,2023-10-09,上海市公安局青浦分局,朱先生：您好！您来信反映的事项收悉。关于会鼎路、蟠祥路沿线加强整治的建议，公安分局已落实警力开展专项整治，严查严处机动车违法停放行为。关于安装电子警察的建议已收悉，将立足交通管理实际予以推进。感谢您对公安机关工作的理解与支持。
地道防汛工作延期,上海市闵行区人民政府新虹街道办事处,2023-10-09,https://xfb.sh.gov.cn/xinfang/yjzj/feedback/feedbackshow?id=F079D5FC9B024BE49D936C937C4034DF,地道防汛工作延期,2023-09-21,光华地道是连接青浦区和闵行区的重要通道，处于施工状态无法通行已近一年，周围道路拥堵加剧，新虹街道今年开始实施光华地道防汛功能完善工程，该项目本今年8月份完工。却延长至10月，目前距离10月只剩一月有余，还包含国庆假期，施工现场仍没有要完工的迹象，是否面临再次延期。上海已入雨季，为消除防汛安全隐患，保障进博会重点区域排水安全，请相关部门加强监督管理，保证项目按时保质保量交付。,2023-10-09,上海市闵行区人民政府新虹街道办事处,潘同志，您好：您于2023年9月21日信访反映光华地道防汛工作延期，希望相关部门加强监督管理，保证项目按时保质保量交付的事项收悉。经了解，该工程施工面与沪苏湖铁路重大项目重合，经市重大办协调，施工周期调整，预计10月底完工。该工程结束后，后续待沪苏湖铁路完工后，光华地道交通组织将由上级部门统一安排。特此告知。
校区建设,上海市闵行区教育局,2023-10-09,https://xfb.sh.gov.cn/xinfang/yjzj/feedback/feedbackshow?id=23CB77C7F6A44889B0ADEA74D3B39A37,校区建设,2023-09-15,小区居民大多是已婚且正为孩子筹划入学的家庭。按照本区统筹区域分组情况以及就近入学原则，九星文来和碧林湾文来属于一校两区，九星文来未建立之前，针对我们小区优先统筹碧林湾校区属于合理安排。针对现在入学的整体需求，我们提出如下诉求:诉求1:更新适龄幼儿学前教育配套规划，保障2024年入园需求。2:加快落实古美北社区S110501单元29-01地块教育规划，按原有官方公布信息建设文来9年制九星校区，并于2025年前建设完成；3:针对2024年拿到预售合同的业主，安排优先统筹碧林湾文来校区。,2023-10-09,上海市闵行区教育局,姚同志：您好！您关于小区配套学校建设和入学安排问题的来信收悉。现告知如下：九年制学校目前正在进行地块规划调整工作，由七宝镇实施。我局同步推进前期方案研究工作。待规划调整工作完成后，我局将启动项目前期手续办理工作，尽快推进项目开工。关于入学问题的相关诉求，已告知我局相关部门，供其在后续工作中参考。感谢您对闵行教育工作的理解和支持。特此告知。
办理灵活就业社保缴纳,上海市闵行区人民政府新虹街道办事处,2023-10-09,https://xfb.sh.gov.cn/xinfang/yjzj/feedback/feedbackshow?id=18680EC9A9324A0EA9EF362D41DA149C,办理灵活就业社保缴纳,2023-09-14,"本人反映，随申办在办理灵活就业社保缴纳过程中，线上显示已办结，但进行灵活就业社保缴纳时显示不属于灵活就业人员，无法进行下一步绑定扣款账户，进而无法进行社保缴纳。本人认为,既然开通了线上办理功能，那就要做好线上功能体验和办事效率，而不是线上无法办理，设立的客服电话，社区服务中心电话均形同虚设，无法切实的解决问题。由于本人无法线下办理业务，请领导督促相关部门帮我解决线上灵活就业的办理事宜。",2023-10-09,上海市闵行区人民政府新虹街道办事处,王同志，您好：您于2023年9月14日信访反映随申办无法办理灵活就业社保缴纳的事项收悉。经查，您在线办理的9月灵活就业社保缴纳已受理成功，税务将于10月份进行扣款。如您还有其他疑问，建议您向新虹受理服务中心咨询。（联系电话：52962113）特此告知。
