title,agency,date,links,标题,来信日期,信件内容,回复日期,回复单位,回复内容
开设老年助餐点,上海市杨浦区人民政府长海路街道办事处,2023-10-11,https://xfb.sh.gov.cn/xinfang/yjzj/feedback/feedbackshow?id=D866C2B9AA0E43A3BBB75816A6EE4D08,开设老年助餐点,2023-09-11,国和路三门路地段，周边15分钟生活圈没有一个老人食堂，不便于老人生活，建议建设老年食堂。,2023-10-11,上海市杨浦区人民政府长海路街道办事处,杨同志：您反映的信访事项已受理。经调查，现答复如下：经了解，街道服务办工作人员已和您介绍了目前长海路街道助餐方式：堂吃和送餐上门等服务。辖区内行动不便有助餐需求的老人到居委申请均可享受送餐上门服务。此外，目前翔殷路以北区域规划在建的老年食堂有二处：市光路611号和国和路968号。建成后，附近行动方便的老年人可自行前往，符合补贴条件的可按照规定享受优惠政策。感谢您的理解与支持！上海市杨浦区长海路街道办事处2023年9月25日
在市光片辖区内建造睦邻食堂,上海市杨浦区人民政府长海路街道办事处,2023-10-11,https://xfb.sh.gov.cn/xinfang/yjzj/feedback/feedbackshow?id=C71061AC1AD34203A576CA3A27EE7548,在市光片辖区内建造睦邻食堂,2023-09-11,北片辖区无睦邻食堂，在辖区内建造睦邻食堂，解决北片内老年群体的助餐服务需求。,2023-10-11,上海市杨浦区人民政府长海路街道办事处,王同志：您反映的信访事项已受理。经调查，现答复如下：经了解，目前长海路街道助餐服务有睦邻小厨堂吃和老年餐送餐上门服务。辖区内行动不便有助餐需求的老人可以到居委申请享受送餐上门服务。目前北片区规划在建的老年食堂有二处：市光路611号和国和路968号。建成后，附近行动方便的老年人可自行前往，符合补贴条件的可按规定享受优惠政策。上海市杨浦区长海路街道办事处2023年9月25日
建议增设杨浦区双辽支路夜间路边临时停车点,上海市杨浦区人民政府江浦路街道办事处,2023-10-11,https://xfb.sh.gov.cn/xinfang/yjzj/feedback/feedbackshow?id=7529C8BFA60144E7B892978DB5CF63E2,建议增设杨浦区双辽支路夜间路边临时停车点,2023-08-24,本人反映，目前杨浦区双辽支路附近小区内停车困难，小区内主干道两侧都停满了车。本人建议，增设双辽支路和双辽路的夜间路边临时停车，缓解小区停车难得问题。,2023-10-11,上海市杨浦区人民政府江浦路街道办事处,吴同志：您于2023年9月21日反映的信访事项收悉，该信访事项目前已处理完毕，现有关情况答复如下：街道相关职能部门与区交通部咨询该情况后，了解到双辽路及双辽支路由于路面狭窄，交通较繁忙，不适合设置临时停车位。感谢您对社区工作的支持和理解。上海市杨浦区人民政府江浦路街道办事处2023年9月21日
疏通民府路,上海市杨浦区人民政府长海路街道办事处,2023-10-11,https://xfb.sh.gov.cn/xinfang/yjzj/feedback/feedbackshow?id=FA561CF6CF3342BCA967FFCB6DDF5D73,疏通民府路,2023-09-12,疏通民府路（闸殷路-市光路）区段，现在那里不能通汽车，不利于通过淞沪路地道由南向北方向车辆经过民府路向右转的通行，阻碍向东部疏散。,2023-10-11,上海市杨浦区人民政府长海路街道办事处,秦同志：您反映的信访事项已受理。经调查，现答复如下：经了解，民府路（闸殷路-市光路路段）为闸殷村内部通道非市政道路，属于动迁征收范围。该通道原先存在人员杂乱、车辆乱停放等问题，容易产生安全隐患，故区相关部门对该通道进行封闭管理，后续对该地块有统一规划方案。感谢您对长海路街道工作的关心、理解和支持。上海市杨浦区长海路街道办事处2023年10月9日
社区食堂,上海市杨浦区人民政府长海路街道办事处,2023-10-11,https://xfb.sh.gov.cn/xinfang/yjzj/feedback/feedbackshow?id=66B01E1D968D455B88185A746263A838,社区食堂,2023-09-14,社区有不少高龄独居老人，一个人做饭不方便，希望在家附近有一个干净实惠的吃饭地方。社会化的餐厅对这些老人来说价格偏贵，量太大一顿吃不完。社区老年送餐服务，菜品单调无法选择，而且节假日没有送餐。故此希望政府能在社区周边置办一些社区食堂，方便老人就餐，解决老年人的燃眉之急。,2023-10-11,上海市杨浦区人民政府长海路街道办事处,程同志：您反映的信访事项已受理。经调查，现答复如下：经了解，目前长海路街道助餐服务有睦邻小厨堂吃和老年餐送餐上门服务。辖区内行动不便有助餐需求的老人可以到居委申请享受送餐上门服务。此外，工作人员介绍了离长三居委较近的盘山路食堂，在“15分钟养老生活圈”内，您可根据自己需要前往。感谢您的理解与支持！上海市杨浦区长海路街道办事处2023年9月26日
复旦二附校广播扰民,上海市杨浦区教育局,2023-10-11,https://xfb.sh.gov.cn/xinfang/yjzj/feedback/feedbackshow?id=EFB88E26A04D48CCAC13B6BCF65EB0D7,复旦二附校广播扰民,2023-09-27,"本人反映,复旦大学第二附属学校，位于凇沪路、绥芬河路，在早操、课间操时间，该校广播声音很大，且持续时间较长。本人认为,其噪音严重影响了周边居民的生活。本人要求,相关部门督促该校立即整改，还居民安静的生活环境。",2023-10-11,上海市杨浦区教育局,李同志：您好！您于2023年9月27日信访反映关于复旦二附校新江湾城校区广播扰民的事项收悉，教育局相关科室向复旦二附校反映核实相关情况，学校将加强广播管理，要求相关工作人员降低早操、课间操的广播音量，减少对周边居民的噪声影响，保障周边居民的休息。特此告知。上海市杨浦区教育局2023年9月27日
关于排烟管道问题,上海市浦东新区周浦镇人民政府,2023-10-11,https://xfb.sh.gov.cn/xinfang/yjzj/feedback/feedbackshow?id=E287BE14712E4A779D9F67BC3D18EEE6,关于排烟管道问题,2023-09-21,"本人反映,小区外部商业楼开办重油烟餐饮业务，装修期间在小区地库通道一侧安装烟道。本人认为,在小区外部开设餐饮业务，不仅需要得到小区内大部分业主同意，改造安装环节更需要合法合理施工，且商业楼本身无烟道的情况下，自行安装烟道的手续是否齐全，需要相关部门进行相关认定并公开。本人要求,小区外围商业楼经营的业务需经小区内居民认可同意后方可进场，对于目前已进场的商户进行排查相关手续是否合法合规，对未批先建的行为及时予以制止。",2023-10-11,上海市浦东新区周浦镇人民政府,简复告知书林同志：您好！您于2023年9月21日信访反映的事项收悉。经向周南社区中心了解：根据您的诉求，居委会联系了相关职能部门至现场查看，该商铺的营业执照和食品经营许可证正在办理中，其安装的油烟净化设施设备符合《上海市饮食服务业环境污染防治管理办法》规定要求，属于商户经营活动前正常准备工作。另外，根据现场测算，其油烟排放口位置距离居民住宅超过20米以上，符合餐饮服务经营场所油烟排放口应当距离居民住宅10米以上的要求。特此告知。上海市浦东新区周浦镇人民政府2023年9月25日
咨询某小学校长信箱,上海市徐汇区教育局,2023-10-11,https://xfb.sh.gov.cn/xinfang/yjzj/feedback/feedbackshow?id=2258C7B086F340B38FE2D48EE5285CF3,咨询某小学校长信箱,2023-09-28,"本人反映,某小学官网校长信箱已失效。本人认为,联系不到该校校长。本人要求,明确告知校长信箱，方便家长进行沟通。",2023-10-11,上海市徐汇区教育局,简复告知书周先生：您好！您于2023年09月28日信访反映的事项收悉。经查，我局工作人员已与您取得联系，并将该小学校长信箱电话告知您。特此告知。上海市徐汇区教育局2023年10月7日
请政府推进商品房平改坡,上海市徐汇区人民政府枫林路街道办事处,2023-10-11,https://xfb.sh.gov.cn/xinfang/yjzj/feedback/feedbackshow?id=1F0AFFFEAFF3479095B97CD4531DFC2D,请政府推进商品房平改坡,2023-09-19,东安花苑多层住宅楼是总高7楼的楼梯房，是97-98年的商品房。由于年久失修，楼顶漏水噪音隔热保暖性能问题突出，但平改坡项目费用巨大，住户的维修基金无法启动平改坡项目。东安花苑地处徐汇滨江和内环边核心地带，居住环境十分影响市容市貌。恳请政府对商品房的平改坡问题予以支持。,2023-10-11,上海市徐汇区人民政府枫林路街道办事处,陈**同志：您所提的建议本机关已受理。经研究，现答复如下：您建议推进东安花苑平改坡。经查，徐汇区东安花苑小区为商品房小区，目前由华而萌泰物业管理。您所述的“平改坡”为旧住房综合改造项目，依据上海市房屋管理局、上海市规划和自然资源局关于印发《上海市旧住房综合改造管理办法》的通知（沪房规范〔2020〕2号），区房屋管理部门负责本辖区内旧住房综合改造项目实施的具体管理。在区房屋管理部门暂时未将徐汇区东安花苑列入旧住房综合改造项目的情况下，依据相关法律法规，建议徐汇区东安花苑小区业主可自筹资金进行房屋修缮等工作。感谢您对枫林街道工作的关心、理解和支持。特此告知。上海市徐汇区人民政府枫林路街道办事处2023年10月11日
中学扰民,上海市徐汇区教育局,2023-10-11,https://xfb.sh.gov.cn/xinfang/yjzj/feedback/feedbackshow?id=E4D5DAC476E242CD9640F74AC26C8D27,中学扰民,2023-09-19,本人反映，我是某中学周边居民，该校高音喇叭声音太响。本人认为，该校噪音严重扰民。本人要求，该校立即整改。,2023-10-11,上海市徐汇区教育局,陈先生：       您反映的信访事项本机关已受理。经研究，现答复如下：       您反映某中学存在噪音扰民情况，要求该校立即整改。       经查，该校高度重视您反映的问题，已结合正常教学实际需求调整广播音量大小，对于前期给您带来的困扰深表歉意。      感谢您对徐汇教育工作的关心、理解和支持。上海市徐汇区教育局2023年10月7日
上海中房物业收费不合理,上海市徐汇区人民政府长桥街道办事处,2023-10-11,https://xfb.sh.gov.cn/xinfang/yjzj/feedback/feedbackshow?id=5040C6C5FFEA457E948CFB407885E940,上海中房物业收费不合理,2023-09-11,"本人反映,园南二村所属中房物业公司存在乱收停车费，以车辆排队的名义要求新购房业主支付远大于老业主的停车费用（400元 vs 150元/每月），即使已经连续交费两年半仍未能按150元交停车费。而且这部分停车费用收益未与业委会分享，构成违法。因为之前所在业委员公布的停车名单中，仅包括支付150元的部分车辆。再有，小区主干道路两侧长期有自行车和电动车辆占位，物业人员视而不见，即使在保安亭旁边，从而导致停车不便。本人认为,物业仅以划线车位来排队不合理，小区内至少有三分之一车辆停放位置都中路边未划线位置，划线车位仅是物业乱收费的托词。上级管理部门应该实际调查，及时制止物业乱收费和侵占行为。本人要求,物业应该停止对新业主的歧视行为，规范小区内占用停车位乱象，通过小区各种微信群公开停车费收入分配情况。",2023-10-11,上海市徐汇区人民政府长桥街道办事处,信访事项答复意见书唐××同志：您反映的信访事项本机关已受理。经研究，现答复如下：您反映园南二村所属中房物业公司存在乱收停车费。建议物业应该停止对新业主的歧视行为，规范小区内占用停车位乱象，通过小区各种微信群公开停车费收入分配情况。经查，依据《园南小区停车管理和车辆收费实施细则》，园南小区停车收费标准七座以下车辆120元/月。根据园南片区统一停车管理的规定，2019年10月1日及以后业主新增车辆，采用先来后到依次登记排队的方法；对现阶段停车包月排队期间，排队业主缴纳临时停车费，予以减免200元/月的优惠措施。房管所已经督促物业公司按照小区停车管理相关规定严格管理；对于个别业主擅自用物品占车位现象，物业组织安保力量每天进行清理，加强停车秩序管理。依据园南二村物业服务合同中约定的相关条款，2016年7月1日后，公共收益税后，业委会70%，物业30%分成。根据规定，小区公共收益账目每季度在小区公示。长桥街道房办与您取得联系，对以上情况进行了回复。感谢您对长桥社区工作的关心、理解和支持。上海市徐汇区人民政府长桥街道办事处2023年9月28日
教育问题,上海市闵行区教育局,2023-10-11,https://xfb.sh.gov.cn/xinfang/yjzj/feedback/feedbackshow?id=1BF53C22466643EDA9B0B7ACBE31428C,教育问题,2023-09-14,本人反映，小区按户均2人推算，小区将有100名适龄幼儿、儿童需要教育资源配套。加上已交付的小区，未来2年将陆续有3个小区、超过400位学龄幼儿、儿童产生强烈的入学需求。按照本区统筹区域分组情况以及就近入学原则，九星文来和碧林湾文来属于一校两区，九星文来未建立之前，针对我们小区优先统筹碧林湾校区属于合理安排。针对现在入学的整体需求，我们提出如下诉求:诉求1:更新适龄幼儿学前教育配套规划，保障2024年入园需求。2:加快落实地块教育规划，按原有官方公布信息建设9年制九星校区，并于2025年前建设完成；3:针对2024年拿到预售合同的业主，安排优先统筹碧林湾文来校区。,2023-10-11,上海市闵行区教育局,张同志：您好！您关于小区配套学校建设和入学安排问题的来信收悉。现告知如下：九年制学校目前正在进行地块规划调整工作，由七宝镇实施。我局同步推进前期方案研究工作。待规划调整工作完成后，我局将启动项目前期手续办理工作，尽快推进项目开工。关于入学问题的相关诉求，已告知我局相关部门，供其在后续工作中参考。感谢您对闵行教育工作的理解和支持。特此告知。
降噪工程,上海市闵行区七宝镇人民政府,2023-10-11,https://xfb.sh.gov.cn/xinfang/yjzj/feedback/feedbackshow?id=ACD7E112C29D4815993BF85DF4035D59,降噪工程,2023-09-15,我们是位于七宝老街对面七莘路2855弄万兆家园小区曾经是文明小区，四高优秀小区，但是现在，破烂的路面，杂乱的绿化，无序的停车，飞机的噪音，破裂渗水的墙面，脏乱的小区环境，23年的房龄和老破比起来还差，周围小区路面都白加黑了，降噪工程美丽家园都搞过了，请领导关心一下我们小区。,2023-10-11,上海市闵行区七宝镇人民政府,钱同志：你于2023年9月15日写给七宝镇信访办的网上信访件（编号：网[2023]000230xxx）已收悉。你建议：小区实施“美丽家园”工程的问题。经本机关调查了解，现答复如下:关于你信访反映的问题，经了解，根据新一轮“美丽家园”的创建条件，聚焦老镇区、老城区、老公房、住宅保修期届满的保障房等“两区两房”。万兆家园（南区）为商品房小区，没有纳入到新一轮美丽家园改造名单。特此告知。
物业管理问题,上海市闵行区七宝镇人民政府,2023-10-11,https://xfb.sh.gov.cn/xinfang/yjzj/feedback/feedbackshow?id=96E7C04295504784A7D4469CC119CB02,物业管理问题,2023-09-14,本人反映：我所在小区受聘管理小区的物业公司是上海联讯物业管理有限公司。随着车辆增多，小区的停车成为本小区的热门话题。但是，在既没有公示表决内容、也没有公开征集业主居民反馈意见的情况下，联讯物业就自行制定表决方案，并强行发放表决票，要求业主对其单方面提出的小区停车的方案内容进行表决。本人认为：程序不合规，则结果无意义。本人希望：听说物业管理行业已经是“属地化管理”，希望有关主管部门，能督导该物业公司，停止目前的错误行为，端正工作态度和工作方式，认真倾听业主反馈意见，按照合乎常规的流程，来完成相关方案的制定和表决工作。非常感谢，并致以敬礼。,2023-10-11,上海市闵行区七宝镇人民政府,谢同志：你于2023年9月14日写给区信访办的网上信访件（编号：网[2023]000227xxx）已转至七宝镇。你反映：小区停车问题。经本机关调查了解，现答复如下:关于你信访反映的问题，经了解，2023年9月，小区已制定停车初步方案，并在小区公示栏内予以公示。目前，根据该小区《业主大会议事规则》已进行投票，2023年10月10号进行开箱验票。如你有不同意见，本机关建议向小区居委会或业委会提出异议。特此告知。
关于小区监控问题,上海市浦东新区周浦镇人民政府,2023-10-11,https://xfb.sh.gov.cn/xinfang/yjzj/feedback/feedbackshow?id=0271A927D9B24FD2B600233DE58D61DB,关于小区监控问题,2023-09-23,本人反映，小区监控基本全部瘫痪无法使用。本人认为，物业公司有业务保证小区监控正常使用，这也是国家规定的。本人要求，物业公司给出具体时间表，恢复小区内部监控，保障小区业主在小区生活安全，方便警方调取监控解决日常纠纷。,2023-10-11,上海市浦东新区周浦镇人民政府,简复告知书孙同志：您好！您于2023年9月23日信访反映的事项收悉。经向周浦镇房办了解：根据《上海市住宅物业管理规定》第六十八条：全体公用部分物业维修、更新、改造和养护的费用，由物业管理区域内的全体业主按照各自拥有的房屋建筑面积比例共同承担。您小区已成立业委会，并设立了专项维修资金，根据“住规”第六十九条的规定，小区公共区域监控维修动用维修资金应当由小区业主大会征询通过后实施。物业公司前期已多次向小区业委会提交监控系统维修方案，因费用未能落实无法开展维修。今年9月16日物业公司再次制定了新的维修方案提交业委会审核，后续待业委会审核通过后，组织召开业主征询工作落实监控维修事宜。特此告知。上海市浦东新区周浦镇人民政府2023年9月26日
表扬徐汇田林四小某班班主任汤老师,上海市徐汇区教育局,2023-10-11,https://xfb.sh.gov.cn/xinfang/yjzj/feedback/feedbackshow?id=0004ACA501F74B91A2BB40717A9988D0,表扬徐汇田林四小某班班主任汤老师,2023-09-25,"陈书记：9月19日，听小朋友回来说，班主任汤老师骨折受伤了，今天给我们上课的是别的班的老师。小朋友经常说，汤老师是他最喜欢的语文老师。作为家长其实有点担忧，担心小朋友刚刚适应汤老师的教学，适应不了别的代课老师。9月22日，小朋友回家报告说，今天非常开心，汤老师回到了课堂。我们都知道骨折受伤没有这么快好的，汤老师一定心里放不下这个班42个小朋友，担心他们，申请提前回来教学了，作为家长特别感动。动人以言者,其感不深;动人以行者,其应必速。可以看出汤老师非常热爱自己的工作，爱那些天真活泼的小朋友，爱与他们一起学习、活动，把满腔热忱献给她所挚爱的教育事业，知行合一，从而赢得了学生们的爱戴。此致敬礼                                      某班家长 ",2023-10-11,上海市徐汇区教育局,简复告知书王先生：您好！您于2023年9月25日信访反映的事项收悉。感谢您对徐汇区田林第四小学汤老师工作的肯定。我局将继续激励广大教师牢记立德树人根本任务，争做新时代“四有”好教师。特此告知。上海市徐汇区教育局2023年9月27日
解决铁皮房搭建问题,上海市浦东新区新场镇人民政府,2023-10-11,https://xfb.sh.gov.cn/xinfang/yjzj/feedback/feedbackshow?id=8EECC2714FE3433DAB506DE730350DF8,解决铁皮房搭建问题,2023-09-08,"本人反映,家门口搭建的铁皮房空隙已经成为过路人的天然公厕，家门口蚊子苍蝇，各种虫子，老鼠乱窜。本人认为,铁皮房搭建有问题。本人要求,解决铁皮房搭建问题。",2023-10-11,上海市浦东新区新场镇人民政府,李同志：您来信反映家门口搭建的铁皮房成为过路人的天然厕所，家门口蚊子苍蝇，各种虫子，老鼠乱窜。要求相关部门解决问题的信访事项。经转相关职能部门后，现作如下回复：经了解，您反映的情况，相关部门现场查看后根据您的要求及时进行整改，您表示理解。感谢您对我们工作的关心、理解和支持。上海市浦东新区新场镇人民政府2023年9月25日
关于房屋漏水问题,上海市浦东新区人民政府金杨新村街道办事处,2023-10-11,https://xfb.sh.gov.cn/xinfang/yjzj/feedback/feedbackshow?id=2F6E6874F0624BC3936B4D9CDE933B08,关于房屋漏水问题,2023-08-24,本人反映，因楼上没做防水因此会漏水到我家。本人认为，应该处理好自己防水问题不要漏水到我家。本人要求，他家卫生间、灶间的地坪整修一下，做个防水，不再漏水，屋顶粉刷一下。,2023-10-11,上海市浦东新区人民政府金杨新村街道办事处,信访事项答复意见书您好！您于2023年8月24日反映的信访事项，根据属地管理，分级负责，分类处理的原则，已交我街道调查处理。根据您信访反映的问题，我街道受理的信访事项有：反映楼上漏水导致房屋受损，要求立即解决。我们对您提出的信访事项十分重视，现答复如下：接到反映问题后，居委立即与您联系了解详细情况，并就此问题与物业及相关业主进行沟通。经了解，物业已为307室更换了热水器软管，经过一个月的观察，确定已不再漏水。关于您要求307室对厨房和厕所进行防水处理的问题，经居委沟通，307室业主表示具体情况需在房屋租约到期后再做处理。感谢您对社区管理工作的理解和支持。上海市浦东新区人民政府金杨新村街道办事处2023年9月13日
关于住房问题,上海市浦东新区惠南镇人民政府,2023-10-11,https://xfb.sh.gov.cn/xinfang/yjzj/feedback/feedbackshow?id=E1EC012E8A424A6ABCC8B5DD6A05EB0E,关于住房问题,2023-07-29,"本人反映,本人是一名村民，因住房条件不够一直寻求解决，本人要求建房审批。",2023-10-11,上海市浦东新区惠南镇人民政府,刘同志：您反映您因住房条件不够，要求建房审批的来信收悉。现答复如下：经了解，根据《上海市农村村民住房建设管理办法》（沪府16号令）第六条（分类引导），位于规划确定的农村居民点范围内的农户，在符合村庄设计和乡村风貌管控要求的前提下，允许翻建、改建住房，即农民建房适用范围规划为集中建设点，您反映的地点不属于上述政策的点位，故无法受理该区域的农民建房审批。特此告知。感谢您的来信。上海市浦东新区惠南镇人民政府2023年9月15日
