title,agency,date,links,标题,来信日期,信件内容,回复日期,回复单位,回复内容
关于强化垃圾分类减量和后续处理的建议,上海市崇明区绿化和市容管理局,2023-12-26,https://xfb.sh.gov.cn/xinfang/yjzj/feedback/feedbackshow?id=4F8963F693704404A27A6148B3B80005,关于强化垃圾分类减量和后续处理的建议,2023-12-12,崇明世界级生态岛建设需要社会环境整治，应建立环境整治和垃圾无害化处理一条龙服务体系，可以组织考察团到先进国家学习这方面知识，更好的推动生态岛建设。,2023-12-26,上海市崇明区绿化和市容管理局,张（先生/女士）：您好！您反映的信访事项已收悉。经研究，现答复如下：环境整治是崇明建设世界级生态岛的需要，崇明区生活垃圾分类工作自2017年全覆盖推进以来，成立了以区委书记为第一组长、区长为组长，各乡镇和委办局“一把手”为责任人的区生活垃圾分类减量推进工作领导小组组织架构，统筹推进全区垃圾分类工作。领导小组下设办公室，负责制定全区垃圾分类实施方案，工作导则、指导意见等相关制度文件，建立工作例会、情况通报等会议制度，协调推进各项工作开展。各乡镇建立相应协调推进机制，确保垃圾分类减量工作全面落到实处。目前，我局针对各类垃圾均已落实了末端收运处置，包括建筑垃圾、农林废弃物、可回收物等均已委托相应的第三方处置公司实施转运处置。同时要求加大转运频次，增加收运次数，确保各类垃圾的及时清运和处置。对于您提出的组织考察团到先进国家学习这方面的知识，更好的推动生态岛建设的建议，我局将向相关区级部门反映。感谢您对崇明区垃圾分类工作的关心、理解和支持。特此告知。
表扬徐家汇街道南丹居委主任,上海市徐汇区人民政府徐家汇街道办事处,2023-12-26,https://xfb.sh.gov.cn/xinfang/yjzj/feedback/feedbackshow?id=3E89213CEBA7430A925BB92D2DB79025,表扬徐家汇街道南丹居委主任,2023-12-21,我家是低保家庭，而且年老多病，每次从良友便利用帮困卡购买的大米无法提上楼，向居委请求帮助，特别是居委主任答应帮将大米送上楼。同时，还多次收到区政府和街道领导的春节送温暖，非常感谢！,2023-12-26,上海市徐汇区人民政府徐家汇街道办事处,黄**同志：您好！您于2023年12月21日信访反映的事项收悉。我们会继续做好服务群众工作，让百姓满意，也感谢您对社区工作的理解和支持。特此告知。上海市徐汇区人民政府徐家汇街道办事处2023年12月21日
关于金水湖教育问题,上海市金山区教育局,2023-12-26,https://xfb.sh.gov.cn/xinfang/yjzj/feedback/feedbackshow?id=3F52D64DE26145F98F85DCFE22A20306,关于金水湖教育问题,2023-11-24,建议秋灵路学校适时招生二年级。,2023-12-26,上海市金山区教育局,李同志：      您反映的信访事项本机关已受理。经研究，现答复如下：      经了解，金水湖区域新建工程项目名称是秋灵路中学，该工程项目计划于2024年7月竣工。学校具体名称和办学方式正在研究协调中。目前，正在开展入学生源排摸工作，2024年义务教育招生工作暂未启动，招生政策还未发布，请耐心等待。       感谢您对本区教育工作的关心、理解和支持。
表扬信,上海市浦东新区大团镇人民政府,2023-12-26,https://xfb.sh.gov.cn/xinfang/yjzj/feedback/feedbackshow?id=1E9573FDA39A43BAB637C8A9E1EACDCB,表扬信,2023-12-13,本人反映，村里通往田头的路已经破旧不堪、无法通行，遇上农耕操作，拖拉机等农机设备无法进入，严重影响老百姓春耩秋收。之后我们向村里反映相关情况，村里知通后立马进行实地勘察，并召开了村民代表大会，通过会议讨论后。制定了通路整改方案。之后对被损道路进行了整改。新建的道路大大方便了我们老百姓。,2023-12-26,上海市浦东新区大团镇人民政府,简复告知书朱同志：您好！您于2023年12月13日信访反映的事项收悉。您反映田头路破旧不堪、无法通行，影响农耕。经查，村委会知道后立即组织工作人员实地勘察，并召开村民代表大会制定通路整改方案，随即对破损道路进行了整改。感谢您的表扬信及对我们工作的关心、理解和支持。上海市浦东新区大团镇人民政府2023年12月20日
关于施工问题,上海市浦东新区书院镇人民政府,2023-12-26,https://xfb.sh.gov.cn/xinfang/yjzj/feedback/feedbackshow?id=BE4D9609CA92499F8607138599555D31,关于施工问题,2023-12-15,"本人反映,道路施工方损坏我的围墙本人认为,造成损坏完全是施工方责任本人要求,道路施工方赔偿或维修围墙",2023-12-26,上海市浦东新区书院镇人民政府,韩同志：您于2023年12月15日反映的信访事项，我单位已办理完毕。您反映：道路施工方损坏我的围墙，施工方赔偿或维修围墙。经核实，现回复如下：收到您的诉求后，村委工作人员第一时间至现场了解情况，现场情况属实，已联系相关施工单位，现修复完，对此您表示满意。我单位对您反映的情况回复如上。解支持，请及时对以上处理进行满意度评价。上海市浦东新区书院镇人民政府2023年12月21日
关于教育配置问题,上海市金山区教育局,2023-12-26,https://xfb.sh.gov.cn/xinfang/yjzj/feedback/feedbackshow?id=7A7C4F311AAF4CAC821309334E95CDE1,关于教育配置问题,2023-11-29,建议金水湖地区尽快配套公立幼儿园及秋灵路学校招生小学一年级和初中六年级。,2023-12-26,上海市金山区教育局,杨同志：      您反映的信访事项本机关已受理。经研究，现答复如下：      经了解，金水湖周边区域已于2022年1月启用一所办园规模15班的民办慧慈幼儿园。根据高新区幼儿园的区域布局，朱行幼儿园、金工幼儿园和慧慈幼儿园三所幼儿园的办园规模，可以满足高新区适龄幼儿入园问题。另，金水湖区域新建工程项目名称是秋灵路中学，该工程项目计划于2024年7月竣工。目前，正在开展入学生源排摸工作，2024年义务教育招生工作暂未启动，招生政策还未发布，请耐心等待。       感谢您对本区教育工作的关心、理解和支持。
多多买菜不给工资，拖欠工资。平台监管不力,上海市长宁区人力资源和社会保障局,2023-12-26,https://xfb.sh.gov.cn/xinfang/yjzj/feedback/feedbackshow?id=D178158EA9F14B5E8F0CCAF012E47C44,多多买菜不给工资，拖欠工资。平台监管不力,2023-11-29,本人在11月5日到11月24日在多多买菜当司机，现在已经离职。离职后并没有支付我的工资报酬，还说要扣我的工资报酬，根据《工资支付暂行规定》第七条，工资至少每月支付一次。联系老板无果，后面联系拼多多平台，平台也搞不了。多多买菜都是拼多多旗下的，连工资支付都监管不了吗？,2023-12-26,上海市长宁区人力资源和社会保障局,董**先生：        您反映的信访事项已受理。经研究，现答复如下：        您反映在11月5日到11月24日期间多多买菜当司机，现在已经离职。离职后并单位没有支付工资报酬，还说要扣工资报酬。您要求解决。       经相关部门协调，您目前已收到工资，该事项已解决。       感谢您对我局工作的关心、理解和支持。上海市长宁区人力资源和社会保障局
建议长宁中小学校加装空调,上海市长宁区教育局,2023-12-26,https://xfb.sh.gov.cn/xinfang/yjzj/feedback/feedbackshow?id=BEAE96DD546240B3817C3032295E0185,建议长宁中小学校加装空调,2023-12-20,天气寒冷，孩子在教室上课也冷。长宁有的学校安装了空调，有的学校没有安装。气温降幅大，孩子们年龄小，在教室上课手脚非常冷，建议政府多照顾弱势群体，给长宁没有安装空调的中小学校加装空调，让小朋友在温暖的教室里学习。,2023-12-26,上海市长宁区教育局,李**：您关于建议长宁区中小学校加装空调的意见建议，区有关部门已转长宁区教育局处理。现告知如下：区教育行政部门和学校将根据上级、长宁区教育改革和发展“十四五”规划及相关部门的要求，结合项目建设、财政预算和学校电气线路改造等情形，在符合“节能减排”和卫生防疫、通风等要求的情况下逐步推进教室空调安装工作。区教育局要求学校根据天气变化情况，做好学校高温天气防暑降温、低温天气防冻保暖等工作，也希望家长和学生能配合学校共同做好相关工作。给家长和学生带来的不便，请多谅解！感谢对长宁教育和相关学校的关心支持监督！上海市长宁区教育局
退款,上海市金山区住房保障和房屋管理局,2023-12-26,https://xfb.sh.gov.cn/xinfang/yjzj/feedback/feedbackshow?id=862E5CE531B54A648E0CF5F672523FBF,退款,2023-11-21,反映在认购过程中发现开发商存在违规售楼问题，要求退款,2023-12-26,上海市金山区住房保障和房屋管理局,刘同志：      您好！您反映的信访事项本机关已受理。经研究，现答复如下：      经联系，您和开发企业均表示已经协商一致。问题已解决。       感谢您对金山房管工作的理解和支持。
关于定西路1211弄2号加装电梯的求助,上海市长宁区人民政府华阳路街道办事处,2023-12-26,https://xfb.sh.gov.cn/xinfang/yjzj/feedback/feedbackshow?id=B4E43F9763714E3AAE2E69B05E2DCF48,关于定西路1211弄2号加装电梯的求助,2023-12-26,        本人居住于定西路1211弄2号。近日，楼组内征询加装电梯，仅差1户业主认可，同意率便能达到相关标准。考虑到高楼层老年人十分期待此次加梯工程得以最终落地。希望街道有关部门进行协调，进一步提升加梯征询同意率。,2023-12-26,上海市长宁区人民政府华阳路街道办事处,张**女士：您好！        您于2023年12月26日信访反映的事项收悉。        经查，街道此前已获悉定西路1211弄2号既有住宅电梯加装工程居民意见征询工作情况。对此，街道相关部门领导高度重视，已通过会议协商、联合走访及现场办公等方式推动邻里协商，促进同意率达标。针对持反对意见居民提出的房屋安全性等疑问，街道已联合专业机构作出答复，打消了居民的顾虑。        目前，低楼层多数居民已重新签署征询意见，同意率已达到规定比例，您来信反映的诉求已经解决。后续楼栋加梯工作将按照《关于进一步做好本市既有多层住宅加装电梯工作的若干意见》推进实施。        特此告知。上海市长宁区人民政府华阳路街道办事处                                                                                                                  
关于预售和质量的疑问,上海市静安区住房保障和房屋管理局,2023-12-26,https://xfb.sh.gov.cn/xinfang/yjzj/feedback/feedbackshow?id=7CBCA2D28FD043B8B017DEA23E3BEB72,关于预售和质量的疑问,2023-12-14,反映楼盘在销售过程中存在不合规的情况。认为该楼盘未达到预售标准“七层以下（含七层）应当完成基础工程并施工至主体结构三分之二以上”就上市销售；施工中开发商随意减配，降低交付标准。要求查处。,2023-12-26,上海市静安区住房保障和房屋管理局,居民同志：您的来信收悉。现答复如下：根据市房管局2022年6月下发的通知，对受疫情影响的在建商品房项目申请预售许可，工程进度条件暂定调整为完成主体结构的三分之一。该项目于2022年6月及10月分两批取得《预售许可证》并公开销售，施工建设期间正值疫情时期，因此参照该通知要求执行，不存在违反预售标准上市销售的情况。该项目的备案价格是通过市、区两级政府核价确定的，其价格的确定符合相关程序。项目按要求与中国农业银行股份有限公司上海静安支行签订《商品房预售资金监管协议》，资金使用情况由监管银行负责审核、支付。目前该项目正处于施工阶段，尚未完成竣工验收。根据相关规定，我单位对房地产开发企业申请上市销售的商品房销售方案（包含房屋室内全装修主要装修材料和设备表）进行备案。小区公共区域则根据规划设计方案施工建设，并最终由相关部门进行验收。感谢您对我们工作的理解和支持。
关于道路问题,上海市浦东新区大团镇人民政府,2023-12-26,https://xfb.sh.gov.cn/xinfang/yjzj/feedback/feedbackshow?id=9D1487C6D449484B846395FA7E593896,关于道路问题,2023-12-12,我们村新农村改造完之后，村里所有的交通非常便捷，小汽车都能开到家门口，可是我家前面的路确一直保持原样，我们家一起的一共6户人家，我们向村里反映相关情况，村里知道后立马进行了实地勘察，并邀请我们参加了对此道路改造的会议，但是由于涉及到一户人家的承包地，这户人家一直和邻里之间存有矛盾，所以有一定的困难，后经过村委会介入调解之下，与这一户人家达成协议，对该道路进行了扩宽的项目，方便了村民的进出。我觉得我们村委的工作人员解决问题的能力非常有效，确实是为老百姓做实事，写封表扬信来表扬我们村的工作人员，确实做到了为人民服务。,2023-12-26,上海市浦东新区大团镇人民政府,简复告知书汤同志：您好！您于2023年12月12日信访反映的事项收悉。您反映农村道路问题。经查，村委会接单后，立即组织工作人员实地勘察，期间，发现矛盾及时化解，后对涉事道路进行了扩宽，方便了村民的进出。感谢您的表扬信及对我们工作的关心、理解和支持。上海市浦东新区大团镇人民政府2023年12月20日
关于中学开班情况,上海市金山区教育局,2023-12-26,https://xfb.sh.gov.cn/xinfang/yjzj/feedback/feedbackshow?id=17AB39F24927423096C71CD0A5522591,关于中学开班情况,2023-11-19,建议秋灵路学校适时招生初中六年级。,2023-12-26,上海市金山区教育局,姜同志：       您反映的信访事项本机关已受理。经研究，现答复如下：       经了解，金水湖区域新建工程项目名称是秋灵路中学，该工程项目计划于2024年7月竣工。目前，正在开展入学生源排摸工作，2024年义务教育招生工作暂未启动，招生政策还未发布，请耐心等待。         感谢您对本区教育工作的关心、理解和支持。
关于加装电梯管理问题,上海市松江区人民政府永丰街道办事处,2023-12-26,https://xfb.sh.gov.cn/xinfang/yjzj/feedback/feedbackshow?id=957C8B2C37E243C8AD9B8FBAA6EF7C4F,关于加装电梯管理问题,2023-11-30,"本人反映,加装电梯目前已建成，想移交给小区物业管理，但是物业提供的委托服务合同表明只愿意提供清洁服务和门岗报警系统接入，并明确指出电梯报警系统接入小区门岗后如果门卫远离门岗进行工作时未听见报警声音不认为是违法协议，另外，其余任何管理责任在合同上都列明全部推卸给出资的业主。加装电梯业主多为老年群体，一旦发生意外被关入电梯无人救援，后果不堪设想，该项目本为政府实事项目，希望能切实为人民提供便利。",2023-12-26,上海市松江区人民政府永丰街道办事处,简复告知书朱**同志：您好！您信访反映关于加装电梯管理问题的事项收悉。经了解，加梯完工后准备移交给小区物业公司，该部加装电梯属于8家出资业主所有，由于是8家业主，所以由小区物业代为签订维保合同。物业公司表示目前只代收取了电梯的电费和保洁费，并没有收取电梯管理费，如业主一定要物业承担管理责任，则需要收取一定的管理费。建议双方通过协商解决。特此告知。上海市松江区人民政府永丰街道办事处2023年12月8日
装修升级包问题,上海市闵行区建设和管理委员会,2023-12-26,https://xfb.sh.gov.cn/xinfang/yjzj/feedback/feedbackshow?id=6186F4F164804C608409E1EB6E1E23C3,装修升级包问题,2023-11-14,"本人反映,购买了住宅装饰服务，买卖过程中对方有多种违法行为，需要市场监督管理、整治，1. 诱导消费及胁迫销售：代表开发商方的前端销售人员严重虚假宣传装修服务及夸大不买装修服务的严重后果；2. 虚假宣传、欺诈销售：装修服务价格清单无法提供，实际落地装修材料质量与宣传严重不符， 严重危害人民健康；3. 无效合同：装修合同从前期销售存在欺诈手段订立合同，到实际落地损害集体利益，及合同本身的免责条款及霸王条款会造成人身伤害等，均构成合同无效。本人认为,装修服务过程、合同违法。本人要求,介入执法，取消合同，退还服务，全额退还费用，对销售方依法处罚。",2023-12-26,上海市闵行区建设和管理委员会,张同志：您好！您来信反映家居公司虚假宣传装修包，要求退赔违法赚取的利益所得的事项已收悉，我委对此十分重视，并责成闵行区建筑建材业管理所立即派员进行调查，现将相关情况答复如下：经闵行区建筑建材业管理所监督员立即前往现场核实，现场施工内容均按图施工。关于虚假宣传和合同履约等问题，建议您向相关职能部门反映或通过司法途径解决。特此告知。
上海长宁区安化路夜间施工问题,上海市长宁区建设和管理委员会,2023-12-26,https://xfb.sh.gov.cn/xinfang/yjzj/feedback/feedbackshow?id=0A00CE3F1D0D440883C464ADBB63A56D,上海长宁区安化路夜间施工问题,2023-12-11,本人反映，上海长宁区安化路最近两个月总是在夜间施工修路；本人认为，夜间施工修路产生的噪音严重扰民，影响道路两侧居民生活休息；本人要求，施工在白天进行，晚上八点以后不要施工。,2023-12-26,上海市长宁区建设和管理委员会,李**同志：您反映的信访事项本机关已受理。经研究，现答复如下：您反映：安化路最近两个月总是在夜间施工修路。您认为：夜间施工修路产生的噪音严重扰民，影响道路两侧居民生活休息。您诉求：施工在白天进行，晚上八点以后不要施工。经现场核查，安化路正在进行安化路架空线入地和杆箱整治项目，目前正在进行道路提升工程。由于提升工程涉及到对车行道、人行道进行整体提升，工程耗时较长，为保障道路交通通行和居民的正常出行，项目采用夜间施工方式进行，白天采用临时修复路面保障通行。区市管中心已要求项目参建单位严格落实文明施工措施，20:00-22:00进行破碎路面等高噪音工作，22:00之后进行出土等低噪音工作。施工时努力做好降噪措施，努力减少对周边居民的影响。架空线入地整治工程作为市委市政府民心工程，实施后将清除空中“蜘蛛网”线缆安全隐患，进一步优化周边环境。感谢您对架空线入地和杆箱整治工作的关心、理解和支持。上海市长宁区建设和管理委员会
关于教育配置问题,上海市金山区教育局,2023-12-26,https://xfb.sh.gov.cn/xinfang/yjzj/feedback/feedbackshow?id=6865220276E74FAF976D0DAE05D80280,关于教育配置问题,2023-11-23,建议金水湖地区尽快配套公立幼儿园及秋灵路学校招生小学一年级和初中六年级。,2023-12-26,上海市金山区教育局,王同志：      您反映的信访事项本机关已受理。经研究，现答复如下：      经了解，金水湖周边区域已于2022年1月启用一所办园规模15班的民办慧慈幼儿园。根据高新区幼儿园的区域布局，朱行幼儿园、金工幼儿园和慧慈幼儿园三所幼儿园的办园规模，可以满足高新区适龄幼儿入园问题。另，金水湖区域新建工程项目名称是秋灵路中学，该工程项目计划于2024年7月竣工。目前，正在开展入学生源排摸工作，2024年义务教育招生工作暂未启动，招生政策还未发布，请耐心等待。       感谢您对本区教育工作的关心、理解和支持。
关于绿植问题,上海市浦东新区书院镇人民政府,2023-12-26,https://xfb.sh.gov.cn/xinfang/yjzj/feedback/feedbackshow?id=83D645345D4B4E9AA49F510C9F6C2D75,关于绿植问题,2023-12-14,本人小区内绿化坏死没有及时更换，请及时处理。,2023-12-26,上海市浦东新区书院镇人民政府,汪同志：您反映的信访事项本机关已受理。经研究，现答复如下：您反映小区坏死的绿化问题，现已妥善解决。经与您沟通，您对处理结果表示满意。感谢您对我们工作的理解支持，请及时对以上处理进行满意度评价。上海市浦东新区书院镇人民政府2023年12月21日
关于改进办公大楼停车难的建议,上海隧道工程股份有限公司,2023-12-26,https://xfb.sh.gov.cn/xinfang/yjzj/feedback/feedbackshow?id=44FF450CA0F54A038FB31B5440CBAB15,关于改进办公大楼停车难的建议,2023-11-27,建议**公司安装智能停车系统，解决办公大楼停车困难的问题,2023-12-26,上海隧道工程股份有限公司,您好，您反映的事项收悉。经了解，现答复如下：非常感谢您对我们工作的关心，您提出的建议我司已采纳，下一步将对总部大楼停车库进行升级改造，加装智能停车系统，进一步提升职工的幸福感和办公的舒适度。感谢您对我们工作的关心、理解和支持！
领取企业年金咨询,太平洋保险（集团）公司,2023-12-26,https://xfb.sh.gov.cn/xinfang/yjzj/feedback/feedbackshow?id=4F6D822608104EB7A5F653F8847A09A5,领取企业年金咨询,2023-11-28,咨询领取企业年金事宜,2023-12-26,太平洋保险（集团）公司,您好！关于您咨询我司企业年金领取事宜，现答复如下：根据《企业年金办法》规定，符合下列条件的，可以申领企业年金：（1）到达法定退休年龄并办理退休（退职）；（2）出国（境）定居；（3）死亡；（4）完全丧失劳动能力（如上海地区经市级劳动能力鉴定机构鉴定为完全丧失劳动能力的）。感谢您对我们工作的关心、理解和支持！
关于允许外地户籍逝者参加海葬的建议,上海市殡葬服务中心,2023-12-26,https://xfb.sh.gov.cn/xinfang/yjzj/feedback/feedbackshow?id=DBAC4933B1814165BC4386F78069E906,关于允许外地户籍逝者参加海葬的建议,2023-12-21,龚市长：你好。我是一名新上海人，已落户上海，我的母亲已在上海医院进入临终状态。我母亲生前的愿望是参加海葬，但是我们了解到上海的海葬只开放给本户籍居民，而且还有补贴。海葬是一件利国利民的好事，我们理解外地户籍参加海葬可能会挤占本地市民的资源，所以政府能否考虑一下向外地户籍居民开放海葬，我们不要补贴，而且可以付费，以维持海葬系统的正常运转。当然这件事情可能增加飞思海葬公司的业务量，但也是一个推广海葬、移风易俗的善举，更是一个向全国人民展示上海市海纳百川、大气谦和的一个机会。拜请龚市长百忙之中能和民政部门商议一下，看是否合适，谢谢!对象信息不了解，电话也无法拨通。对来信中董先生反映的一名上海普通市民,2023-12-26,上海市殡葬服务中心,***同志：您反映的信访事项收悉。上海市殡葬服务中心信访工作人员于2023年12月25日与您取得联系，并协调海葬公司向您介绍上海海葬政策，您表示理解。感谢您对上海殡葬工作的关心、理解和支持。上海市殡葬服务中心2023年12月25日
关于公交线路建议,上海市金山区交通委员会,2023-12-26,https://xfb.sh.gov.cn/xinfang/yjzj/feedback/feedbackshow?id=451A7D50B355469DAF1C571EAC097680,关于公交线路建议,2023-12-06,建议增加朱松线班次及增加直达松江南站公交，方便朱泾居民乘坐公共交通到松江上班。,2023-12-26,上海市金山区交通委员会,马同志：      您来信反映的事项我委已受理。经研究，现答复如下：      朱松线是一条连接金山与松江的跨区线路，原起讫站为朱泾汽车站---松江汽车东站。为更好服务沿途市民出行，自2021年12月起实施了调整：由高速改走地面，起讫站调整为朱泾汽车站---松江大学城。调整后，服务的站点及人群更多。根据目前掌握的客流调查数据，朱松线客流人次有上升趋势，行业管理部门已要求公交运营企业密切关注线路客流，根据需求，适时调整增加运能。      关于增加直达松江南站公交的建议，因跨区线路新辟需协调属地交通管理部门，且由市交通管理部门审批，所以我们将积极向相关部门反映我区市民的需求，并认真开展前期研究。        感谢您对金山交通工作的关心、理解和支持。
