title,agency,date,links,标题,来信日期,信件内容,回复日期,回复单位,回复内容
图书馆寄存柜长时间不能使用,上海工程技术大学,2023-12-27,https://xfb.sh.gov.cn/xinfang/yjzj/feedback/feedbackshow?id=2D3AAA3B960446F2A6EF1928E9D5D20F,图书馆寄存柜长时间不能使用,2023-12-20,我反映学校图书馆寄包柜自学校图书馆翻新之后一直不能使用。我认为学校有许多考研的同学每天都会在图书馆学习很久，并且他们的书很多，每天从宿舍到图书馆搬来搬去不太现实。以前图书馆有寄包柜，图书馆翻新之后一直不能使用。我希望学校能尽快恢复图书馆寄包柜的使用，方便学校考研学生。,2023-12-27,上海工程技术大学,王同学：         您反映的信访事项已受理。经研究，现答复如下：         您反映学校图书馆寄包柜自学校图书馆翻新之后一直不能使用。您认为学校有许多考研的同学每天都会在图书馆学习很久，并且他们的书很多，每天从宿舍到图书馆搬来搬去不太现实。您要求尽快恢复图书馆寄包柜的使用，方便学校考研学生。         经核实，图书馆寄存柜在图书馆大修期间损坏，图书馆重新启用以后，学校联系寄存柜生产单位来校维修，经检查损坏较为严重，没有维修价值。学校准备在明年为学生添置新的寄存设备。        感谢您对我们工作的理解、支持，请及时对以上处理进行满意度评价。                                                                            上海工程技术大学                                                                              2023年12月21日
关于乱扔垃圾问题,上海市浦东新区书院镇人民政府,2023-12-27,https://xfb.sh.gov.cn/xinfang/yjzj/feedback/feedbackshow?id=AEA5769E431C48BD85EA90796A374785,关于乱扔垃圾问题,2023-12-14,本人反映，自己楼上住户经常往楼下乱扔垃圾本人要求，相关工作人员及时劝阻,2023-12-27,上海市浦东新区书院镇人民政府,茅同志：您反映的信访事项本机关已受理。经研究，现答复如下：您反映楼上乱扔垃圾的情况，现已妥善解决。感谢您对我们工作的理解支持。上海市浦东新区书院镇人民政府2023年12月21日
关于道路问题,上海市浦东新区北蔡镇人民政府,2023-12-27,https://xfb.sh.gov.cn/xinfang/yjzj/feedback/feedbackshow?id=5C690019E1B145A9A705021CA4ABB5F7,关于道路问题,2023-12-20,本人反映，小区门口道路坑洼积水，希望有关部门能及时整修。,2023-12-27,上海市浦东新区北蔡镇人民政府,信访事项处理意见书石同志：您反映的信访事项我镇已受理。经研究，现答复如下：您反映出行道路安全问题。经查，相关部门接单后立即进行实地勘察商议修缮道路事宜，并立即联系施工队已将涉事道路进行修缮。感谢您对信访工作的关心、理解和支持。上海市浦东新区北蔡镇人民政府2023年12月20日
关于积水问题,上海市浦东新区北蔡镇人民政府,2023-12-27,https://xfb.sh.gov.cn/xinfang/yjzj/feedback/feedbackshow?id=9B7227D672AD4211BD77A65592BC22BA,关于积水问题,2023-12-20,道路雨天易积水，还望有关部门能及时处理。,2023-12-27,上海市浦东新区北蔡镇人民政府,信访事项处理意见书唐同志：您反映的信访事项我镇已受理。经研究，现答复如下：您反映出行道路安全问题。经查，相关部门接单后立即进行实地勘察商议修缮道路事宜，并立即联系施工队已将涉事道路进行修缮。感谢您信访工作的关心、理解和支持。上海市浦东新区北蔡镇人民政府2023年12月20日
关于积水问题,上海市浦东新区北蔡镇人民政府,2023-12-27,https://xfb.sh.gov.cn/xinfang/yjzj/feedback/feedbackshow?id=D8A42005043141F78C92408BD9EB60DF,关于积水问题,2023-12-20,本人反映，小区门口道路易积水，下雨天影响百姓的日常通行。本人要求，及时修理。,2023-12-27,上海市浦东新区北蔡镇人民政府,信访事项处理意见书袁同志：您反映的信访事项我镇已受理。经研究，现答复如下：您反映出行道路安全问题。经查，相关部门接单后立即进行实地勘察商议修缮道路事宜，并立即联系施工队已将涉事道路进行修缮。感谢您对信访工作的关心、理解和支持。上海市浦东新区北蔡镇人民政府2023年12月20日
毕业生获取成绩单,上海工程技术大学,2023-12-27,https://xfb.sh.gov.cn/xinfang/yjzj/feedback/feedbackshow?id=E85D45C5F26340849FDA6ED62A66841F,毕业生获取成绩单,2023-12-20,我是上海工程技术大学的毕业生，因为办理其他业务需要，我要开成绩证明和新生入学名册，咨询如何办理？,2023-12-27,上海工程技术大学,郑同学：        您反映的信访事项学校已受理。经研究，现答复如下：        您咨询毕业生如何开具成绩证明和新生入学名册。经了解，请您登录上海工程技术大学网站（www.sues.edu.cn），在组织机构里找到档案馆，在档案馆主页右下角点击“快捷通道”，点击“网上申请毕业生成绩证明”，按照相关提示即可办理。        感谢您对学校工作的关心、理解和支持。                                                                               上海工程技术大学                                                                                 2023年12月21日
英语音标学习问题,上海市金山区教育局,2023-12-27,https://xfb.sh.gov.cn/xinfang/yjzj/feedback/feedbackshow?id=04038E5D96FB43498FA321961D544696,英语音标学习问题,2023-12-16,本人反映，中小学都没有教英语音标。本人认为，应在义务教育的某个阶段教英语音标。本人建议，加强英语音标学习。,2023-12-27,上海市金山区教育局,杨先生/女士：        您反映的信访事项本机关已受理。经研究，现答复如下：        您反映目前中小学阶段在英语音标教学上存在欠缺，建议加强英语音标学习。        经了解，学校学科教学均有国家课程标准规范。目前，小学阶段，五年级有音标教学，初中阶段，无专门时间要求。       您的建议留作工作参考。       感谢您对本区教育工作的关心、理解和支持。                                                                       上海市金山区教育局                                                                           2023年12月26日
关于普法问题,上海市浦东新区书院镇人民政府,2023-12-27,https://xfb.sh.gov.cn/xinfang/yjzj/feedback/feedbackshow?id=32D3E0AA813B406AB92A0362242C8CDC,关于普法问题,2023-12-14,尊敬的区委、区政府的领导：     你们好！     非常感谢你们在今年举办的普法活动，我身边的老百姓越来越懂法了，身边的纠纷争吵也少了，社会治安也越来越好了，我自己也是有了基本的法律思维，做事也是会先考虑是否合法合规，感谢党，感谢政府，你们真的做到的为民服务，政府也是人民的政府。,2023-12-27,上海市浦东新区书院镇人民政府,蒋同志：您反映的信访事项本机关已受理。经研究，现答复如下：您反映村举办的普法活动，老百姓受益很多，对此其感谢党，感谢政府。感谢您对我们工作的理解支持。上海市浦东新区书院镇人民政府2023年12月21日
寝室楼开水机老化,上海工程技术大学,2023-12-27,https://xfb.sh.gov.cn/xinfang/yjzj/feedback/feedbackshow?id=A6C414EBB60D42B489F45B9F09B34048,寝室楼开水机老化,2023-12-20,"本人反映,我们住的寝室楼开水机锈蚀，放水的时候水流非常小，有时候放出来的水有水垢或铁锈。本人认为,这极大影响了我们的健康。本人要求,学校更换新的设备。",2023-12-27,上海工程技术大学,朱同学：        您信访反映的事项收悉。经研究，现答复如下：        您反映寝室楼开水机放水的时候水流非常小，有时候放出来的水有水垢。您认为，这极大影响健康。您要求，学校更换新的设备。        经检查，您反映的问题在部分开水机上确实存在，去年以来，学校已经逐步替换老旧开水机140台，明年学校将再更新一批已到使用年限的开水机，新安装的开水机带前置过滤系统，将更好地保障学生的用水安全。        感谢您对我们工作的理解支持，请及时对以上处理进行满意度评价。                                                                                  上海工程技术大学                                                                                   2023年12月22日
划拨用地转出让用地应缴纳的土地出让金金额,上海市规划和自然资源局,2023-12-27,https://xfb.sh.gov.cn/xinfang/yjzj/feedback/feedbackshow?id=4042CA3FB2FD4A8B82B5C310208284E7,划拨用地转出让用地应缴纳的土地出让金金额,2023-12-15,领导好，我是评估机构的评估人员，现在在业务上面临一个问题:就是在承接上海的划拨性质的土地时，需要转为出让性质的土地后方可自有交易，想请问一下划拨地转出让地的土地出让金缴纳比例是多少，怎么样的一个计算方式去缴纳，谢谢领导的答复~,2023-12-27,上海市规划和自然资源局,信访事项答复意见书陈**同志：您反映的信访事项已受理。经研究，现答复如下：根据《国有建设用地使用权出让地价评估技术规范》（国土资厅发〔2018〕4号），使用权人申请以协议出让方式办理出让，出让时不改变土地及建筑物、构筑物现状的，应按本规范评估在现状使用条件下的出让土地使用权正常市场价格，减去划拨土地使用权价格，作为评估结果，并提出底价建议。出让时重新设定规划建设条件的，应按本规范评估在新设定规划建设条件下的出让土地使用权正常市场价格，减去现状使用条件下的划拨土地使用权价格，作为评估结果，并提出底价建议。本市国有土地划拨转出让的地价评估过程，应符合《城镇土地估价规程》（GB/T18508-2014）、《国有建设用地使用权出让地价评估技术规范》（国土资厅发〔2018〕4号）、《划拨国有建设用地使用权地价评估指导意见（试行）》（自然资办函〔2019〕922号）等相关规范和要求。感谢您对规划资源工作的关心、理解和支持。上海市规划和自然资源局2023年12月27日
更换老师的建议,上海市青浦区教育局,2023-12-27,https://xfb.sh.gov.cn/xinfang/yjzj/feedback/feedbackshow?id=B2A46C67C75341ECB4BDF9D2141F1EDA,更换老师的建议,2023-12-12,本人反映，学校高二年级某班的数学成绩不佳。本人认为，高中是关乎孩子人生的阶段，而数学又是重中之重，现在数学成绩不佳，将影响孩子的高考成绩。本人要求，更换数学老师。,2023-12-27,上海市青浦区教育局,杨先生/女士：        您好！        您于2023年12月12日信访反映的事项收悉。        您反映学校高二年级某班因数学老师的问题导致数学成绩不佳。经了解，近期学校收到相关诉求后十分重视，立即成立工作专班，并由校长约谈相关老师，要求其严格落实教育教学常规工作，加强师生互动。后续学校将持续加强随堂听课及教学常规检查，加强教研组、备课组建设，做到统一要求、统一进度、统一内容。同时，学校将进一步加大对教育教学的监管力度，持续关注该教师的工作，包括进一步了解情况、严格跟踪教育教学，广泛听取意见等，不断提升办学业绩。       特此告知。                                                                         上海市青浦区教育局                                                                              2023年12月21日
上海静安维信小额贷款有限公司违法向大学生发放贷款问题,上海市静安区金融服务办公室,2023-12-27,https://xfb.sh.gov.cn/xinfang/yjzj/feedback/feedbackshow?id=6C9F16B8A62A49088F4A0C4944E4DAB5,上海静安维信小额贷款有限公司违法向大学生发放贷款问题,2023-12-15,本人反映，上海静安维信小额贷款有限公司违法向在校大学生发放贷款问题本人认为，上海静安维信小额贷款有限公司不按国家规定违法向在校大学生发放贷款本人要求，本人在2017年1月11日向上海静安维信小额贷款有限公司，当时本人是在校大学生，上海静安维信小额贷款有限公司违反了审慎经营原则和贷前审查严重失职，依据银保监会发布《关于进一步规范大学生互联网消费贷款监督管理工作的通知》（下称《通知》），禁止小额贷款公司向大学生发放互联网消费贷款，禁止非持牌机构为大学生提供信贷服务。请求相关部门对此机构违法问题进行查处。,2023-12-27,上海市静安区金融服务办公室,同志：您来信收悉。您反映上海静安维信小额贷款有限公司（下称“维信小贷”）违反《关于进一步规范大学生互联网消费贷款监督管理工作的通知》，向大学生发放贷款，要求查处。经查，您在2017年1月11日通过上海维信荟智金融科技有限公司运营的“星星钱袋”平台与“维信小贷”订立借款合同，未违反当时规定。您提到的《关于进一步规范大学生互联网消费贷款监督管理工作的通知》发布时间为2021年2月24日，您的业务发生在该通知发布前。本办建议，若您与“维信小贷”在贷款业务上存在纠纷的，可通过协商解决，协商不成的可以根据法律规定或合同约定的争议解决条款，通过诉讼或仲裁等法定途径寻求解决。特此告知。2023年12月26日
上海医保转移至外地3个月无结果,上海市黄浦区医疗保障局,2023-12-27,https://xfb.sh.gov.cn/xinfang/yjzj/feedback/feedbackshow?id=79496E1C986E49C79904B117959FE484,上海医保转移至外地3个月无结果,2023-11-30,2023年9月医保通过线下办理从上海转入成都市成华区。经查询，截至2023年10月15日，转出地已经转出办结，但在成华区显示转移余额未到账。成都医疗保障局工作人员于11月16日，17日与上海黄浦区医疗保障局联系并提供更改后的银行对公账户，但至今未收到上海的支付数据和通知。成都医疗保障局工作人员11月28日再次联系上海黄浦医疗保障局进行联系并留言，至今还未得到回复。,2023-12-27,上海市黄浦区医疗保障局,杨某某同志：您好！经了解，您因工作变动，需要办理医保转移接续业务。通过和成都医保部门的沟通，确认11月29日，您的医保金已转移到成都医保，后续处理请直接联系当地医保部门。感谢您对医保工作的关心、理解和支持。上海市黄浦区医疗保障局2023年12月6日
关于活动场地问题,上海市浦东新区书院镇人民政府,2023-12-26,https://xfb.sh.gov.cn/xinfang/yjzj/feedback/feedbackshow?id=2A9B44833B28467DB9F503D84EBDBB1B,关于活动场地问题,2023-12-14,"本人反映小区没有活动场地,本人认为应该增设活动场地,本人要求增加活动场地,",2023-12-26,上海市浦东新区书院镇人民政府,"顾同志：您于2023年12月15日反映的信访事项，我单位已办理完毕。您反映：小区没有活动场地,增加活动场地。经核实，现回复如下：收到您的诉求后，工作人员第一时间至现场了解情况，现场情况属实，已联系相关部门上门勘察评估，后续进展进行公告，对此您表示满意。我单位对您反映的情况回复如上。感谢您对我们工作的理解支持，请及时对以上处理进行满意度评价。上海市浦东新区书院镇人民政府2023年12月21日"
路段沉降,上海市闵行区交通委员会,2023-12-26,https://xfb.sh.gov.cn/xinfang/yjzj/feedback/feedbackshow?id=8883A79231CF49B0B91635A9BD4FFD16,路段沉降,2023-11-14,"本人反映, 剑川路-景东路至虹梅南路段东向西方向路面沉降大，之前养护部门给到反馈说可能存在下面水管漏水导致一直沉降。本人要求请相关主管部门实地查看，确认下此路段是否存在上述问题，以消除安全隐患。",2023-12-26,上海市闵行区交通委员会,韩同志：    关于您反映路段沉降大，要求确认下此路段是否存在上述问题，以消除安全隐患的诉求我委于2023年11月17日受理。剑川路（虹梅南路-景东路），东起虹梅南路，西至景东路，全长约510m，双向两车道布置，道路等级为二级公路。经管道CCTV检测后显示，此路段管道并无破损、塌陷现象发生。我委已将该段道路列入2024年大中修计划，目前正在积极推进方案研究，预计2024年上半年将工程可行性研究方案报送区相关审批部门，待区相关审批部门批复工程可行性研究报告后，我委将尽快展开施工工作。特此告知。
关于垃圾清运问题,上海市浦东新区北蔡镇人民政府,2023-12-26,https://xfb.sh.gov.cn/xinfang/yjzj/feedback/feedbackshow?id=573E409A0A6A4FAD87F86AED2A34FDFD,关于垃圾清运问题,2023-12-25,本人反映小区里垃圾车每天早晨6点不到就来收垃圾，干垃圾清运车装运垃圾时，汽车发出巨大轰鸣声，影响居民的休息。本人认为清运垃圾应该是在不影响居民休息的前提下作业。本人要求调整垃圾清运车作业时间，尽量不要影响居民休息。,2023-12-26,上海市浦东新区北蔡镇人民政府,信访事项处理意见书房同志：您反映的信访事项已受理。经研究，现答复如下：关于您反映垃圾车噪音扰民，要求处理的问题。经协调，清运公司已将干垃圾清运时间调整为每日8点以后。感谢您对我们工作的关心、理解和支持。上海市浦东新区北蔡镇人民政府2023年12月25日
关于施工问题,上海市浦东新区书院镇人民政府,2023-12-26,https://xfb.sh.gov.cn/xinfang/yjzj/feedback/feedbackshow?id=6BA6A934C9DC4771B417EEBB9BE50E4E,关于施工问题,2023-12-15,"本人反映,道路施工方损坏我家大门本人要求,施工方进行赔偿",2023-12-26,上海市浦东新区书院镇人民政府,褚同志：您于2023年12月15日反映的信访事项，我单位已办理完毕。您反映：道路施工方损坏其家大门，进行赔偿。经核实，现回复如下：收到您的诉求后，村委工作人员第一时间至现场了解情况，现场情况属实，已联系施工单位，经多次协商后，意见达成一致，对此您表示满意。我单位对您反映的情况回复如上。感谢您对我们工作的理解支持，请及时对以上处理进行满意度评价。上海市浦东新区书院镇人民政府2023年12月21日
小区物业管理问题,上海市闵行区莘庄镇人民政府,2023-12-26,https://xfb.sh.gov.cn/xinfang/yjzj/feedback/feedbackshow?id=FEDFD84B79E246DEAB85E2B99ECD6F2F,小区物业管理问题,2023-11-08,"本人反映小区居民在家中长期存放电瓶车一辆，并在家中充电，每日通过电梯上下楼。本人认为，非法存放电瓶车违法了上海非机动车管理条例第29条中对非机动车存放的管理要求，危害住户的生命安全。本人要求,1.联合执法，对该住处业主进行行政处罚，并妥善安放该电瓶车。2.小区租户持有每层楼的电表箱锁钥匙，长期电表箱里存放大量纸板箱，也存在消防隐患，请一并整改。",2023-12-26,上海市闵行区莘庄镇人民政府,沈同志，您好！我镇于2023年11月8日收悉您反映小区居民家中存放电瓶车，家中充电；小区租户长期在电表箱内存放大量纸板的事项。现将您反映的事项答复如下：关于小区居民家中存放电瓶车、家中充电的事项。经莘庄镇房管所向小区物业服务企业了解，物业服务企业在日常巡查中未发现业主将电瓶车停放在自己家中。经居委会、物业服务企业调取监控和上门实地查看，在现场并未发现有家中电瓶车充电的情况。物业服务企业也向居民宣讲了电瓶车室内充电的危害，居民承诺不会在家中充电电瓶车。居委会表示会关注电瓶车室内充电情况，发现后立即劝阻，联系民警做进一步处置。关于小区租户长期在电表箱内存放大量纸板的事项。经莘庄镇房管所向小区物业服务企业了解，电表箱锁为业主自行管理。针对业主在电表箱内存放物品的情况，物业服务企业已联合居委会对此情况进行不定期整治。居委会和物业服务企业已对小区租户进行上门教育并劝阻，其答应不会再将纸板箱放在电表箱内。特此答复。
关于充电问题,上海市浦东新区北蔡镇人民政府,2023-12-26,https://xfb.sh.gov.cn/xinfang/yjzj/feedback/feedbackshow?id=EE2977C9AF5E4B5DB032EBE86E191F1A,关于充电问题,2023-12-25,本人反映，小区楼栋内飞线充电严重，天气已经进入冬天小区用电量上升，个别居民法律意识淡薄违反消防安全法律法规，对周边邻居带来很大安全隐患，希望相关部门核实处理。,2023-12-26,上海市浦东新区北蔡镇人民政府,信访事项处理意见书于同志：您反映的信访事项已受理。经研究，现答复如下：关于您反映小区楼栋内飞线充电严重，要求处理的问题。经查，接到您的反映后，居委会同物业对整个小区进行了巡查，对存在私拉电线充电的现象进行了制止，并告知存在的安全隐患，同时张贴了相关告知书。后续居委和物业将加强宣传及日常巡查管理。感谢您对我们工作的关心、理解和支持。上海市浦东新区北蔡镇人民政府2023年12月25日
装修包虚假宣传,上海市闵行区建设和管理委员会,2023-12-26,https://xfb.sh.gov.cn/xinfang/yjzj/feedback/feedbackshow?id=7DA2081494B94A7B87D1F89B1CB28D3E,装修包虚假宣传,2023-11-14,"本人反映,购买了住宅装饰服务，买卖过程中对方有多种违法行为，需要市场监督管理、整治，1. 诱导消费及胁迫销售：代表开发商方的前端销售人员严重虚假宣传装修服务及夸大不买装修服务的严重后果；2. 虚假宣传、欺诈销售：装修服务价格清单无法提供，实际落地装修材料质量与宣传严重不符， 严重危害人民健康；3. 无效合同：装修合同从前期销售存在欺诈手段订立合同，到实际落地损害集体利益，及合同本身的免责条款及霸王条款会造成人身伤害等，均构成合同无效。本人认为,装修服务过程、合同违法。本人要求,介入执法，取消合同，退还服务，全额退还费用，对销售方依法处罚。",2023-12-26,上海市闵行区建设和管理委员会,余同志：您好！您来信反映家居公司虚假宣传装修包，要求退赔违法赚取的利益所得的事项已收悉，我委对此十分重视，并责成闵行区建筑建材业管理所立即派员进行调查，现将相关情况答复如下：经闵行区建筑建材业管理所监督员立即前往现场核实，现场施工内容均按图施工。关于虚假宣传和合同履约等问题，建议您向相关职能部门反映或通过司法途径解决。特此告知。
小区电表老化,上海市普陀区人民政府长风新村街道办事处,2023-12-26,https://xfb.sh.gov.cn/xinfang/yjzj/feedback/feedbackshow?id=2EE32D0085644F1B94A63DAD092579BC,小区电表老化,2023-09-13,本人反映，现在居住的大楼楼龄达到40年以上，老旧电线存在众多问题，适逢夏季或者冬季用电量激增的情况下火灾隐患严重。已经有好几户居民家里短路停电，电表烧坏。经由电力公司和物业排查后发现，是大楼电线年久失修，进线太细且老旧，无法承受目前的荷载。本人认为，先提出质疑，此事宜是否为长风居委会牵头负责？是否属于老旧小区改造范围？是否需要动用业委会的维修基金？基于去年本小区已经进行过一轮改造工程，经历且不限于走道窗户更换、大厅地砖铺设、外立面涂刷等项目，从未征询过居民意见。然而电线的维修和更换并不在此列，物业严重推诿，故意拖延不出解决方案。本人要求，更换新的电线，且标准为一户一根，保障居民用电及生命财产安全。,2023-12-26,上海市普陀区人民政府长风新村街道办事处,告知书陈同志：您好！您反映的信访事项本机关已受理。经研究，现答复如下：某小区去年进行“美丽家园”改造工程，系列改造项目中，电线维修更换未在此列。部分居民要求对上述楼栋更换老旧电线的诉求，可根据《市住宅物业管理规定》第68、69条的相关规定：此类全小区的共用设施的改造应由全体业主共同决定，费用通过维修资金由全体业主共同承担。目前，小区居委会连同物业、业委会已启动楼栋业主征询，结果将依据流程予以公示。感谢您对社区工作的关心、理解和支持。上海市普陀区人民政府长风新村街道办事处2023年12月5日
