title,agency,date,links,标题,来信日期,信件内容,回复日期,回复单位,回复内容
关于“三类人员”电子证书下载问题,上海市住房和城乡建设管理委员会行政服务中心,2023-08-11,https://xfb.sh.gov.cn/xinfang/yjzj/feedback/feedbackshow?id=534F514589D0494DAAD5D0FD50AE3C96,关于“三类人员”电子证书下载问题,2023-08-03,我是上海某企业管理人员，自沪住建规范[2023]6号文件发布以来，“三类”人员电子证书需要更换使用新版证书，在使用贵委新系统下载证书过程中，经常出现卡顿、网络繁忙、生成证书时间过长无响应等问题，有时下载一个证件需要好几个小时，而且个人不方便下载，更换新系统后需要下载大量人员证件，望贵委持续优化系统，方便企业使用。,2023-08-11,上海市住房和城乡建设管理委员会行政服务中心,同志您好：您反映的信访事项本机关已受理。经研究，现答复如下：您反映三类人员”电子证书下载问题，在使用新系统下载证书过程中，经常出现卡顿、网络繁忙、生成证书时间过长无响应等问题，建议持续优化系统，方便企业使用。我中心已回复您，三类人员国标证书换证前期由于存量证书数量巨大，且全国都在进行换证工作，住建部相关数据接口访问量也十分巨大，导致可能存在证书生成延迟和排队现象，目前系统已整体平稳。感谢您对我中心工作的关心、理解和支持。上海市住房和城乡建设管理委员会行政服务中心2023年8月11日
物业不管楼宇门铃问题,上海市普陀区桃浦镇人民政府,2023-08-11,https://xfb.sh.gov.cn/xinfang/yjzj/feedback/feedbackshow?id=8F52576182894FFFA2AAC70372ECEB04,物业不管楼宇门铃问题,2023-06-02,本人反映，桃浦八村21号的楼道门铃23年没有维护保养，导致现在很多家都不能用了，本人认为，公共区域的维修非个人能力可以解决，要求物业维修或换新，使楼宇门铃可以正常使用。,2023-08-11,上海市普陀区桃浦镇人民政府,梁同志：您于2023年6月2日致信反映小区21号楼道门铃23年没有维护保养，现在很多家都不能用，需要换新或保养的信访事项已收悉。您反映的问题，经了解，6月15日下午，物业已帮助您修复了门铃。关于公共部位的维修需要业主大会同意，目前居民、物业也已向业委会提交维修呼叫系统门铃方案。感谢您的来信。上海市普陀区桃浦镇人民政府2023年7月26日
擅自封闭公共区域窗户,上海市普陀区桃浦镇人民政府,2023-08-11,https://xfb.sh.gov.cn/xinfang/yjzj/feedback/feedbackshow?id=4EA27BFE9D0D441E9FD65057E31164B4,擅自封闭公共区域窗户,2023-06-14,本人反映，5楼居民擅自将4楼公共区域窗户锁闭（用铅丝缠绕捆绑），导致4楼居民无法使用，通风不便。本人认为，其行为侵犯了4楼居民的权利。本人要求，该居民立即自行拆除。,2023-08-11,上海市普陀区桃浦镇人民政府,陈同志：您于2023年6月14日致信反映5楼居民擅自将4楼公共区域窗户锁闭（用铅丝缠绕捆绑）导致4楼居民无法使用，通风不便的信访事项已收悉。您反映的问题，经了解，6月21日，物业、居委书记，社区民警已与五楼居民进行交流，五楼居民答应将铅丝自行拆除，并已落实。目前，已无铅丝缠绕捆绑现象。感谢您的来信。上海市普陀区桃浦镇人民政府2023年7月28日
金沙江路61号门口圆柱体标志筒垃圾太多,上海市普陀区人民政府长风新村街道办事处,2023-08-11,https://xfb.sh.gov.cn/xinfang/yjzj/feedback/feedbackshow?id=0EF2252D203742AEBA76D2DE6E8685C1,金沙江路61号门口圆柱体标志筒垃圾太多,2023-06-16,本人反映，金沙江路61号门口人行道上某个起到阻隔作用的圆柱体标志筒没有封顶，里面垃圾太多，要求把里面的垃圾清理干净，并且把筒体上面用水泥封死，杜绝往里面扔垃圾的可能。,2023-08-11,上海市普陀区人民政府长风新村街道办事处,信访事项答复意见书温同志：您反映的信访事项本机关已受理。经研究，现答复如下：您反映金沙江路61号门口人行道上某个起到阻隔作用的圆柱体标志筒没有封顶，里面垃圾太多，要求相关部门把里面的垃圾清理干净，并且把筒体上面用水泥封死。经了解，您反映的情况属实。街道已派工作人员对金沙江路61号圆柱标志筒内垃圾进行清理并用水泥封顶。感谢您对街道工作的关心、理解和支持。上海市普陀区人民政府长风新村街道办事处2023年7月28日
希望锦江出租车尽快退还压金,上海市道路运输管理局,2023-08-11,https://xfb.sh.gov.cn/xinfang/yjzj/feedback/feedbackshow?id=6F0F5FC1757A4783A3F2ECC3545AE3E0,希望锦江出租车尽快退还压金,2023-07-10,"本人反映,今年五月份我在锦江出租车退车按照约定现在押金应该全部给我，可是至今还差一部分没有退完。本人要求,立刻退还剩余押金。",2023-08-11,上海市道路运输管理局,马同志：  您好！您关于出租行业的来信已收悉，经研究，现将处理意见答复如下：  收到您的来信后，管理部门及时联系锦江出租车公司核实相关信息。经核实，锦江出租车公司表示您的相关费用已退还至您的个人账户。经承办部门电话与您沟通，您对此处理表示满意。  感谢您对本市道路运输行业的关心和支持。                                  上海市道路运输管理局                                           2023年7月26日
关于电动车安全停放问题,上海市金山区枫泾镇人民政府,2023-08-11,https://xfb.sh.gov.cn/xinfang/yjzj/feedback/feedbackshow?id=4C064E2D4F2F439D927A007F12FCB4AB,关于电动车安全停放问题,2023-07-18,反映依云四季小区，居民楼架空层大量停放电瓶车，还有电动汽车，存在消防安全隐患，请相关部门尽快处理整顿。,2023-08-11,上海市金山区枫泾镇人民政府,陈同志：您好！您信访反映的事项收悉，现答复如下：经了解，该小区电动车地下停车库由于坡道设计不合理，部分业主不愿停放，为了解决电动车上楼、电动车乱停放的问题，物业将架空层设置为非机动车临时停放点。经职能部门咨询消防支队，消防支队反馈没有法律法规禁止电动车临时停放在架空层。层内未安装充电插座，不得充电，同时配置了足够的灭火器，安保人员会定时巡查，如发现飞线等现象，将会及时制止。目前，开发商正在研究坡道改造方案，预计年底前改造完毕。待业委会成立以后，可根据意见征询结果安装地面停车充电棚。感谢您对我们工作的支持和理解。
关于土地流转问题,上海市金山区朱泾镇人民政府,2023-08-11,https://xfb.sh.gov.cn/xinfang/yjzj/feedback/feedbackshow?id=1ABFF471C3C54934BE4B487D1D174CC9,关于土地流转问题,2023-07-21,反映朱泾镇待泾村村委会在蒋泾12组农田里种植树木，距离村民家门口不到100米，严重影响村民生活质量，建议归还农田，用于种植粮食。,2023-08-11,上海市金山区朱泾镇人民政府,薛同志：您好！您反映的事项已受理。经研究，现答复如下：经查，您反映地块承包人已和村委会签署流转协议，目前已流转给花开海上生态园，用地性质为林地，目前种植的苗木品种为矮生梅花，高度不到1米，种植品种符合土地流转相关规定。感谢您对我们工作的理解与支持。
关于怀孕检查、产科建卡的建议,上海市嘉定区卫生健康委员会,2023-08-11,https://xfb.sh.gov.cn/xinfang/yjzj/feedback/feedbackshow?id=66C3C90953BB448E8028DE07C4DB757F,关于怀孕检查、产科建卡的建议,2023-07-10,我想对孕期检查和产科建卡提出建议。在我多次的陪伴体验中，我发现通常一个上午的时间，只能完成一个B超检查，大部分的时间都在等待。为此，我提出以下几点建议：1.增加医疗人员和设备的数量，以提高检查的效率。2.建议优化预约制度，让孕妇可以预约到具体的检查时间，并且能做出在合理的时间内完成，一整套的就医，比如果说在规定的1-2小时内，完成挂号、检查、就诊。3.采取分时段检查，可以考虑将一天的检查时间分成几个时段，每个时段接受一定数量的孕妇进行检查。这样既可以避免人员过于集中，也可以提高检查效率。,2023-08-11,上海市嘉定区卫生健康委员会,陆同志：您反映的信访事项本机关已受理。经研究，现答复如下：感谢您对我区孕产期检查工作提出的宝贵意见，目前嘉定区妇幼保健院孕期建卡及定期产检均是采取预约制，产检过程可能需要一定的等待时间。院方也将持续努力改善服务流程，为患者提供更好的诊疗服务，进一步提升患者的就医感受度和满意度。感谢您对嘉定卫生健康工作的关心、理解和支持。上海市嘉定区卫生健康委员会2023年7月20日
地下车库潮湿,上海市嘉定区江桥镇人民政府,2023-08-11,https://xfb.sh.gov.cn/xinfang/yjzj/feedback/feedbackshow?id=412DE521BFA54D60BB66A63B76D92FBA,地下车库潮湿,2023-07-11,本人反映，小区地下车库潮湿，物业不采取任何措施，求解决。,2023-08-11,上海市嘉定区江桥镇人民政府,吴同志：您反映的信访事项已受理。经研究，现答复如下：对于您所反映的情况，物业已对地下车库采取对应除湿防潮措施，摆放抽湿机，保持车库干燥，并对除湿通风设施设备运行情况及除湿效果进行检查维修，目前除湿通风设施设备已正常运行。居委也将督促物业对地下车库加强巡查，确保地下库车干净整洁。感谢您对我们工作的关心、理解和支持。特此函复。上海市嘉定区江桥镇人民政府2023年7月14日
关于垃圾站清运问题,上海市浦东新区三林镇人民政府,2023-08-11,https://xfb.sh.gov.cn/xinfang/yjzj/feedback/feedbackshow?id=EEE1519F5CFE4657BF60C7012D9FF2FF,关于垃圾站清运问题,2023-07-14,我们小区对面有个垃圾处理站，每天凌晨5点就开始工作了，一大早的车辆进出、喇叭及卸货的声音很吵，严重扰民，影响我们早上的休息，我也不是说不能发出声音，至少早上7点前，大家都还没起床的时候减少车辆进出，以及减少发出噪音。 ,2023-08-11,上海市浦东新区三林镇人民政府,宋同志：您反映的信访事项本机关已受理。经研究，现答复如下：经了解，居委已联系环境公司告知该情况，环境公司表示负责范围广，工作量大，但今后在处理垃圾时会注意，减少噪音扰民的情况。您的意见将予以采纳，感谢您对上海市浦东新区三林镇人民政府工作的关心、理解和支持。上海市浦东新区三林镇人民政府2023年7月14日
关于小区流浪猫问题,上海市浦东新区三林镇人民政府,2023-08-11,https://xfb.sh.gov.cn/xinfang/yjzj/feedback/feedbackshow?id=54736FF6C3B84447845240DEE60B5EBD,关于小区流浪猫问题,2023-07-14,"我们小区最近发现流浪猫已比较多了，主要是小区内有部分爱心老阿姨，喜欢在小区花坛内放置食盆和水盆，经常将剩饭剩菜投喂流浪猫，导致小区内流浪猫逐渐增多,论白天还是晚上都能见到流浪猫到处闲逛，弄的小区道路和小花园都脏兮兮的，带孩子的都绕着走，避免小孩被猫抓伤，这么多的流浪猫是有一定风险的，所以来信希望新区督促三林镇做好属地管理，能够有效的避免小区流浪猫越来越多。",2023-08-11,上海市浦东新区三林镇人民政府,王同志：您反映的信访事项本机关已受理。经研究，现答复如下：经协调，属地居委将加强流浪猫喂养的宣传教育，并动员爱猫人士居家收养，同时物业公司将加强小区的日常管理，及时清扫猫粪便、猫毛等垃圾废弃物，并喷洒驱虫药水，做好保洁工作。您的意见将予以采纳，感谢您对上海市浦东新区三林镇人民政府工作的关心、理解和支持。上海市浦东新区三林镇人民政府2023年7月14日
小区外来车辆过多，希望加强管理,上海市浦东新区三林镇人民政府,2023-08-11,https://xfb.sh.gov.cn/xinfang/yjzj/feedback/feedbackshow?id=905E7A9368AF4F3F9E188A150EEBC67D,小区外来车辆过多，希望加强管理,2023-07-14,我们小区是老小区，之前小区建造时，开发商末考虑小区内机动车辆普遍后停放的规划，导致小区现在停车位紧张，小区业主都是先到先得的临停车位，最近发现有外来车辆停在小区内，主要是去附近餐饮店吃饭，每次居民外来车主沟通让位，遇到素质差的车主就会和你大吵大闹，已引发小区内多次争吵，由于物业保安会收取临停车费，他们经常无视我们居民。我们居民也多次和小区物业沟通过，但是效果不佳。故此次来信希望有关部门能够督促小区物业加强小区管理，尽快整改。,2023-08-11,上海市浦东新区三林镇人民政府,雷**同志：您反映的信访事项本机关已受理。经研究，现答复如下：经了解，三林房办已督促小区物业加强小区日常管理工作，提升小区保安服务水平，遵守小区停车管理规约，确保外来车辆能够及时挪车。您的意见将予以采纳，感谢您对上海市浦东新区三林镇人民政府工作的关心、理解和支持。上海市浦东新区三林镇人民政府2023年7月14日
咨询上市公司持股平台减持个税怎么交纳？,国家税务总局上海市第四税务分局,2023-08-11,https://xfb.sh.gov.cn/xinfang/yjzj/feedback/feedbackshow?id=E0FB5CD68AC04D5EB0BCB2E073527A85,咨询上市公司持股平台减持个税怎么交纳？,2023-07-30,咨询上市公司持股平台减持，个人所得税怎么交纳的？,2023-08-11,国家税务总局上海市第四税务分局,"刘某同志：您好！您来信咨询的事项收悉。针对您的提问已电话联系并回复。根据《国家税务总局关于切实加强高收入者个人所得税征管的通知》(国税发〔2011〕50号)第二条规定,对个人独资企业和合伙企业从事股权(票)、期货、基金、债券、外汇、贵重金属、资源开采权及其他投资品交易取得的所得，应全部纳入生产经营所得，依法征收个人所得税。感谢您的咨询！涉及实际操作问题以主管税务机关的判定为准。若您对此仍有疑问，请联系上海税务12366或主管税务机关。您可以登录http://xfb.sh.gov.cn查询具体办理情况。特此告知。"
咨询,上海市金山区交通委员会,2023-08-11,https://xfb.sh.gov.cn/xinfang/yjzj/feedback/feedbackshow?id=A9D3315807D64247B7B3D5DFD9872294,咨询,2023-07-31,咨询码头生产事故应急救援预案备案问题。,2023-08-11,上海市金山区交通委员会,惠同志：您好！您信访反映的事项收悉。关于您咨询的码头生产事故应急救援预案备案，在办理港口经营许可证时同时上报即可，无需线上备案。特此告知。
反映问题,上海市浦东新区人民政府周家渡街道办事处,2023-08-10,https://xfb.sh.gov.cn/xinfang/yjzj/feedback/feedbackshow?id=69838E04697844109AA801663A73BF89,反映问题,2023-06-19,本人反映：一、中汾泾河上的高科西路桥建造了十几年了，认为是危桥，要求拆除。二是反映桥边上地块变成了小区建筑垃圾临时堆放点，要求恢复。,2023-08-10,上海市浦东新区人民政府周家渡街道办事处,陈同志：您反映的信访事项本机关已受理。经研究，现答复如下：您反映高科西路中汾泾河上有一座危桥以及相邻地块管理的问题。经了解，该桥位于周家渡街道和南码头路街道交界处。经沟通，南码头路街道表示近期将聘请第三方机构对该桥进行检测，若检测结果为危桥标准，后期将联合周家渡街道共同开展拆除工作。关于相邻地块的管理问题。您反映地块现由相邻小区实际养护，该小区正进行雨污水改造工程，临时堆放相关材料，我街道相关部门已要求工程结束后立即恢复原状。感谢您对社区工作的关心、理解和支持。上海市浦东新区人民政府周家渡街道办事处2023年7月20日
希望早日征收,上海市黄浦区建设和管理委员会,2023-08-10,https://xfb.sh.gov.cn/xinfang/yjzj/feedback/feedbackshow?id=04EC30ED5C4348F4A8B5B2F8A6024BB1,希望早日征收,2023-08-06,尊敬的陈书记，您好！上海市黄浦区学院路四新小区有解放前建造的房屋，也有60年代、70年代建造的房屋，这些房屋年久老化，结构松动，尤其是上海市黄浦区学院路123号边门危房要倒塌了，用脚手架加固，拉绿色防护网，拉警戒线，挂警示牌子。由于脚手架压力，使另一幢房屋倾斜，同时脚手架挡住居民窗户，无法开窗通风，无法晾晒衣服。弄堂狭小，一旦发生大地震，没有地方逃生。居民卫生条件差，每天拎马桶、倒痰盂。上海城隍庙附近没有一条像样的马路，旅游大巴开不进，影响旅游业、商业发展，希望拓宽学院路地面道路，解决上海市黄浦区学院路四新小区房屋征收问题。,2023-08-10,上海市黄浦区建设和管理委员会,姚某某同志：您好！旧区改造始终是黄浦最大的民生和最大的发展。2022年，在成片旧改完成后，市委、市政府再次提出加速推进“两旧一村”改造的工作要求，这对于完善城市功能、提升城市面貌、满足人民群众对美好生活向往的意义十分重大。黄浦坚决贯彻市委、市政府的决策部署，创新思路办法，加大工作力度，迅速启动“两旧”改造工作。经查，四新小区目前未列入旧改征收范围，是否改造，何时改造，通过何种方式改造仍处于研究阶段。我们将会同房管等有关部门，进一步细化实施方案，明确实施方向，全力以赴改善居民生活条件。感谢您对我区旧改工作的关心和支持！上海市黄浦区建设和管理委员会2023年8月7日
求职问题,上海市人力资源和社会保障局,2023-08-10,https://xfb.sh.gov.cn/xinfang/yjzj/feedback/feedbackshow?id=3C628DB35CE14971961B97B5BCDE435A,求职问题,2023-07-17,本人反映，我是2022届江西籍应届毕业生，本科专业是法学，无工作经历。考研失败后决定找工作，因父亲在上海打工，且相信上海是年轻人发展的最好城市，遂想在上海求职。希望上海市委和市政府能够给像我这样的毕业生提供就业帮助。,2023-08-10,上海市人力资源和社会保障局,陈同志：         您好！我中心在接到来信后，根据您居住在上海市静安区大统路，遂委托静安区就业促进中心（以下简称“静安就促”）与您进一步沟通，并提供公共就业服务。         根据个人情况和需求，静安就促工作人员通过电话向您提供了初步的就业服务：         一是通过职业指导帮助个人充分了解当前上海的就业形势，分析法律专业的求职应聘方向。         二是留下静安就促职业指导师的联系电话。表示如果有求职困惑，可以直接致电咨询，也可以安排法律相关行业就业服务专家为其提供咨询服务。         三是推荐上海公共就业招聘新平台、乐业上海、静安就业微信公众号等官方公共就业服务平台。告知可以通过手机随申办APP登录公招平台搜索相关岗位应聘，适当拓宽求职渠道。         7月24日静安就促工作人员再次致电您，根据所学法学专业和求职意愿，推荐了区域内一家人力资源公司代理招聘的区非诉讼争议解决中心调解秘书岗位，向您介绍了岗位的主要工作职责和任职要求，询问应聘意向。         后续我中心将要求静安就促继续为个人持续进行指导和推荐服务。         此复。
调档问题,上海市人力资源和社会保障局,2023-08-10,https://xfb.sh.gov.cn/xinfang/yjzj/feedback/feedbackshow?id=16DAAEEA0BAB4EB49DD79DAF3E645065,调档问题,2023-06-25,本人反映，本人档函在沪工作期间存放于人才市场，由于自身从上海到外地发展需要调档本人希望开通线上调档渠道，并明确需要的材料和相关的程序。,2023-08-10,上海市人力资源和社会保障局,朱同志：       您好！经了解，由于您以为本人档案存放在人才服务中心，查询未果造成误会。而后本应由外省市工作单位进行的调档工作交由您本人进行咨询，故带来困扰。       根据您的具体情况，工作人员向您详细解释了本市流动人员人事档案管理服务政策，告知您可在上海人社App上查询本人档案存放部门和联系电话；如调档单位为外省市流动人员人事档案管理部门的，可通过人社部跨省通办系统进行线上档案调集手续。由于您为工作单位调档，按规定应进行调档手续办理，提供单位组织人事部门出具的调档函后，档案保管部门通过机要交通方式向调档单位寄递档案。       经沟通，您个人对相关政策有了了解，化解了误会。       此复。
今年增发退休养老金,上海市人力资源和社会保障局,2023-08-10,https://xfb.sh.gov.cn/xinfang/yjzj/feedback/feedbackshow?id=35F828745C7340488AECA4B76AE6400B,今年增发退休养老金,2023-07-12,能否告知今年的增发养老金啥时候到账。,2023-08-10,上海市人力资源和社会保障局,李同志：       您好！您反映的事项已收悉。现告知如下：       2023年增加的养老金，企业退休人员和城乡居保按月领取养老金人员于7月17日，机关事业单位退休人员于7月31日通过相关银行、邮局发放到领取养老金人员的账户中。       感谢您对我们工作的关心、理解和支持！       特此告知。
咨询,上海市人力资源和社会保障局,2023-08-10,https://xfb.sh.gov.cn/xinfang/yjzj/feedback/feedbackshow?id=326EDD6DFB9049FF89F903022A2F0EFE,咨询,2023-07-14,本人想知道上海23年退休人员增资政策何时公佈？什么时候发放？。,2023-08-10,上海市人力资源和社会保障局,顾同志：       您好！来信收悉。       今年本市调整退休人员养老金方案已经公布，增加的养老金，企业退休人员和城乡居保按月领取养老金人员于7月17日，机关事业单位退休人员于7月31日通过相关银行、邮局发放到领取养老金人员的账户中。       特此回复。
社保转移办理进度问题,上海市人力资源和社会保障局,2023-08-10,https://xfb.sh.gov.cn/xinfang/yjzj/feedback/feedbackshow?id=AEBB745D0E2C4E0A915C4BBBD899CA65,社保转移办理进度问题,2023-07-25,社保转移进度太慢，7月14日审核通过，截止今天社保还没转过来，希望加快进度。,2023-08-10,上海市人力资源和社会保障局,李同志：        您好！现就您的来信答复如下：         您于2023年7月14日申请了《城镇职工基本养老保险关系跨省转出》业务，本市社保经办机构于7月14日完成转出审核，7月25日外省市社保经办机构确认本市信息表，7月31日养老保险基金支付成功。         特此告知。
养老金问题,上海市人力资源和社会保障局,2023-08-10,https://xfb.sh.gov.cn/xinfang/yjzj/feedback/feedbackshow?id=CE3022DD42A84B3BB6A7C87B9828DB40,养老金问题,2023-07-21,请问特级教师津贴是否纳入基本养老金。,2023-08-10,上海市人力资源和社会保障局,钱同志：         您好！来信收悉！现就您来信反映的特级教师津贴问题答复如下：          经电话了解，您反映您亲戚91年中学教师退休，是否享受特级教师津贴。根据《教育部、劳动人事部关于中小学特级教师退休离休和调动工作以后补贴费处理的意见》（[82]教计资字213号）相关规定，您亲戚的养老金组成中已包含特级教师津贴。         此复。
退休金问题,上海市人力资源和社会保障局,2023-08-09,https://xfb.sh.gov.cn/xinfang/yjzj/feedback/feedbackshow?id=B5ABEC248C8A408F9EC587D1582BA069,退休金问题,2023-07-01,本人咨询今年调整的退休金什么时间发放。,2023-08-09,上海市人力资源和社会保障局,王同志：       您好！来信收悉。现就您反映的问题答复如下：       从2023年1月起，本市对2022年底前已按规定办理退休手续并按月领取基本养老金的职保退休人员增加养老金。增加的养老金（含从今年1月份补发的养老金）于7月17日发放到领取养老金人员的账户中。对此，本市官方媒体已于7月14日作相关报道。       如需进一步咨询，可拨打上海市人力资源和社会保障局咨询电话12333，或就近前往社保经办机构咨询。       此复。
