title,agency,date,links,标题,来信日期,信件内容,回复日期,回复单位,回复内容
缴费情况证明问题,上海市人力资源和社会保障局,2023-08-09,https://xfb.sh.gov.cn/xinfang/yjzj/feedback/feedbackshow?id=F2A1150653854AD29BCB917A80DDE35F,缴费情况证明问题,2023-07-04,龚市长您好！本人于6月20日至上海浦东社保中心办理社保参保记录证明。当日工作人员和我说社保参保证明无法立刻拿到，至少要下一周才能打印出证明，由于我现在不在上海，只能选择挂号信的形式收取。在我填写了一份申请书和挂号信地址后就和我说办理好了，等待后面的挂号信送达即可。然而现在距离办理日已经过去半个月，我依然没有收到社保参保证明。期望能够尽早拿到社保参保证明。,2023-08-09,上海市人力资源和社会保障局,王同志：       您好！您致市委市府信访办的信件已转上海市社会保险事业管理中心浦东分中心收悉。对于您反映要求出具缴费情况的问题，现答复如下：       参保个人因特殊情况需要社保缴费记录，可至社保中心柜面提出申请，审批同意后将手工出具相关的社保缴费证明。经查，您原提供的联系地址无法邮寄到，已与您电话沟通，委托他人至分中心领取缴费情况。       特此回复。
关于留学生申请落户的疑问,上海市人力资源和社会保障局,2023-08-09,https://xfb.sh.gov.cn/xinfang/yjzj/feedback/feedbackshow?id=E9B76C5226564B6295A5247031EEB7F9,关于留学生申请落户的疑问,2023-07-27,"本人大学本科学制为2+2，后2个学年共计4个学期在国外学习。由于存在寒暑假回国的情况，且毕业后暑假开始即回国，导致实际在境外时间不满2年。落户申请提交后，因不满足“本科阶段累计在外学习时间一般不少于2年”，未通过审核。本人认为,2020年发布的《留学回国人员申办上海常住户口实施细则》中，第三条条第一款第5项条件细则中要求的“本科阶段累计在外学习时间一般不少于2年”，是否考虑了学制为2年，实际境外时间不满2年的情况？细则中使用“一般”这个修饰词，是否表示，存在本科阶段累计在外学习时间少于2年，也满足第三条第一款第5项。十分期望收到回信，谢谢。",2023-08-09,上海市人力资源和社会保障局,熊同志：       您好！来信收悉。      《留学回国人员申办上海常住户口实施细则》第三条第一款第5项所指国（境）外学士学位如为最高学位的，不含国内大专起点本科、有关国家高等教育文凭（HND）、国内计划外招生的合作办学及转学分等形式，本科阶段累计在外学习时间一般不少于2年。       感谢您对于留学回国人员申办上海常住户口政策的关心和关注，同时，感谢您的意见和建议！我们将认真研究，努力把工作做得更好。上海张开怀抱欢迎广大优秀的留学人员来到上海、选择上海、喜欢上海、扎根上海，我们将结合国家相关规定和实际情况，进行综合考量，欢迎及时关注发布的最新政策和信息。       特此回复。上海市人力资源和社会保障局起点本科、有关国家高等教育文凭（HND）、国内计划外招生的合作办学及转学分等形式，本科阶段累计在外学习时间一般不少于2年。感谢您对于留学回国人员申办上海常住户口政策的关心和关注，同时，感谢您的意见和建议！我们将认真研究，努力把工作做得更好。上海张开怀抱欢迎广大优秀的留学人员来到上海、选择上海、喜欢上海、扎根上海，我们将结合国家相关规定和实际情况，进行综合考量，欢迎及时关注发布的最新政策和信息。特此回复。
感谢,上海市静安区人力资源和社会保障局,2023-08-09,https://xfb.sh.gov.cn/xinfang/yjzj/feedback/feedbackshow?id=0685C491EA0A4120B321B8378AF22BAA,感谢,2023-07-17,尊敬的龚市长，您好，在您的监督和部门的协调下，公司已经把不合常理罚的二百块钱还给了我，维护了普通工人的合法权益，这充份体现了您全心全意为人民服务的一贯作风，是位焦裕禄式的好官，谢谢，祝您身体健康，工作顺利。也感谢静安区社会保障局，劳动监察大队的机关员工的依法履职，尽责。敬礼！！,2023-08-09,上海市静安区人力资源和社会保障局,简复告知书金同志：您好！您于2023年7月17日信访反映的事项收悉。感谢您对我们的工作理解与支持，我们将一如既往地做好本职工作。如您有其他疑问，也可直接与我们沟通咨询。特此告知。
举报群租房,上海市静安区人民政府芷江西路街道办事处,2023-08-09,https://xfb.sh.gov.cn/xinfang/yjzj/feedback/feedbackshow?id=A0D2F9594F854A35A56C461CF4DFE350,举报群租房,2023-07-04,本人反映太阳山路***弄5号楼****号房，一套一居室被非法隔断改造成12个小单间。最小的一间房只能勉强放下一个单人床。。。居住环境极其恶劣，消防隐患极其严重。人员数量众多杂乱，极其容易发生火灾问题。希望查处。,2023-08-09,上海市静安区人民政府芷江西路街道办事处,居民同志：您反映的信访事项本机关已受理。经研究，现答复如下：收到举报后，7月21日芷江西路街道综合行政执法队、城市运行中心、平安办等部门联合上门对该处进行了检查，发现部分违规分隔和多人租住的情况，当即拆除违规分隔间，并对该处租客进行劝离。街道将继续关注并督促房东做好整改工作。感谢您对党和政府工作的关心、理解和支持。
共享单车停放,上海市静安区人民政府北站街道办事处,2023-08-09,https://xfb.sh.gov.cn/xinfang/yjzj/feedback/feedbackshow?id=16E3D198E3EE48FD84ABB40BEB6277B3,共享单车停放,2023-07-21,"来信反映,海宁路13XX号门口附近长期停放着一辆黄色的僵尸共享单车，希望能够派人立刻处理掉。",2023-08-09,上海市静安区人民政府北站街道办事处,告知书陈先生：您好，您来信提出的事项已收悉，现我单位已处理完毕，回复如下：收到来信后，街道社管办立即安排工作人员对该长期停放的共享单车进行清理，同时将安排工作人员加强巡逻，及时发现和处理。感谢您对社区工作的理解和支持。特此告知。
咨询海外本科上海市落户问题,上海市人力资源和社会保障局,2023-08-09,https://xfb.sh.gov.cn/xinfang/yjzj/feedback/feedbackshow?id=5D394C3CB723470BBC0D6711A616A72C,咨询海外本科上海市落户问题,2023-07-30,我家孩子在澳大利亚……大学马来西亚校区就读，明年即将毕业，取得的是澳大利……大学学士学位，但留服认证的就读地点为马来西亚校区。请问：该校区毕业生是否能够直接落户上海，感谢回复，谢谢！,2023-08-09,上海市人力资源和社会保障局,蒋同志：        您好！您反映的事项已收悉。现告知如下：        留学人员在国（境）外学习获得学位的院校以教育部出具的国外学历学位认证书中载明的颁发该学位证书的院校名称为准。同时，成绩单和offer中的学校名称也可用来佐证。如果名称一致，即可认为是同一学校。       特此告知。
土地使用权取得方式的含义,上海市规划和自然资源局,2023-08-09,https://xfb.sh.gov.cn/xinfang/yjzj/feedback/feedbackshow?id=1F1FEA05FAB44D4A8BC7A519B631C59E,土地使用权取得方式的含义,2023-07-21,"本人反映,咨询专业问题，《不动产登记簿信息》上“土地使用权取得方式”中有“土地使用权转让”“出让”“划拨”，咨询不同取得方式的原因，以及在交易中的限制，谢谢！",2023-08-09,上海市规划和自然资源局,信访事项答复意见书陈*同志：您反映的信访事项已受理。经研究，现答复如下：根据《国土资源部关于启用不动产登记簿证样式（试行）的通知》（国土资发[2015]25号），“不动产登记簿使用和填写说明”二、填写说明（一）宗地、宗海基本信息的规定，【权利性质】国有土地填写划拨、出让、作价出资（入股）、国有土地租赁、授权经营、家庭承包、其他方式承包等；集体土地填写家庭承包、其他方式承包、批准拨用、入股、联营等。土地所有权可以不填写。根据《上海市不动产登记技术规定》集体土地上的非居住房屋，划拨土地上的花园住宅、非居住房屋及出让土地（空转）上的房地产办理转移登记的特殊规定：4.2.27.1因转让划拨土地上的花园住宅和非居住房屋申请转移登记的，还应当提交规划资源部门同意使用划拨建设用地的书面意见或者建设用地使用权有偿使用的合同及缴清土地出让金的证明。4.2.27.2集体土地上的非居住房屋申请转移登记的，还应当提交规划资源部门同意使用集体土地的书面意见。4.2.27.3除第4.2.26条的情形外，出让土地（空转）上的房地产申请转移登记的，还应当提交建设用地使用权有偿使用的合同及缴清土地出让金的证明。感谢您对规划资源工作的关心、理解和支持。上海市规划和自然资源局2023年8月4日
查询住宅间距设计规范,上海市规划和自然资源局,2023-08-09,https://xfb.sh.gov.cn/xinfang/yjzj/feedback/feedbackshow?id=8083553B26994537A2F84803C209389B,查询住宅间距设计规范,2023-08-03,"本人反映,查询不到规范本人认为,应有便捷查询途径本人要求,提供查询路径",2023-08-09,上海市规划和自然资源局,信访事项答复意见书吕**同志：您反映的信访事项已受理。经研究，现答复如下：您要求获取《上海市城市规划管理技术规定》的信息，我局官网（链接：http://hd.ghzyj.sh.gov.cn/zcfg/ghss/201912/t20191216_954532.html）已主动公开，可以查询相关间距标准。感谢您对规划资源工作的关心、理解和支持。上海市规划和自然资源局2023年8月7日
虹梅菁典和徐汇芳邻之间空地规划,上海市闵行区规划和自然资源局,2023-08-09,https://xfb.sh.gov.cn/xinfang/yjzj/feedback/feedbackshow?id=CF693D1CA684419EBACEA5F013E39928,虹梅菁典和徐汇芳邻之间空地规划,2023-07-21,相关领导，您好希望知道虹梅菁典和徐汇芳邻之间空地（见附件图）土地属性和未来规划，楼高多少?,2023-08-09,上海市闵行区规划和自然资源局,**同志：您于2023年7月21日致信《咨询信箱》人民来信咨询“虹梅菁典和徐汇芳邻之间空地规划”事项已由上海市规划和自然资源局收转至我局处理，我局信访登记编号为闵规划资源信访（网）2023070074号。现回复如下：经查，您所咨询地块涉及已批控制性详细规划为《上海市闵行区梅陇社区MHP0-0303、MHP0-0304控制性详细规划（修编）》（沪府规〔2014〕89号），具体为02-16-04地块，用地面积11832平方米，规划用地性质为幼儿园（RS6）。您所询地块土地性质为国有。感谢您对闵行区规划和自然资源局工作的理解和支持。特此告知。
请长宁区慧加美公司和华阳物业合力搞好清宁小区乱停车问题,上海新长宁（集团）有限公司,2023-08-09,https://xfb.sh.gov.cn/xinfang/yjzj/feedback/feedbackshow?id=E718C58C11E348EAA437F561C469C6EB,请长宁区慧加美公司和华阳物业合力搞好清宁小区乱停车问题,2023-07-15,"本人反映,清宁小区25号单元楼门口，每日有加装电梯分包施工队机动车胡乱停放，影响机动车、行人、非机动车正常通行。本人认为,慧加美公司应加强合作方车辆管理，华阳物业应及时引导车辆停放在合理区域，如果没车位，那就去别的地方停。本人要求,25号单元楼门口，以及小区里不是车位的其他地方，都不应停车。请慧加美公司管好合作方行为，请华阳物业履行好车辆停放管理职责。",2023-08-09,上海新长宁（集团）有限公司,"佟**同志：    您反映的信访事项已受理。经研究，现答复如下：    您反映清宁小区25号单元楼门口前存在加装电梯分包施工队机动车胡乱停放情况，已经影响机动车、行人、非机动车正常通行，要求华阳物业履行好车辆停放管理职责。    收到您反映的事项后，属地华阳物业当即要求施工方工程车按照规定停放，不得影响小区其他车辆和行人的通行。若再次发生此类情况，将禁止其车辆进入小区。    华阳物业将进一步加强小区车辆管理工作,有效维护好小区良好的停车秩序。    感谢您对我司工作的关心、理解和支持。    上海新长宁（集团）有限公司    2023年7月21日"
关于旧房改造,上海市长宁区住房保障和房屋管理局,2023-08-09,https://xfb.sh.gov.cn/xinfang/yjzj/feedback/feedbackshow?id=430D198F61A14AE2B9E81F99D82B8639,关于旧房改造,2023-07-16,"本人反映,长宁区仅关注天山五村拆落地试点，不利于这项工作以后全区推进。本人认为,天山五村拆落地试点区域，所在区域隔壁楼栋曾于2019年实施征收拆迁，剩下未征收拟拆落地的居民一直都认为自己会被征收，这次拆落地方案已启动第一次意见征询，至今也有4年时间，现在已经僵局了，绝大多数人都认为，区里面盯着五村不去谈其他地方拆落地旧改，就是因为那块地要用。如果最终五村拆落地谈不成，实施征收，这将对整个长宁未来其他小区旧改的推进造成更大困难，旧改工作会越做越难，后面如果其他小区再去试点拆落地，又会模仿五村居民，很多居民会认为反正拖到最后会拆的。本人要求,长宁区的旧改拆落地试点，不应该只关注和宣传天山五村，而是应该之前3到4个街道几个不同小区同时展开，这样有利于最终方案的实施和落地。千万不要把事情越做越难。",2023-08-09,上海市长宁区住房保障和房屋管理局,汪**同志：    您来信反映天山五村拆落地事宜已转交我局进行处置，现回复如下：    经查，天山五村位于仙霞街道，房屋类型为新工房，用途为居住。属于上海新长宁（集团）仙霞物业有限公司管理。    天山五村1-2号等八幢房屋拆除重建项目还在继续推进中。截至目前，绝大部分居民已同意拆除重建方案，少数不同意居民在继续做工作。    为推进长宁区“两旧一村”工作，目前在新华、江苏街道开展番禺路217弄、长宁路1088弄、江苏路284弄等小区同时实施拆除重建征询工作。    上海市长宁区住房保障和房屋管理局    2023年8月7日
百色路汇成五村居民求装电梯,上海市徐汇区人民政府长桥街道办事处,2023-08-09,https://xfb.sh.gov.cn/xinfang/yjzj/feedback/feedbackshow?id=4570F78C389C412C8B944A83C43F425D,百色路汇成五村居民求装电梯,2023-07-18,反映希望汇成五村可以加装电梯，改善生活。,2023-08-09,上海市徐汇区人民政府长桥街道办事处,信访事项答复意见书周**同志：您反映的信访事项本机关已受理。经研究，现答复如下：您反映希望汇成五村可以加装电梯，改善生活。接信访件后，长桥街道自治办于2023年7月25日、8月3日两次与您电话沟通，解释了政策。1、加装电梯是居民自治行为，楼道居民若需安装电梯，应需楼道内居民选出三人小组，并进行全楼征询，按照相关规定，需达到2/3参与表决，3/4同意即可。今年汇成五村居委在街道办事处指导下，重新开展过征询，该楼栋居民整体愿意加梯的户数不足。2、加装电梯工作推进开始时，区房管局聘请的专家对该处楼道的评估报告显示为“不适合加装”电梯，因该楼栋距离相邻的幼儿园距离太近，按照相关施工标准要求空间不够。在与您沟通中也向您说明，如该楼栋加梯意愿非常强烈，征询通过后街道可邀请代建公司上门重新勘察情况，研究是否有技术上解决该困难的可能性。以上事项均已向您说明，并向您介绍了加装电梯的工作开展流程。感谢您对长桥社区工作的关心、理解和支持。上海市徐汇区人民政府长桥街道办事处2023年8月3日
建国西路夜间施工扰民,上海市徐汇区建设和管理委员会,2023-08-09,https://xfb.sh.gov.cn/xinfang/yjzj/feedback/feedbackshow?id=DE30AD3ACA824DC299A8E2E45190E645,建国西路夜间施工扰民,2023-07-16,建国西路存在夜间道路施工，噪音扰民情况。,2023-08-09,上海市徐汇区建设和管理委员会,"包**同志：您反映的信访事项本机关已受理。经研究，现答复如下：您反映建国西路存在夜间道路施工，噪音扰民情况。本机关认为，经核实此处为建国西路煤气隐患管网改造升级工程，建国西路煤气管网已使用近30年，此工程旨在消除建国西路煤气管网隐患，彻底避免煤气泄露等安全问题。为了不影响该区域白天的交通安全，经征询交警部门意见，只同意在夜间施工,我中心于7月19日23：00联合城管部门对建国西路进行现场安全文明施工执法，经检查现场施工噪音符合夜间施工噪音标准。我中心已督促施工单位负责人优化施工方案，使用内衬法工艺减少噪音，将破碎路面等大噪音施工安排在夜间23：00之前完成，23:00之后进行低噪音的排管工作，预计此处路段施工于十天左右完工。感谢您对我委工作的关心、理解和支持。上海市徐汇区建设和管理委员会2023年8月3日"
小区停车问题,上海市青浦区人民政府盈浦街道办事处,2023-08-09,https://xfb.sh.gov.cn/xinfang/yjzj/feedback/feedbackshow?id=912D15B8A1A64F349AB50A95F8E79F78,小区停车问题,2023-07-11,"本人反映,本小区停车问题始终得不到解决，交了停车费，居民的停车却得不到保障。门口的道闸系统有名无实，外来车辆可以随意进入；占用了小区本就不多的车位资源。给小区带来了安全隐患。本人要求,小区安装道闸门禁系统，合理规划停车位，非本小区车辆按时段收费。",2023-08-09,上海市青浦区人民政府盈浦街道办事处,唐先生：您好！您来信反映的事项收悉。经了解，小区业委会就小区道闸系统问题正与设备方沟通中，目前设备正在调试中。小区物业将继续做好外来车辆信息登记工作，同时加强车辆日常停放管理。感谢您对我们工作的关心、理解和支持。
关于宣传人民调解典型案例的建议,上海市司法局,2023-08-09,https://xfb.sh.gov.cn/xinfang/yjzj/feedback/feedbackshow?id=05C18C548D1D46CFB49167B4C7D1B716,关于宣传人民调解典型案例的建议,2023-08-03,一、	现状在《司法部》网页的《人民调解-案例库》给出了很多很好的人民调解案例的文字说明。为了提高公民素质，提高普法效果，司法部门应该编制上述人民调解的典型案例的普法视频，在司法部门网页和百度上发布及在抖音上发布。二、	建议建议上海市司法局编制人民调解的典型案例的普法视频（包含文字说明和动画表演），在司法局网页和百度上发布及在抖音上发布。,2023-08-09,上海市司法局,您好！您的建议已收悉。现告知如下：我局已通过电话向您介绍了当前市司法局对人民调解案例进行宣传的相关工作，包括组织编写、审核上报司法部，在中国法律服务网上发布宣传，依托报刊、微信公众号、视频号对案例信息宣传等。因抖音的受众范围尚未达到微信层级，后续会结合实际考虑是否依托抖音开展人民调解案例的普法宣传。我们将积极采纳您的建议，在今后的人民调解案例宣传工作中，更注重运用视频和新媒体等形式，提升体验感。感谢您对人民调解工作的关心、支持。特此告知。上海市司法局2023年8月9日
社保缴费明细证明申请,上海市人力资源和社会保障局,2023-08-09,https://xfb.sh.gov.cn/xinfang/yjzj/feedback/feedbackshow?id=039B2FC6E86F4495B763093AAB129AB8,社保缴费明细证明申请,2023-07-06,17-18年在上海杨浦区工作，现在人外地，因新工作工龄认定需要社保明细。本人不在上海，找不到区社保局电话，请协调解答如何办理，盼复。【需要打印社保缴费记录、带有缴费单位名称的缴费证明。】,2023-08-09,上海市人力资源和社会保障局,张同志：       您好！您给上海市委市府信访办的网信已转本中心收悉，现答复如下：       关于您要求出具社保缴费证明的事宜，我们已开具缴费情况并寄出。       此复。
关于居住证积分申请手续的建议,上海市人力资源和社会保障局,2023-08-09,https://xfb.sh.gov.cn/xinfang/yjzj/feedback/feedbackshow?id=C680C5C357554F28B39D6D88EDC1E64F,关于居住证积分申请手续的建议,2023-07-19,上海居住证积分办理要求的手续异常繁琐，到处都要纸质原件。希望无纸化办理上海居住证积分申请。,2023-08-09,上海市人力资源和社会保障局,黄同志：       您好！您反映的事项已收悉。现告知如下：       申办《上海市居住证》积分时，除特殊说明外，所有积分申请材料均须核对原件，提交复印件。对于能够通过调用电子证照、数据共享等方式核验相关申办材料信息的，可免于提交纸质申办材料。在外省市工作期间获得的三级及以上技能等级证书，须通过技能人才评价证书全国联网查询系统或上海市人力资源和社会保障局网站查询核验。       感谢您对我们工作的关心、理解和支持！       特此告知。
工伤问题,上海市人力资源和社会保障局,2023-08-09,https://xfb.sh.gov.cn/xinfang/yjzj/feedback/feedbackshow?id=0D78C3A42A35492D865BD1F6F4A87D31,工伤问题,2023-07-21,请问相关部门，工伤5级/6级企业无法安排工作、按月领取企业发放的伤残津贴的工人，其待遇依据什么文件进行调整？,2023-08-09,上海市人力资源和社会保障局,韩同志：       您好！您的来信已转至我局收悉。现就您咨询的问题答复如下：      《工伤保险条例》规定，职工因工致残被鉴定为五级、六级伤残的，保留与用人单位的劳动关系，由用人单位安排适当工作。难以安排工作的，由用人单位按月发给伤残津贴，标准为：五级伤残为本人工资的70%，六级伤残为本人工资的60%，并由用人单位按照规定为其缴纳应缴纳的各项社会保险费。伤残津贴实际金额低于当地最低工资标准的，由用人单位补足差额。目前，国家对五级、六级工伤职工伤残津贴调整没有明确政策规定。       此复。
关于公交招呼站站牌问题,上海崇明生态交通集团有限公司,2023-08-09,https://xfb.sh.gov.cn/xinfang/yjzj/feedback/feedbackshow?id=4EA53233BDB246F89BC3A3B334C5515B,关于公交招呼站站牌问题,2023-07-23,"本人反映,关于建材市场招呼站站牌老旧问题本人要求,应进行修缮改进",2023-08-09,上海崇明生态交通集团有限公司,赵（先生/女士）：您好！您反映的信访事项已收悉。经研究，现答复如下：经调查核实，您反映情况属实，南裕专线招呼站（建材市场）站点上的站牌图字迹因时间久而模糊不清。现新的站牌已制作完成，并更换完毕。感谢您对我们工作的关心、理解和支持。
关于公交站点命名问题,上海崇明生态交通集团有限公司,2023-08-09,https://xfb.sh.gov.cn/xinfang/yjzj/feedback/feedbackshow?id=537615903566456D8722108733113F31,关于公交站点命名问题,2023-07-12,本人反映，堡陈中线经过的煊州（公交站）和堡七线经过的煊洲（公交站）读音相同，写法相似，且相距也不过一百二十多米。煊洲之名可能是来源于汲浜乡的抗日烈士蒋煊洲。煊州呢？本人认为，两站距离相近，读音相同，难以区分。本人要求，应做出区分。,2023-08-09,上海崇明生态交通集团有限公司,赵（先生/女士）：您好！您反映的信访事项已收悉。经研究，现答复如下：两条线路中“煊州（公交站）”与“煊洲（公交站）”应为同一地点，因工作产生漏洞导致个别字写法差异，“煊洲（公交站）”为正确写法。接到您来信后，崇明巴士公司已将涉及线路车厢内的票价表、走向图、走字屏进行了整改。站点上的站牌图将由设施公司尽快整改。感谢您对我们工作的关心、理解和支持。
