title,agency,date,links,标题,来信日期,信件内容,回复日期,回复单位,回复内容
关于改造工程问题,上海市浦东新区高行镇人民政府,2023-08-31,https://xfb.sh.gov.cn/xinfang/yjzj/feedback/feedbackshow?id=B8ABD8608E5141B1A4B393D497DD9DEC,关于改造工程问题,2023-06-23,"本人反映,小区改造施工中废除道路旁原有绿化带及修复污水井盖问题。本人认为,小区楼宇（临近别墅区）是小区主干道，该主干道右旁原本有一排整齐的、终年常青的黄杨树绿化带（绿化带高度约近1米高）。本次改造施工中，该黄杨树绿化带被临时拔除了。但截至今日，补种回来的情况是：黄杨树都是被剪过后的短树干，没有绿叶，补种的数量远远不够。这些补种回来的，能成活吗？镇政府应该补齐黄杨树绿化带，并保证其成活。除毁损绿花带之外，北侧一污水井盖没有修复好。本人要求,一、应保质保量补种好小区楼宇南侧（临近别墅区）小区主干道旁自东至西一排整齐的、终年常青的黄杨树绿化带（绿化带高度约近1米高），并确保黄杨树成活。二、铺设好北侧一污水井盖。",2023-08-31,上海市浦东新区高行镇人民政府,冯同志：您来信反映的问题已收悉。经了解，现相关职能部门答复如下：为进一步巩固水环境整治成果，落实长效养护，根据《上海市新一轮雨污混接整治工作方案》要求，按照新区统一部署，在全区开展新一轮住宅小区雨污混接整治工作。我镇涉及57个小区，其中包含您所居住小区。一、关于您反映绿化的问题由于立管改造重新接入地下管网需在绿化带中施工，按照施工方案，施工单位在开挖前将较大的绿化树木进行了移栽，在管道铺设完成并回填后，将移栽的树木回复原位，并补种其他绿化。由于树木经过移栽，考虑到气温较高，为保证树木存活，对部分枝叶进行了修剪，后续由物业对树木进行日常养护。二、关于您反映北侧污水井盖的问题目前施工单位已经修复完成。特此告知。上海市浦东新区高行镇人民政府2023年7月31日
关于“美丽家园”改造问题,上海市浦东新区人民政府东明路街道办事处,2023-08-31,https://xfb.sh.gov.cn/xinfang/yjzj/feedback/feedbackshow?id=C0613E3E656D4D4AB2837DE45E69FBA5,关于“美丽家园”改造问题,2023-07-23,"本人反映，本人小区90号91号92号，西面绿地被毁坏，用于建造一条6米宽约50米长的断头路。从居委会了解到这条路是为了给架空层停车而开设的断头路。本人认为,1.原来的绿化更好更美丽。该绿化事实上隔绝了水泵房，隔绝了西面三岔路口大量车流。2,在开工之前完全不知情，改建工程白改黑沥青道路。3，该道路是非必要断头路。建造在居民户主卧正前方，即正西方三岔路和居民主卧正面外墙前。4,房子有骑楼，可以联通改造的楼道通道，行人可以通行。请求还原绿化，将此处美丽还给居民。现提出诉求， 恢复绿化。",2023-08-31,上海市浦东新区人民政府东明路街道办事处,李同志：您反映的信访事项已受理。现答复如下：您于2023年7月23日向《市委领导信箱》人民来信反映：小区91号西面绿地被毁坏，用于建造一条断头路。从居委了解到这条路是为了给架空层停车而开设的断头路。该道路毁坏了原有的绿化，求决。接件后，街道管理办立即派员对此事进行调查了解。经了解，8月3日管理办电话联系您，就小区综合整新项目具体情况做了解释。一是本项目开展前，小区业主委员会于2021年12月22日公示召开业主大会公告，其中综合整新改造内容包括屋顶、墙面、楼道、停车位优化及修缮宅间绿化等项目，并说明项目最终方案以住建部门批复的内容为准。2022年1月12日以92.75%的同意率通过综合整新方案表决并进行公告。二是实际施工中，相关施工细节要求施工队及时做好解释，同时确保安全文明施工，将对居民的影响降至最低。感谢您对政府和社区工作的关心、理解和支持。上海市浦东新区人民政府东明路街道办事处2023年8月10日
关于地板维修问题,上海市浦东新区三林镇人民政府,2023-08-31,https://xfb.sh.gov.cn/xinfang/yjzj/feedback/feedbackshow?id=27B8E2299063453E964BB79CF8CE9659,关于地板维修问题,2023-06-19,本人反映，本人居住小区，物业未解决小区居民的诉求。自收房后，多次、多渠道向物业提出地板存在质量问题，需要维修，至今未解决。本人认为，多次联系后，未得到反馈甚至电话沟通。本人要求，积极协调、尽快将业主的问题解决！,2023-08-31,上海市浦东新区三林镇人民政府,汪同志：您反映“曾向物业反映地板存在质量问题，至今未解决”的信访事项已受理。经研究，现答复如下：经三林房办了解，小区竣工于2020年，目前由物业管理有限公司（以下简称“物业”）为小区提供物业管理服务。经三林房办核实，该房屋室内精装修已过2年质保期，开发商不再承担后续维修责任。物业已多次协调精装修单位的施工人员上门进行维修工作，并承担了维修费用。若您的权益受到侵害，可以向有权管辖的人民法院提出。感谢您对上海市浦东新区三林镇人民政府工作的关心、理解和支持。上海市浦东新区三林镇人民政府2023年8月8日
关于马路菜场扰民问题,上海市浦东新区惠南镇人民政府,2023-08-31,https://xfb.sh.gov.cn/xinfang/yjzj/feedback/feedbackshow?id=030EE4478110415B905BF4F3D2FFBF78,关于马路菜场扰民问题,2023-07-15,"本人反映, 浦东新区惠南镇通济路，在这条短短几十米的人行道上和马路上每天4点起就有大批流动摊贩聚集于此，占道经营，环境脏乱差，噪音扰民，扰乱交通，已经严重影响沿街居民生活，本人要求,希望在这一路段设置执法岗亭，早上5点到9点派人在此路段驻守巡逻，还我们一个整洁干净安静的生活环境。",2023-08-31,上海市浦东新区惠南镇人民政府,徐同志：您反映通济路，占道经营，要求处理的来信收悉。现答复如下：经了解，针对餐饮店跨门经营的现象，惠南镇综合行政执法队员均已告知当事人不得将桌椅餐具等摆放到店外经营。针对早上占道设摊现象，每天凌晨也有执法队员进行巡查执法。后续将不定期组织专项整治，逐步消除跨门经营现象。特此告知。感谢您的来信。上海市浦东新区惠南镇人民政府2023年8月14日
关于食品安全问题,上海市浦东新区川沙新镇人民政府,2023-08-31,https://xfb.sh.gov.cn/xinfang/yjzj/feedback/feedbackshow?id=BEFD8DD6845340E7AEBABD167EECB957,关于食品安全问题,2023-08-08,"本人反映,浦东新区川沙镇凌空路新川路路口西有人骑个三轮车每天每餐销售客饭，希望政府取缔，要还百姓一个放心食品。",2023-08-31,上海市浦东新区川沙新镇人民政府,卢同志：您反映的信访事项本机关已受理。经研究，现答复如下：经我镇城管中队执法队员现场调查，发现有三名人员在该处售卖盒饭，执法队员当场责令立即整改离开，并给予当场处罚，同时派队员对该处加强固守和巡查监管，一旦发现问题立即整改。上海市浦东新区川沙新镇人民政府2023年8月25日
关于医院病史打印问题,上海市浦东新区卫生健康委员会,2023-08-31,https://xfb.sh.gov.cn/xinfang/yjzj/feedback/feedbackshow?id=52BF3DFC0F594043B7AFD2B5DE7B95BE,关于医院病史打印问题,2023-07-27,本人在医院4月1日就诊，由于医院病史打印机重复打印，导致第一第二第三行挤在了一起，本人当时问过一楼工作人员，称门诊病史无法重复打印，导致保险公司无法赔偿。恳请领导帮忙解决。,2023-08-31,上海市浦东新区卫生健康委员会,信访事项处理意见书傅同志：您反映的“医院打印病史不清晰导致保险公司无法赔偿”来信已收到。经研究，现答复如下：我委接件后立即要求医院与您取得联系，就此事进行沟通解释。据悉，医院已与您联系并解释，以图片形式提供清晰病史。我委也要求医院进一步加强医院管理，提高医疗质量，优化医疗服务。如不服本意见，您可自收到本处理意见之日起30日内向上海市卫生健康委员会或浦东新区人民政府提出复查申请。如逾期不提出复查申请，本意见即为最终意见。感谢您对浦东卫生工作的理解和支持。上海市浦东新区卫生健康委员会2023年8月10日
关于自动挂号机器不能刷异地医保码挂号问题,上海市浦东新区卫生健康委员会,2023-08-31,https://xfb.sh.gov.cn/xinfang/yjzj/feedback/feedbackshow?id=5531D3C605214D54BB410C7D2E62C6AF,关于自动挂号机器不能刷异地医保码挂号问题,2023-07-24,"本人反映,医院自动挂号机器不能刷异地医保码挂号本人认为,应该要可以本人要求,应该要支持 方便我们异地老百姓 ",2023-08-31,上海市浦东新区卫生健康委员会,杨同志：您反映的“医院自动挂号机不能刷异地医保码挂号”的来信已收到。经研究，现答复如下：我委收到您的来信后立即要求医院与您取得联系，就您反映的问题进行沟通解释。据悉，医院已与您取得联系，异地医保卡需至参保地先报备。我委也要求医院进一步加强管理，不断改进医疗服务，提升服务水平，改善患者就医体验。感谢您对浦东新区卫生工作的建议与支持。上海市浦东新区卫生健康委员会2023年8月1日
关于小区垃圾站开门时间问题,上海市浦东新区人民政府花木街道办事处,2023-08-31,https://xfb.sh.gov.cn/xinfang/yjzj/feedback/feedbackshow?id=3F873970824D4592A40C4E505590016F,关于小区垃圾站开门时间问题,2023-06-21,"本人反映,尊敬的领导您好，很抱歉因为扔垃圾这个小事打搅您。本人居住的小区门口有个垃圾站是固定时间扔垃圾，早上6:00-9:30,晚上6:00-8:30.但是我天天起得晚回家晚，根本凑不上扔垃圾时间。本人认为,垃圾站不要锁门，就应该开着门，让大家自由扔垃圾，就算是自由扔垃圾，绝大多数人也都是早上扔，极少数人会像我这么特殊白天扔。本人要求,垃圾站不要锁门了，请给我自由扔垃圾的机会，谢谢领导，盼解决。",2023-08-31,上海市浦东新区人民政府花木街道办事处,张同志：您好！2023年7月6日，我单位受理您提出的信访事项。您来信反映小区垃圾投放点固定时间开放，要求全天开放。经调查研究，现答复如下：经核实，该小区垃圾投放时间为周一至周五6:30-9:00；18:00-20:00；周六、周日6:30-9:30；18:00-20:30，符合《上海市生活垃圾管理条例》对于生活垃圾定时定点分类投放的相关要求。关于您提出的希望该垃圾房全天开放的建议，鉴于小区投放点位位置较为特殊及生活垃圾管理相关工作要求，您的建议暂时无法予以采纳。谢谢您的来信，并请一如既往关心、关注和支持花木社区工作！上海市浦东新区人民政府花木街道办事处2023年8月4日
关于购车后置换补贴问题,上海市浦东新区商务委员会,2023-08-31,https://xfb.sh.gov.cn/xinfang/yjzj/feedback/feedbackshow?id=1C69ED51863041D0B7AEFBA598C447DD,关于购车后置换补贴问题,2023-07-08,本人反映，于2022年12月购置新能源车一辆；购买时，根据4S店告知，旧车置换购买新能源车，可获得6000元置换补贴。本人于购车当月（2022年12月）根据4S店要求，提供了所有旧车置换申请补贴材料。截止2023年7月，6000元补贴尚未返还。本人认为，购车时，4S店方告知的置换补贴属于车辆买卖双方的预定，且已根据4S店方要求提供相关材料，应在合理时间内半截并返还补贴。本人要求，1.明确置换补贴审核所需时间。2.根据明确的时间周期，尽快完成审核并发放补贴款项。,2023-08-31,上海市浦东新区商务委员会,信访事项处理意见书徐同志：您反映的信访事项已受理。经研究，现答复如下：您反映您于2022年12月在上海浦东新区购置新能源车一辆，购买时被告知可以取得6000元以旧换新补贴，您按要求提供了相关资料，但至今仍未取得补贴。您希望尽快落实补贴。经查，确定您是在该4S店购买的车辆，且是用您家庭其他成员的名义签订的合同。所涉及的以旧换新补贴事项，已经落实。如不服本意见，您可自收到本处理意见之日起30日内向上海市商务委员会提出复查申请。如逾期不提出复查申请，本意见即为最终意见。感谢您对我们工作的关心、理解和支持。上海市浦东新区商务委员会2023年8月9日
关于医院病房卫生问题,上海市浦东新区卫生健康委员会,2023-08-31,https://xfb.sh.gov.cn/xinfang/yjzj/feedback/feedbackshow?id=97500F21E0494D44B5A8A756D482CD3F,关于医院病房卫生问题,2023-07-25,"本人反映，医院2号楼3楼1-6病床所在病房里卫生问题，电风扇上的积灰和柜子有积垢。本人认为,作为医院应该保持卫生清洁。本人要求,上海市政府应该责成主管部门督促改正。",2023-08-31,上海市浦东新区卫生健康委员会,蒋同志：您反映的“医院病房卫生问题”的来信已收到。经研究，现答复如下：我委收到您的来信后立即要求医院与您取得联系，就您反映的问题进行沟通解释。据悉，医院已与您取得联系，就相关问题致歉并加强整改。我委也要求医院进一步加强管理，不断改进医疗服务，提升服务水平，改善患者就医体验。感谢您对浦东新区卫生工作的建议与支持。上海市浦东新区卫生健康委员会2023年8月10日
关于加建人行上桥通道的建议,上海市浦东新区川沙新镇人民政府,2023-08-31,https://xfb.sh.gov.cn/xinfang/yjzj/feedback/feedbackshow?id=B14FC5E1549B4F3083216F3020FA6A99,关于加建人行上桥通道的建议,2023-07-19,本人反映：目前川沙镇北部川杨河北岸沿河目前正建设“春桐路”。“春桐路”东端与华东路川杨河桥之间规划为绿化带，是断头路，居民沿着春桐路往东无法步行到达华东路。极大不便居民出行。本人建议：新建台阶或坡道等方式，打通正在建设中的春桐路与华东路川杨河桥的步行连接，这样将极大的方便附近所有居民出行。也方便幼儿园和中学的孩子上学。,2023-08-31,上海市浦东新区川沙新镇人民政府,李同志：您反映的信访事项本机关已受理。经研究，现答复如下：经查，您所购在建商品房的配套道路为春桐路，因该道路连接的华东路土地性质为集体土地，根据相关规定目前不能建设通道，待建设华东路绿带时，我镇将协调区环保局一并予以解决，以方便居民出行。上海市浦东新区川沙新镇人民政府2023年8月7日
关于加建人行上桥通道的建议,上海市浦东新区川沙新镇人民政府,2023-08-31,https://xfb.sh.gov.cn/xinfang/yjzj/feedback/feedbackshow?id=DF7C785986F6470DBF9903A65E3A22C4,关于加建人行上桥通道的建议,2023-07-18,本人反映：春桐路与华东路川杨河桥之间规划为绿化带，春桐路与华东路川杨河桥落差约3米；居民沿着春桐路往东无法步行到达华东路。本人建议，恳请政府考虑新建台阶或坡道等方式打通春桐路与华东路川杨河桥的步行连接，这样将极大的方便附近所有居民出行。除了方便居民，也方便幼儿园和中学的孩子上学。,2023-08-31,上海市浦东新区川沙新镇人民政府,赵同志：您反映的信访事项本机关已受理。经研究，现答复如下：经查，您所购在建商品房的配套道路为春桐路，因该道路连接的华东路土地性质为集体土地，根据相关规定目前不能建设通道，待建设华东路绿带时，我镇将协调区环保局一并予以解决，以方便居民出行。上海市浦东新区川沙新镇人民政府2023年8月8日
关于加建人行上桥通道的诉求,上海市浦东新区川沙新镇人民政府,2023-08-31,https://xfb.sh.gov.cn/xinfang/yjzj/feedback/feedbackshow?id=F0A33B1237814E24852FFED5BB343B5E,关于加建人行上桥通道的诉求,2023-07-18,本人反映，春桐路与华东路川杨河桥之间规划为绿化带，春桐路与华东路川杨河桥落差约3米；居民沿着春桐路往东无法步行到达华东路。鉴于此本人建议，恳请政府考虑新建台阶或坡道等方式打通春桐路与华东路川杨河桥的步行连接，这样将极大的方便附近所有居民出行。除了方便居民，也方便幼儿园和中学的孩子上学。,2023-08-31,上海市浦东新区川沙新镇人民政府,张同志：您反映的信访事项本机关已受理。经研究，现答复如下：经查，您所购在建商品房的配套道路为春桐路，因该道路连接的华东路土地性质为集体土地，根据相关规定目前不能建设通道，待建设华东路绿带时，我镇将协调区环保局一并予以解决，以方便居民出行。上海市浦东新区川沙新镇人民政府2023年8月8日
解决停车难问题,上海市浦东新区人民政府洋泾街道办事处,2023-08-31,https://xfb.sh.gov.cn/xinfang/yjzj/feedback/feedbackshow?id=2DEDDE295ED04C98A537FE0D4F6D0CF7,解决停车难问题,2023-06-12,"本人反映,本人居住小区为老小区，车位紧张，常有非本小区车辆停放或长期停放，影响本小区车辆停放。本小区非固定车位，但有多人使用非机动车辆占据车位。小区监控“严重”不足！只有出入口安装有监控设备 小区内的多数道路无监控。本人认为,小区是居民的一个大家，和谐的环境可以让居民更团结本人要求,共四点，第一，把好小区的大门，严禁外部车辆长时间停放，过夜停放，这需要物业和保安的严格管理。第二，打击小区内部的占车位，抢车位等不文明行为。第三，增加小区内部的监控设备，至少做到无死角，保障居民的财产安全。第四，适当减少绿化增加车位。",2023-08-31,上海市浦东新区人民政府洋泾街道办事处,信访事项答复意见书倪同志：您反映博山路博山小区停车相关事宜的信访事项本机关已受理。现答复如下：关于要求物业公司把好小区的大门，严禁外部车辆长时间停放，过夜停放，并加强小区管理的问题。洋泾房管办已与物业公司联系，同时物业公司也已承诺将加强小区巡视，疏导小区地面停车管理，劝阻和制止小区居民乱停车和外来车辆停放，确保小区地面道路畅通无阻行人安全，更好地为小区居民服务。关于要求物业公司打击小区内部的占车位，抢车位等不文明行为的问题。物业公司已表示将加强小区巡视，劝阻和制止小区居民在停车位上堆物等抢占停车位，如有抢占停车位的行为，在巡视中发现后立即将物品搬离。关于建议增加小区内部的监控设备和适当减少小区绿化增加停车位的问题。小区内新增摄像监控设备和扩建停车位等问题，应由小区业委会或业主大会依据相关的法律法规商议决定。以上二项建议，建议您向小区业委会反映提议。感谢您对街道工作的理解和支持。上海市浦东新区人民政府洋泾街道办事处2023年8月7日
查找2009年初中义务教育转学记录,上海市浦东新区教育局,2023-08-31,https://xfb.sh.gov.cn/xinfang/yjzj/feedback/feedbackshow?id=2A49BB476B5547B9B29C9558391A4884,查找2009年初中义务教育转学记录,2023-08-21,"本人反映,想查询2009年读完初二转学至浙江学校读书的转学记录。打了962066转3，查询不到学籍信息，本人认为，2009年办了转学手续，回浙江学校读书后，2010年毕业，当时没拿到毕业证，也没多想原因，没拿到就没深究。现在想要补办初中证明，被浙江学校的教育局告知查不到我初中转学学籍。本人要求，上海查明情况。",2023-08-31,上海市浦东新区教育局,邵同志：您反映的信访事项本机关已受理。现答复如下：您来信反映您于2009年在上海学校读完初二转学至浙江读书，现在想要补办初中证明，但被浙江学校的教育局告知查不到初中转学学籍，其建议您回上海查明，您希望有关部门可以帮助查询的问题。经查阅您当年在沪就读学校的学籍档案，您的学籍卡显示您于2006年9月入校就读该校预备班(六年级)，并于2009年6月回原籍(浙江温州)就读，档案中无其他转学相关记录。如不服本意见，您可自收到本处理意见之日起30日内向浦东新区人民政府或上海市教育委员会提出复查申请。如逾期不提出复查申请，本意见即为最终意见。感谢您对浦东教育工作的关心、理解和支持。此复。上海市浦东新区教育局2023年8月24日
信访人对城市安全管理提出了相应的建议,上海市建设工程安全质量监督总站,2023-08-31,https://xfb.sh.gov.cn/xinfang/yjzj/feedback/feedbackshow?id=39E3443BA98A4F6EAD7522D085261E60,信访人对城市安全管理提出了相应的建议,2023-07-26,信访人因齐齐哈尔体育馆坍塌事故引发担忧，故对城市安全管理提出了相应的建议。,2023-08-31,上海市建设工程安全质量监督总站,信访答复意见书倪同志：您反映的信访事项已受理。现答复如下：您因齐齐哈尔体育馆坍塌事故引发担忧，故对城市安全管理提出了相应的建议。我站于8月1日与您进行联系，关于您反映齐齐哈尔发生的事故，我站已发布关于整治本市建筑工地违规堆载堆料管理的工作提示，并督促工程参建单位尤其是学校、医院、体育场馆、养老、幼托等公建项目要加强隐患排查整治，并且上海市住房和城乡建设管理委近期正在开展本市建筑工地安全隐患排查整治专项行动，本次行动成立10个督查组覆盖全市各区的工地进行督导检查。我站于8月11日与您再次联系，您表示你的问题已得到解答。感谢您对我站工作的支持和理解。您可以登录http://xfb.sh.gov.cn查询具体办理情况。上海市建设工程安全质量监督总站2023年8月17日
车库维修,上海市青浦区住房保障和房屋管理局,2023-08-31,https://xfb.sh.gov.cn/xinfang/yjzj/feedback/feedbackshow?id=D83496F93CE04B09B137D89CA4910D2F,车库维修,2023-07-22,本人反映，房子是2022年12月份交付的新楼盘，地下车库自6月中下旬以来出现大面积严重漏水，物业、开发商虽然派人了，但仍无济于事。本人认为，开发商区别对待地库漏水问题。同样的漏水问题，今年交付的三期由于地下车库尚未出售，开发商已经安排施工队伍紧急大修，目前漏水问题已得到控制；而我们小区地库由于车位已售，开发商仅仅安排小修小补。本人要求，政府相关部门深入群众，听取广大业主的呼声，责成开发商认真对待地库漏水问题，拿出切实可行的整改方案并立即实施。,2023-08-31,上海市青浦区住房保障和房屋管理局,杨女士：您好！您来信反映的事项收悉。经核实，您反映的商品房项目于2022年11月29日获得《上海市新建住宅交付许可证》。经查，7月21日下大雨时小区地下车库和车库大厅处存在多处漏水情况。目前开发商已进行自查，发现漏水原因，并且已启动维修工作。截止目前已对小区内2幢、5幢、7幢进行维修，其余楼栋全部正在施工中。开发商承诺对小区所有住宅楼进行整改维修，避免类似情况再次出现。我局已要求开发商按计划完成维修工作。感谢您对我局工作的理解与支持。
