title,agency,date,links,标题,来信日期,信件内容,回复日期,回复单位,回复内容
关于取消上海部分道路公交车专用车道提议,上海市道路运输管理局,2023-12-28,https://xfb.sh.gov.cn/xinfang/yjzj/feedback/feedbackshow?id=AF4B909024F54B35A317281D0E8C5000,关于取消上海部分道路公交车专用车道提议,2023-12-02,原本公交车专用车道目的在于早晚高峰，提高大部分公交通勤的上班族，上学族效率。然后随着上海城市地铁交通线路的不断完善，家庭轿车的不断普及。以往的公交车出行习惯已经有了大大的改变。就拿曹安公路为例，三根直行车道，其中一根为公交车专用道。早高峰，两根直行车道拥堵十几公里。公交专用车道空空荡荡。十几分钟通行一辆公交车。且几乎每辆公交车上连座位都没有坐满。细心观察会发现，乘坐者多为老年人居多。希望相关交通部分能够看到目前公交专用车道的存在不合理性。不但不能在早晚高峰缓解通勤，反而大大影响了交通的畅通性。,2023-12-28,上海市道路运输管理局,应同志：  您好！您关于路政行业的来信已收悉，经研究，现将处理意见答复如下：  公交优先是综合交通发展十四五规划中大力推行的集约出行理念，通过完善本市公交专用道网络，充分发挥公交专用道对公交及道路集约客运的保障功能，逐步培育公众低碳出行的良好习惯。  随着道路设施的调整和周边环境的变化，原有部分专用道存在一些不足，管理部门将持续完善专用道网络，补短板，弥不足，通过多部门、专家参与不断优化本市公交专用道的设置。您的宝贵意见我们将在日后的工作中留作参考。  感谢您对本市道路运输行业的关心和支持。                                      上海市道路运输管理局                                           2023年12月19日
感谢信,上海市宝山区市场监督管理局,2023-12-28,https://xfb.sh.gov.cn/xinfang/yjzj/feedback/feedbackshow?id=18BBB8167FA5469DBB6111CC11A27FF6,感谢信,2023-12-15,本人作为弱势群体，目前怀孕三个月，因之前对餐饮店香*浓的卫生不达标问题投诉 ，找商家理论，后经宝山区杨行市场监管所赵老师的调解，才得以将此事解决 ，也让我能够安心养胎，特别感谢赵老师，沟通调解期间有耐心，认真负责，竭尽全力为老百姓处理问题，非常专业和优秀 。特此感谢！祝赵老师工作顺利  ！,2023-12-28,上海市宝山区市场监督管理局,杨先生/女士：您好！     您的表扬信已经收到，已转至经办部门提出表扬。同时感谢您对市场监督管理工作的理解和支持！
小区公共充电桩,上海市奉贤区庄行镇人民政府,2023-12-27,https://xfb.sh.gov.cn/xinfang/yjzj/feedback/feedbackshow?id=104256E184F34182A03BCFB04B1C4C4F,小区公共充电桩,2023-12-13,"本人反映,随着新能源车的增加，电车充电需求越来越大。汇金家园小区交房时，已经装有50个左右公用充电桩，截止目前，一直处于未通电状态。本人希望能尽快解决充电桩通电问题，切实解决人民群众急难愁盼的问题。",2023-12-27,上海市奉贤区庄行镇人民政府,王同志：您好！目前庄行镇汇金家园地下车库由于电表尚未安装完成，故公用充电桩处于未通电状态，现上海万舜物业管理有限公司与电力公司正在讨论安装事项。庄行镇邬桥居委也将做好督促工作，尽快完成汇金家园地下车库电表安装工作，使地下公用充电桩通电，确保居民正常使用。感谢您对政府工作的理解和支持。
关于人行横道的建议,上海市宝山区建设和交通委员会,2023-12-27,https://xfb.sh.gov.cn/xinfang/yjzj/feedback/feedbackshow?id=E6B09C569C214DBE8D1307CB0D0D45BF,关于人行横道的建议,2023-12-06,要求恢复新沪路475弄出入口人行横道线，方便道路两侧居民及行人，保障市民的安全通行。,2023-12-27,上海市宝山区建设和交通委员会,董同志：您来信关于恢复人行横道的建议，我委已收悉，经调查，现答复如下：您反映路段为区交通委新沪路（沪太路-新村路）修复养护工程。本次新沪路（沪太路-新沪路）修复养护工程主要工作内容是对沪太路至怡华苑路段白色混凝土路面改成黑色沥青混凝土路面，同时更换沪太路至华灵路段两侧因沿街商铺损坏的人行道板，将彻底解决新沪路混凝土板块路面给沿线居民带来的噪音问题，同时有效提升道路安全性和居民出行舒适度。因目前施工尚未结束，您诉求处仅为临时标线，待后续新沪路（沪太路至怡华苑路）全段细沥青面层施工完后将恢复该处人行横道线。后续我委将加强现场安全文明施工管理，合理安排作业时间，尽快完成工程。感谢您对我们工作的关心、理解和支持。特此答复。上海市宝山区交通委员会2023年12月20日
建议增加小区到地铁站的公交,上海市宝山区建设和交通委员会,2023-12-27,https://xfb.sh.gov.cn/xinfang/yjzj/feedback/feedbackshow?id=3138DA03164748E080C19C1109288282,建议增加小区到地铁站的公交,2023-11-20,反映宝山区顾村镇顾北路（宝荻路至潘泾路）路段两侧，缺乏公交线路到地铁站（如到顾村公园地铁站），请相关部门协调解决该路段小区到顾村公园地铁站的公交，方便居民出行。,2023-12-27,上海市宝山区建设和交通委员会,蔡同志：您来信建议小区附近增加公交的事项，我委已收悉。经调查，现答复如下：对于您要求增设公交线路到地铁站的诉求，我委已记录备案，待教育路全线贯通交付后，规划调整公交线路从教育路至顾北路。后续我委将会同属地街镇、区交警部门及巴士五公司，结合周边路网情况和公交基础设施情况，优化调整周边公交线网，尽量满足市民的出行需求。感谢您对我们工作的关心、理解和支持。特此答复。上海市宝山区交通委员会2023年12月21日
关于路面不平整问题,上海市宝山区建设和交通委员会,2023-12-27,https://xfb.sh.gov.cn/xinfang/yjzj/feedback/feedbackshow?id=4E9FAABBD61E4C7AA63BB8675DCAA188, 关于路面不平整问题,2023-11-29,反映宝山区环镇北路南陈路在施工，机动车道和非机动车道路面不平整，诉求相关部门解决道路不平整问题，方便居民出行。,2023-12-27,上海市宝山区建设和交通委员会,陈同志：您来信反映南陈路环镇北路和南陈路唐祁路路面不平的事项，我委已收悉，经调查，现答复如下：该路段为区交通委合杆整治工程，目前施工尚未结束，待合杆整治工程结束后，我委将即刻开始修复摊铺工作，统一进行路面铣刨加罩，工程预计明年3月左右结束施工。目前我委将会对路段中的坑洼进行排摸巡查后，采取临时填补的方式尽可能地减轻附近居民的出行问题，由此给您带来的不便，我们表示歉意。后续我委将加强现场安全文明施工管理，合理安排作业时间，尽快完成工程。感谢您对我们工作的关心、理解和支持。特此答复。上海市宝山区交通委员会2023年12月20日
东西向公共交通优化建议,上海市宝山区建设和交通委员会,2023-12-27,https://xfb.sh.gov.cn/xinfang/yjzj/feedback/feedbackshow?id=0E5C0FDCB39C41BFBCAF845E3DA6471B,东西向公共交通优化建议,2023-11-27,反映顾北路周边开通一条可以解决周围居民上下班的公交线路，建议开通顾北路 ---顾北东路 — 红林路 — 蕰川公路 — 水产路 公交路线，完善周边公共交通，方便居民出行。,2023-12-27,上海市宝山区建设和交通委员会,孔同志：您来信反映宝山区东西向公共交通优化建议的事项，我委已收悉。经调查，现答复如下：对于您建议开通顾北路—顾北东路—红林路—蕰川公路—水产路公交线路的诉求，考虑到顾北路顾村小学和顾村中学人流量较大及道路拥堵等因素，不具备开通此条线路条件。目前规划待教育路全线贯通后，调整一条宝安公路东西向线路从教育路转至顾北路。后续我委会及时跟进周边道路建设进程，结合周边线网和公交基础设施情况，优化调整公交线路，尽量满足市民的出行需求。感谢您对我们工作的关心、理解和支持。特此答复。上海市宝山区交通委员会2023年12月21日
关于小区工程资金及施工进度相关问题,上海市宝山区建设和交通委员会,2023-12-27,https://xfb.sh.gov.cn/xinfang/yjzj/feedback/feedbackshow?id=6CE9CE2954A440FFB9A6896F05B60611,关于小区工程资金及施工进度相关问题,2023-11-05,反映上海宝山区宝莲玖邑项目工程进度滞后，诉求开发商公布账户资金情况及工程进度计划，由政府部门搭建沟通平台，有需要沟通的问题，实时沟通反馈。,2023-12-27,上海市宝山区建设和交通委员会,杨同志：您来信反映小区存在的相关问题，我委已收悉，经调查，现答复如下：宝莲玖邑小区（淞滨路780弄）为在建项目，于2020年9月22日取得施工许可证（主体），建设单位为上海宝林房地产开发有限公司，施工单位为上海宝建集团宝山建筑发展有限公司。目前该项目已完成主体结构施工，水电安装已完成，处于外立面装饰装修阶段。地下车库部分安装，室外总体待完成。我委工作人员已联系您，解释了施工进度等相关问题。11月24日，建设单位在宝莲玖邑施工现场接待部分业主代表，组织业主代表实地查看房屋进展情况，并现场解答项目进度和资金情况。感谢您对我们工作的关心、理解和支持。特此答复。上海市宝山区建设和管理委员会2023年12月8日
物业不履行承诺，影响业主正常出行,上海西部企业集团有限公司,2023-12-27,https://xfb.sh.gov.cn/xinfang/yjzj/feedback/feedbackshow?id=F7E641E0E2DF4C85AB24623F68861912,物业不履行承诺，影响业主正常出行,2023-11-30,本人反映，上海中山物业有限公司随意暂停业主两辆包月停车。2021年6月20日，我其中一辆车的车窗玻璃在某弄某号门口被利器划伤，导致车辆漏水，当时物业经理答应免除同等修车金额的停车费，按当时停车包月费用150元/月计算，应共计免停53.33月 (4.4年)；与物业经理、业委会及居委会协商，我本人愿意支持物业工作，并从2023年10月16日起开始正常缴纳停车包月费。可今年缴费时被物业经理告知，物业办公室内的一名员工要求我将未缴纳费用全部补齐才能正常续费或缴纳物业费才予以包月，现车辆包月已过期，物业不让驶离小区，严重影响本人家庭生活。本人认为，依据法律规定，物业费收缴不应与停车包月绑定。本人要求，希望物业履行承诺，继续包月，不要影响业主的正常进出。,2023-12-27,上海西部企业集团有限公司,信访事项处理意见书夏同志：您好！您来信反映的信访事项已受理。经核查，现答复如下：经了解，12月4日上午，业委会、居委会及物业共同与您的家人进行协调并达成一致。您将8年物业管理费欠费一次付清，您两辆车的其中一辆补交7月和8月的停车费用，另一辆车自2023年9月份起按第二辆车300元/月补交停车费，并且不再追缴所欠停车费。12月4日下午您已将物业欠费一次付清。12月7日经核实停车系统已经恢复，现您的车辆包月停车服务已正常启用。工作人员于12月8日联系您并告知您上述内容，您表示知晓。感谢您对我们工作的理解和支持！特此告知上海西部企业（集团）有限公司2023年12月8日
对口幼儿园,上海市普陀区教育局,2023-12-27,https://xfb.sh.gov.cn/xinfang/yjzj/feedback/feedbackshow?id=CE686A2B79724E90A05E52F745A7107F,对口幼儿园,2023-12-03,本人反映，本人居住地的对口幼儿园距离较远，老人接送幼儿非常劳累。想申请家门口的幼儿园读书。普陀区幼儿园的对口是否可以按照就近原则，或者给居民更多的自主选择权？,2023-12-27,上海市普陀区教育局,戴同志：您好！您于2023年12月3日信访反映的事项收悉。普陀区依据每年幼儿人数、地区情况、楼盘数量、幼儿园规模等要素安排幼儿就近入公办幼儿园。您的需求已进行记录，后续将结合规划依照招生当年情况核定。特此告知。上海市普陀区教育局2023年12月7日
关于排污问题,上海市浦东新区书院镇人民政府,2023-12-27,https://xfb.sh.gov.cn/xinfang/yjzj/feedback/feedbackshow?id=5E8D1DE47A6C4A6E9FEDD5E363F61575,关于排污问题,2023-12-14,有村民排放污水，请村委及时解决排污问题。,2023-12-27,上海市浦东新区书院镇人民政府,徐同志：您反映的信访事项本机关已受理。经研究，现答复如下：您反映村民排污问题，现已妥善解决。非常感谢您的来信，感谢您对我们工作的理解支持。上海市浦东新区书院镇人民政府2023年12月19日
医疗纠纷,上海市普陀区卫生健康委员会,2023-12-27,https://xfb.sh.gov.cn/xinfang/yjzj/feedback/feedbackshow?id=AC3278D5961643D9A885B1C362C56091,医疗纠纷,2023-12-01,本人反映，今年8月7日，在某医院进行了手术，承诺3个月恢复，至今没有太大效果并且给我造成比较严重的损失。本人认为，此医院有欺诈患者的行为。本人要求，医院公开赔礼道歉并赔偿。,2023-12-27,上海市普陀区卫生健康委员会,告知书董同志：您好！您信访反映的事项收悉。经了解，医院方面已自查并联系您进行了沟通解释，目前您与该医院已协商达成一致。对此，您表示认可。感谢您对普陀卫生工作的理解、支持和关注。特此告知。上海市普陀区卫生健康委员会2023年12月6日
关于家门口教育配套问题,上海市金山区教育局,2023-12-27,https://xfb.sh.gov.cn/xinfang/yjzj/feedback/feedbackshow?id=39F8593406934448A25F0CF75513B59F,关于家门口教育配套问题,2023-11-24,建议秋灵路学校适时招生初中六年级。,2023-12-27,上海市金山区教育局,李同志：您好!      您反映的信访事项本机关已受理。经研究，现答复如下：       经了解，金水湖区域新建工程项目名称是秋灵路中学，该工程项目计划于2024年7月竣工。学校具体名称和办学方式正在研究协调中。目前，正在开展入学生源排摸工作，2024年义务教育招生工作暂未启动，招生政策还未发布，请耐心等待。       感谢您对本区教育工作的关心、理解和支持。
关于教育配置问题,上海市金山区教育局,2023-12-27,https://xfb.sh.gov.cn/xinfang/yjzj/feedback/feedbackshow?id=504165CC20134F23AF8FC6C8A2EBC70D,关于教育配置问题,2023-11-24,建议秋灵路学校适时招生初中六年级。,2023-12-27,上海市金山区教育局,苏同志：        您反映的信访事项本机关已受理。经研究，现答复如下：经了解，金水湖区域新建工程项目名称是秋灵路中学，该工程项目计划于2024年7月竣工。目前，正在开展入学生源排摸工作，2024年义务教育招生工作暂未启动，招生政策还未发布，请耐心等待。        感谢您对本区教育工作的关心、理解和支持。
关于教育配置问题,上海市金山区教育局,2023-12-27,https://xfb.sh.gov.cn/xinfang/yjzj/feedback/feedbackshow?id=3D96462D1F0B4645BD49163FE1070A55,关于教育配置问题,2023-11-24,建议秋灵路学校适时招生初中六年级。,2023-12-27,上海市金山区教育局,宋同志：       您反映的信访事项本机关已受理。经研究，现答复如下：        经了解，金水湖区域新建工程项目名称是秋灵路中学，该工程项目计划于2024年7月竣工。目前，正在开展入学生源排摸工作，2024年义务教育招生工作暂未启动，招生政策还未发布，请耐心等待。         感谢您对本区教育工作的关心、理解和支持。
关于新房上学问题,上海市浦东新区教育局,2023-12-27,https://xfb.sh.gov.cn/xinfang/yjzj/feedback/feedbackshow?id=3D056CC3070B42C08D5680DE587B0C77,关于新房上学问题,2023-12-06,本人已购置新房，但在小孩入学前房产证可能还未办理，这种情况能否使用购房合同申请入学呢？,2023-12-27,上海市浦东新区教育局,洪同志：您反映的信访事项本机关已受理。现答复如下：您来信咨询小区适龄儿童、少年凭购房合同就近入学的问题。按有关法规和往年的入学政策，义务教育适龄儿童、少年在户籍所在地学校免试就近入学。符合入学条件的适龄儿童、少年，可按户籍、产证地址登记入学信息。目前，2024年本市义务教育阶段学校招生入学政策尚未发布，请关注后续发布的您孩子入学当年度的本市义务教育阶段学校招生政策。感谢您对浦东教育工作的关心、理解和支持。此复。上海市浦东新区教育局2023年12月20日
表扬工作人员,上海市浦东新区北蔡镇人民政府,2023-12-27,https://xfb.sh.gov.cn/xinfang/yjzj/feedback/feedbackshow?id=DE215EE3CA4448C281970F16DB416D7F,表扬工作人员,2023-12-20,本人反映小区门口道路坑洼积水，尤其下雨天，影响百姓的日常通行。跟镇里反映后，他们修复了路面。在此我想表扬这些为老百姓做实事的工作人员。,2023-12-27,上海市浦东新区北蔡镇人民政府,信访事项处理意见书俸同志：您反映的信访事项我镇已受理。经研究，现答复如下：您反映出行道路安全问题。经查，相关部门接单后立即进行实地勘察商议修缮道路事宜，并立即联系施工队已将涉事道路进行修缮。感谢您的表扬信及对信访工作的关心、理解和支持。上海市浦东新区北蔡镇人民政府2023年12月20日
关于道路交通安全设施设置问题,上海东滩建设集团有限公司,2023-12-27,https://xfb.sh.gov.cn/xinfang/yjzj/feedback/feedbackshow?id=DB1CD57F8E4E4420A5C24F308BD03B0B,关于道路交通安全设施设置问题,2023-12-05,请重视一下柳兰路、翠鸟路、郁金香路、雪雁路等周边小区学生上下学安全问题，在学校周边路口放置临时红绿灯，尽快把道路安全隐患消除,2023-12-27,上海东滩建设集团有限公司,宋（先生/女士）：您好！您反映的信访事项已收悉。经研究，现答复如下：经查，目前雪雁路、郁金香东路改建工程施工许可证已获批，人行道、红绿灯、路灯等将按照工程及时间节点相继展开。柳兰路和翠鸟路路灯工程已向崇明区电力公司申请路灯电源，待路灯电源工程结束后，路灯工程相继开展。根据以上情况，我公司已与崇明区公安局、陈家镇政府、陈家镇派出所等相关部门会商制定以下临时工作措施：1.柳兰路翠鸟路，雪雁路等路口已增设临时红绿灯；2.区公安局早高峰增派相关人员协助交通管制；3.陈家镇人民政府已增派临时志愿服务人员参与交通管理志愿服务。感谢您对我司工作的理解和支持。
房屋采光问题,上海市徐汇区人民政府凌云路街道办事处,2023-12-27,https://xfb.sh.gov.cn/xinfang/yjzj/feedback/feedbackshow?id=D1B8F0B4F7B14F8784C2F6065D7D9B6B,房屋采光问题,2023-11-28,罗秀路*弄小区因隔壁小区高大树木枝叶影响，常年采光受到影响，多年前曾有过一次修剪，但被修剪树木现在已重新长高枝繁叶茂，再次影响我小区居民的采光，屋内阴冷，衣物不干，老人小孩的健康受到严重影响。鉴于上次修剪不完全，紧挨居民楼的几棵高大树木未做修剪，当时阳光仍有部分遮挡，希望能够得到彻底解决。,2023-12-27,上海市徐汇区人民政府凌云路街道办事处,万**同志：您反映的信访事项本机关已受理。经研究，现答复如下：根据《上海市居住区绿化调整实施办法》规定，小区绿化修剪应由业委会经业主意见征询确认后，委托物业公司予以修剪。就您所反映问题，街道已指导小区做好意见征询工作，后续将根据征询结果，组织实施单位做好绿化修剪。感谢您对凌云街道工作的关心、理解和支持。上海市徐汇区人民政府凌云路街道办事处2023年12月15日
希望肇周路小区征收,上海市黄浦区建设和管理委员会,2023-12-27,https://xfb.sh.gov.cn/xinfang/yjzj/feedback/feedbackshow?id=1AC76540F0E84366A217210B8FB59D61,希望肇周路小区征收,2023-11-29,我们是居住黄浦区肇周路某小区的居民。随着政府房屋征收工作的逐步推进，我们周围已有二级旧里的房屋被征收，或计划被征收。我们小区紧临上海红房子医院，仅有一幢6层的老公房，共48户居民，其中不乏年近九十的老人或附近上学的孩子。我们想了解，我们的小区是否会被征收，或小区下一步的城市规划计划。  我们小区虽小，但十分雅致，是个闹中取静的地方，邻里之间非常和睦，其乐融融。听闻，可能被征收的消息，大家都很担心。政府为民着想，想为居民改善生活条件，深得人心，但在城市快速发展的同时，我们发现越来越多的上海人，离开了黄浦区，摩登的城市中少了许多上海味道，尤其是上海人文的味道。我们小区绝大部分的居民都是土生土长的上海人，甚至是土生土长的黄浦人，我们的根扎在这里，对这里有感情，我们都不曾想过要离开。最近，我们也关注到“黄浦区保屯路旧房改造”的成功案例，让我们非常欣喜，我们真心希望，我们这个仅有一幢楼的老公房，可以保留住，原拆原位。 我们期待，政府为民办实事，创造一个能让百姓安居乐业，且有人情味的地方，多几个让我们更爱这个城市的理由。,2023-12-27,上海市黄浦区建设和管理委员会,李某某同志：您好！旧区改造始终是黄浦最大的民生和最大的发展。2022年，在成片旧改完成后，市委、市政府再次提出加速推进“两旧一村”改造的工作要求，这对于完善城市功能、提升城市面貌、满足人民群众对美好生活的向往意义十分重大。黄浦坚决贯彻市委、市政府的决策部署，创新思路办法，加大工作力度，迅速启动“两旧”改造工作。经查，您反映的小区目前未列入旧改征收范围，是否改造，何时改造，通过何种方式改造仍处于研究阶段。我们将会同房管等有关部门，进一步细化实施方案，明确实施方向，全力以赴改善居民生活条件。感谢您对我区旧改工作的关心和支持！上海市黄浦区建设和管理委员会2023年12月5日
无故查封问题,上海市闵行区人民政府江川路街道办事处,2023-12-27,https://xfb.sh.gov.cn/xinfang/yjzj/feedback/feedbackshow?id=2D9A297AAC76459EAD4C23D329C32956,无故查封问题,2023-11-24,本人反映汉庭宾馆外被无故贴封条，要求取消。,2023-12-27,上海市闵行区人民政府江川路街道办事处,孙同志：您好！您反映江川路街道于11月12日擅自查封千代广场汉庭优佳宾馆的事项已收悉，现回复如下：经江川路街道协商搬迁办公室了解，上海市重大工程轨道交通23号线项目涉及江川路街道范围内相关线路和站点的设计。为加快推进市重大工程建设，闵一公司为千代广场协商搬迁补偿工作具体实施方，具体详见《轨道交通23号线金平路站点及东川路2151号国有土地非居住房屋协商搬迁补偿方案》。根据工程建设需要，东川路2266弄在轨道交通23号线金平路站点的搬迁范围内，站点搬迁方式为协商搬迁。经了解，汉庭宾馆外贴封条是汉庭宾馆为防止外人私自进入，因而自行张贴封条。封条现已消除。感谢您对江川路街道工作的关心、理解和支持。特此告知。
