title,agency,date,links,标题,来信日期,信件内容,回复日期,回复单位,回复内容
建议全面禁止共享单车,上海市道路运输管理局,2023-09-12,https://xfb.sh.gov.cn/xinfang/yjzj/feedback/feedbackshow?id=6B8AAF9683B343C095A29C23870F171C,建议全面禁止共享单车,2023-08-07,本人反映，共享单车发展弊大于利，应当全面禁止。本人认为，共享单车从发展至今可以看出对城市造成了巨大的负担，而该等负担对于解决市民最后一公里出行的帮助甚微。（1）看似解决出行一公里，实则受众群体有限。单车在日常生活中具有很大的潮汐效应。工作日早高峰，需要换乘公告交通的市民出小区后用单车的方式前往地铁站或车站，而在下班后，在地铁站或车站再换单车回到小区。而早高峰时期，单车基本为单项流动，在到达目的地后很少部分才会继续流动。因此单车的使用效率有限，覆盖人群有限。而在周末时间段，单车通常也会大批聚集在各大商场附近，流动力有限。（2）看似解决部分居民出行一公里，实则是转嫁了矛盾给其他方面。基于上述流动性问题，比较明显的会造成两个问题：①为了解决流动性，需要更多的人力、车力来人工调解单车，使增加使用效率，在本身拥挤的早高峰时间段造成更多的道路占用。②基于流动困难，造成了大量的单车成堆聚集在部分区域、道路，影响了本就拥挤的道路，是牺牲了部分道路面积代价，实惠了少数使用人群。③严重影响区域管理，人行道路本就不宽敞，在单车停放后，许多道路只能允许单人同行，甚至单人也无法顺利通行。（3）危险系数较高。一般而言，共享单车由于是非单车自有人使用，因此在使用过程中破损较多。容易造成单车本身比如刹车、龙头损坏，不仅对使用人具有潜在的危险，使用潜在危险单车也会对道路其他使用人造成危害。（4）占用巨大社会资源由于单车发行量巨大，使得原本不宽阔的道路占据了大量的位置。即使道路上有专人摆放，但在单车停放后，许多道路只能允许单人同行，甚至单人也无法顺利通行，并且，对其他自有单车使用人而言，失去了原本可以在部分区域停车的机会。（5）资源浪费  基于前述损坏率高的原因，因此企业出于降低运营费率的考量，单车本身质量就不会很高，因此更容易损坏，造成更多的生产资源浪费。另外，由于需要调解潮汐，浪费了人力车力，造成更多的道路占用、资源消耗，反而与节能减排相行见远。本人要求，全面禁止共享单车。,2023-09-12,上海市道路运输管理局,"程同志：  您好！您关于共享单车的来信已收悉，经研究，现将处理意见答复如下：  关于您反映共享单车具有很大的潮汐效应，影响了行人通行的问题，经了解，目前本市部分商办集中区域、轨交站点早晚高峰时段确实容易出现潮汐现象，运营企业力量不足，未及时清收调运，导致车辆淤积、乱停乱放，增加行人通行困难。  针对这一问题，交通、城管和属地政府积极引导和督促运营企业发挥市场配置作用，落实企业主体责任，根据《上海市非机动车安全管理条例》有关规定，要求运营企业加强车辆日常调度，及时平衡区域潮汐车辆供给，建立专门管理队伍或者委托第三方清理乱停乱放车辆；对于挤占人行道、车行道、绿化带等道路、区域停放的共享单车，由城管执法部门通知运营企业在二小时内予以清理，未予清理的依法予以处罚；各区交通部门也督促运营企业签订区域投放运营协议，共同遴选委托第三方回收清理企业，对车辆淤积的地方开展清理。  关于您反映共享单车在使用过程中破损较多，对使用人具有潜在的危险的问题，交通管理部门一直督促各运营企业加强对共享单车的维护、及时回收坏车,确保车辆性能状况良好，各运营企业在运营APP中均设有用户报修故障车辆的功能，并建立了路面车辆故障巡查机制，降低故障发生率。  关于您希望全面禁止共享单车的建议，目前国家和本市的法律法规和政策尚无这方面的禁止性规定，本市关于共享单车发展思路主要是汇聚政府、社会、企业、用户等多方力量，规范引导、有序发展。  感谢您对本市道路运输行业的关心和支持。                                      上海市道路运输管理局                                              2023年8月23日"
关于使用退役军人优待证免费乘坐城市公共交通工具的建议,上海市退役军人事务局,2023-09-12,https://xfb.sh.gov.cn/xinfang/yjzj/feedback/feedbackshow?id=A3803D94F1C94EA0891B1E292E03DADD,关于使用退役军人优待证免费乘坐城市公共交通工具的建议,2023-08-15,贵局领导： 您好。根据本市现行退役军人优待目录清单，退役军人无免费乘坐市内公共汽车、电车和轨道交通工具的优待。 山东省退役军人基本优待目录清单明确规定“在本省行政区域内，推行退役军人凭有效证件免费乘坐城市公共交通。” 滁州市交通运输局印发的《滁州市市直两区现役军人、军属、退役军人在城区免费乘坐公交车工作实施方案》中有相似规定。 上海作为一个国际化大都市，应起到良好的带头作用，乘坐公共交通工具作为最常见的生活场景，在乘坐公共交通工具时出示退役军人优待证并获得免费优待，可以实实在在地提升广大退役军人群体的社会认同感和幸福感，同时对于弘扬“让军人成为全社会尊崇的职业”有极大的促进作用，对国防建设产生深远的积极影响。,2023-09-12,上海市退役军人事务局,告知书***同志：您好！您来信建议退役军人持优待证免费乘坐市内公共汽车、电车和轨道交通工具的事项收悉。我们将会同有关部门不断提高优待力度，拓展优待项目。感谢您对我们工作的关心、理解和支持。特此告知。上海市退役军人事务局2023年8月16日
退役军人优待证,上海市退役军人事务局,2023-09-12,https://xfb.sh.gov.cn/xinfang/yjzj/feedback/feedbackshow?id=4EBB6C4A4EB1461D821992F9C82E986D,退役军人优待证,2023-08-11,请最好尽快在公共交通可以让全国退役军人优待证使用,2023-09-12,上海市退役军人事务局,告知书***同志：您好！您来信建议尽快让全国退役军人优待证可以在共公交通领域使用的事项收悉。我们将会同有关部门不断提高优待力度。感谢您对我们工作的关心、理解和支持。特此告知。上海市退役军人事务局2023年8月17日
龙吴路小区加装电梯周末施工噪音扰民,上海市徐汇区人民政府漕河泾街道办事处,2023-09-11,https://xfb.sh.gov.cn/xinfang/yjzj/feedback/feedbackshow?id=4C696DF1BFAE4E5680425278AA4752C4,龙吴路小区加装电梯周末施工噪音扰民,2023-08-02,本人反映，龙吴路*弄小区加装电梯的工程，每天早上大约七点就开始施工，且一周七天都是如此，严重的打扰了附近居民的日常生活，使居民无法正常休息。且加装电梯的施工进展异常缓慢。希望调整，减少扰民情况。,2023-09-11,上海市徐汇区人民政府漕河泾街道办事处,来**同志：您反映的信访事项本机关已受理。经研究，现答复如下：您反映龙吴路13弄小区加装电梯周末施工，工作日早上过早施工，噪音扰民，要求整改。街道有关部门已与现场现代加梯公司联系。经该加梯公司反馈：现代加梯公司将在施工过程中兼顾居民的感受，尽量减少对周边居民的影响。另，现代加梯公司对工程施工带来的不便表示歉意。感谢您对漕河泾街道工作的关心、理解和支持。上海市徐汇区人民政府漕河泾街道办事处2023年9月8日
建议罗秀路长华路段架空线入地,上海市徐汇区建设和管理委员会,2023-09-11,https://xfb.sh.gov.cn/xinfang/yjzj/feedback/feedbackshow?id=2137C837C941490383788A2DCFDDF3A6,建议罗秀路长华路段架空线入地,2023-08-18,反映罗秀路长华路交界门两侧周边随外可见电线杆和高压线塔，建议进行架空线入地工程。,2023-09-11,上海市徐汇区建设和管理委员会,王**同志：您反映的信访事项本机关已受理。经研究，现答复如下：您反映罗秀路长华路交界门两侧周边随外可见电线杆和高压线塔，建议进行架空线入地工程。经现场踏勘，并向工程项目部沟通了解，为进一步提升城市精细化管理水平、加强风貌区保护、改善市容市貌环境，按照市委、市政府统一部署和要求，我委将对我区道路架空线开展整治。目前罗秀路周边建筑工地较多，暂不满足架空线入地作业施工条件，后续我委将根据道路实际情况，安排架空线入地及合杆整治计划，感谢您的意见建议。上海市徐汇区建设和管理委员会2023年9月1日
转学问题,上海市徐汇区教育局,2023-09-11,https://xfb.sh.gov.cn/xinfang/yjzj/feedback/feedbackshow?id=14E7C7544D4344D1A45F8C7400DCA92D,转学问题,2023-08-03,本人反映，我孩子要从嘉定区转学至徐汇区，现被统筹至某小学就读。本人认为，该校距离我的居住地较远。本人要求，有关部门将我的孩子安排至户籍对口小学就读。,2023-09-11,上海市徐汇区教育局,杜先生：您反映的信访事项已受理。经研究，现答复如下：您反映您孩子要从嘉定区转学至我区，现被统筹至某小学就读。您认为该校距离您的居住地较远，要求有关部门将您的孩子安排至户籍对口小学就读。经查，根据《徐汇区义务教育阶段2023学年第一学期转学登记须知》，转学由徐汇区教育局统一办理、统筹安排。因您孩子的户籍对口学校学额已满，现被统筹至某小学就读。我局工作人员已与您解释说明。如您还需了解更多招生信息，也可向我局招生考试中心详询，联系电话：54361242。感谢您对徐汇教育工作的关心、理解和支持。上海市徐汇区教育局2023年9月4日
小区道路施工噪音扰民,上海市徐汇区建设和管理委员会,2023-09-11,https://xfb.sh.gov.cn/xinfang/yjzj/feedback/feedbackshow?id=3FCF1998BBCC41858386D5902CE5E475,小区道路施工噪音扰民,2023-08-12,反映龙华西路存在道路施工噪音扰民,2023-09-11,上海市徐汇区建设和管理委员会,李**同志：您反映的信访事项本机关已受理。经研究，现答复如下：您反映龙华西路存在道路施工噪音扰民情况。经核实，此处在徐汇区小市政道路整治工程范围，因部分小市政道路路面老旧，为提升市民的出行体验，同时地下管道等附属设施亦需翻新，市政中心应街道要求对此段小市政道路进行整治。市民反映时正在进行原地面及侧石翻新的工作，因此工作需破碎地面，故有凿地等声响，因高温天气较早开始作业，已沟通施工方早上有声音的施工会尽量延后至8点开始。感谢您对我委工作的关心、理解和支持。上海市徐汇区建设和管理委员会2023年8月22日
小区物业停车乱收费,上海市徐汇区华泾镇人民政府,2023-09-11,https://xfb.sh.gov.cn/xinfang/yjzj/feedback/feedbackshow?id=02B929C87698428590C78BCAF1378667,小区物业停车乱收费,2023-08-23,本人反映，徐汇区名人花苑小区的物业胡乱收费，事实情况为：本人车辆在5-7月未在小区内停车，但被物业要求必须连续缴纳包月停车费用，需要缴纳5月起至今的所有停车费！本人认为，未实际发生的停车，就不产生停车费。未消费就不应该收取费用的原则。本人要求，从8月实际停放车辆在小区内开始收取物业停车费，5-7月未停放期间不应该补交费用，需要对上海复欣物业管理发展有限公司勒令整改！,2023-09-11,上海市徐汇区华泾镇人民政府,信访事项处理意见书相**同志：您反映的信访事项已受理。经研究，现答复如下：经了解，经华泾城建中心与名人花苑小区业委会协调，目前已由您出具一张驶离情况说明至小区复欣物业管理处，办理从8月份开始车辆包月手续。如不服本意见，您可自收到本处理意见之日起30日内向徐汇区人民政府书面提出复查申请。如逾期不提出复查申请，本意见即为最终意见。上海市徐汇区华泾镇人民政府2023年9月6日
关于徐汇区凌云街道凌云路上中西路路口南侧施工的意见,上海市徐汇区人民政府凌云路街道办事处,2023-09-11,https://xfb.sh.gov.cn/xinfang/yjzj/feedback/feedbackshow?id=20334A5D41A244AB9FB6C2A654D3EB2F,关于徐汇区凌云街道凌云路上中西路路口南侧施工的意见,2023-08-27,反映凌云路上中西路路口南侧施工扰民等问题。,2023-09-11,上海市徐汇区人民政府凌云路街道办事处,答复意见书陈**同志：您反映的信访事项本机关已受理。经研究，现答复如下：您反映凌云路上中西路路口南侧施工扰民等问题。经查，该项目系凌云路（上中西路至罗秀路）段道路改造项目，街道前期已督促施工单位整改，目前，该项目已完工，感谢您的理解与支持。感谢您对凌云街道工作的关心、理解和支持。上海市徐汇区人民政府凌云路街道办事处2023年9月7日
反映徐汇区天钥桥路夜晚施工噪音扰民,上海市徐汇区建设和管理委员会,2023-09-11,https://xfb.sh.gov.cn/xinfang/yjzj/feedback/feedbackshow?id=C18455B778F34B8B948F7FEF9CED556A,反映徐汇区天钥桥路夜晚施工噪音扰民,2023-08-16,徐汇区天钥桥路夜间施工噪音扰民。,2023-09-11,上海市徐汇区建设和管理委员会,胡**同志：您反映的信访事项本机关已受理。经研究，现答复如下：您反映徐汇区天钥桥路夜间施工噪音扰民。经现场踏勘，并向工程项目部沟通了解。为进一步提升城市精细化管理水平、加强风貌区保护、改善市容市貌环境，按照市委、市政府统一部署和要求，徐汇区制定了《架空线入地及合杆整治三年行动计划（2021-2023）》，对我区道路架空线开展整治。天钥桥路为徐汇区实施的道路之一。徐汇区天钥桥路架空线入地合杆整治工程于2023年开始施工，范围从肇嘉浜路至零陵路，具体实施单位为合杆勤电公司、信息管线公司以及市政修复等。本工程施工证照齐全，且考虑周边交通压力，部分施工经过审批只允许在夜间进行作业，市交警批复施工时间为2023年07月-2023年09月，且开工前我方已与周边街道及居委进行过沟通协商，并于施工路段张贴安民公示。感谢您对我们工作的关心、理解和支持。上海市徐汇区建设和管理委员会2023年9月1日
母亲办理低保事宜,上海市徐汇区人民政府长桥街道办事处,2023-09-11,https://xfb.sh.gov.cn/xinfang/yjzj/feedback/feedbackshow?id=1B21F15900074341851C041F6A3A7055,母亲办理低保事宜,2023-08-24,反映母亲张**低保复核，需要提供其本人的收入流水明细以及配偶的收入流水等材料，但其与配偶关系不合，无法提供其收入证明，希望得到解决。,2023-09-11,上海市徐汇区人民政府长桥街道办事处,信访事项答复意见书房**同志：您反映的信访事项本机关已受理。经研究，现答复如下：经了解：1、根据《民法典》1067条的相关规定，成年子女不履行赡养义务的，缺乏劳动能力或者生活困难的父母，有要求成年子女给付赡养费的权利。低保人员属于生活困难的对象，有权利要求成年子女给付赡养费。2、对于您提出的您与妻子关系不合，其不愿意提供流水明细的情况，根据《关于实施中若干问题的意见》中的相关规定：赡养费的计算。赡养人（夫妻双方）的收入，先按照本市最低工资标准扣除赡养费（夫妻双方）的生活费，再按照本市最低生活保障标准扣除抚养费后，一般将余下的20%作为赡养费。赡养费按照实际赡养人数均摊后即为付给每个被赡养人的赡养费。3、已告知您以上政策和赡养费的实际计算方式，并告知了您母亲可以购买居保，到60周岁以后可以享受居保待遇，居保领待不需要计算子女赡养费，您表示明白。感谢您对长桥社区工作的关心、理解和支持。上海市徐汇区人民政府长桥街道办事处2023年9月4日
关于徐汇环卫避免上下学高峰时段在校边清理垃圾的申请,上海市徐汇区绿化和市容管理局,2023-09-11,https://xfb.sh.gov.cn/xinfang/yjzj/feedback/feedbackshow?id=29F132060A9D4CA4A86D2E7016A473CA,关于徐汇环卫避免上下学高峰时段在校边清理垃圾的申请,2023-09-05,本人反映：开学仅二天，已二次碰到上下学时段，环卫车在学校门口收集垃圾本人认为：半敞开式的垃圾车灰尘飞扬，走过的孩子容易吸入有害颗粒，容易传染病毒本人要求：避开上下学时段，尽量在人少的时候，比如清晨6点，或者学生入校后，或者下午放学前（一般下午二点半前）,2023-09-11,上海市徐汇区绿化和市容管理局,易**同志：您好！您于2023年9月5日信访反映的事项收悉。经与作业单位了解沟通，为避免对学校周边道路产生拥堵，我们现做了如下调整:早上周边小区、学校、单位的生活垃圾收运作业时间调整至6点、9点两个时间段；下午商铺上门收集工作提前至13：00左右。上海市徐汇区绿化和市容管理局2023年9月7日
天钥桥南路道路贯通事宜,上海市徐汇区建设和管理委员会,2023-09-11,https://xfb.sh.gov.cn/xinfang/yjzj/feedback/feedbackshow?id=5B1957CACFC940D89B8B5F20C07DDDFC,天钥桥南路道路贯通事宜,2023-08-09,天钥桥南路（龙华西路-龙恒路）道路贯通工程影响小区整体环境，要求停止不合理规划。,2023-09-11,上海市徐汇区建设和管理委员会,"程**同志：您反映的信访事项本机关已受理。经研究，现答复如下：您反映天钥桥南路（龙华西路-龙恒路）道路贯通工程影响小区整体环境，损害居民权益，要求停止不合理规划。本机关认为，天钥桥路、天钥桥南路是徐汇重要的南北向道路，联系徐家汇至徐汇滨江。现状天钥桥路自徐家汇至龙华西路，天钥桥南路自龙兰路至龙腾大道，该通道自龙华西路至龙兰路段由于居民小区和河道阻隔未贯通，导致龙华地区居民出行不便。随着徐汇滨江的不断建设，贯通天钥桥路-天钥桥南路对于群众出行和地区发展具有至关重要的意义，目前龙恒路至龙兰路段即将开工建设，本工程天钥桥南路（龙华西路-龙恒路）是贯通整条南北向道路的最后一处断点。本工程按照规划道路红线实施，目前已取得立项批复。道路红线范围涉及龙华西路部分地区，纳入征收范围;其他不在道路红线范围内的房屋，未纳入征收范围。本工程将委托专业环评单位进行评估,项目方案在实施前也会进行方案公示。目前本工程尚未开工,居民反映的现状房屋开裂及外墙问题并不是由本工程实施导致,后续在道路施工过程中也会对周边房屋进行检测及监测。同时，我区正在推进小区综合环境提升方案研究，将对该区域的小区整体环境、交通组织等进行提升优化，在便利居民出行的同时最大程度减少道路辟通对区域居民生活的影响。感谢您对我委工作的关心、理解和支持。上海市徐汇区建设和管理委员会2023年8月15日"
楼上抛物,上海市嘉定区菊园新区管理委员会,2023-09-11,https://xfb.sh.gov.cn/xinfang/yjzj/feedback/feedbackshow?id=F0C4A120ACE447F1AC4AEDD21A4FDFBC,楼上抛物,2023-08-14,本人反映小区内有高层住户高空抛物，丢烟头垃圾到底楼，请及时处理。,2023-09-11,上海市嘉定区菊园新区管理委员会,徐同志：您反映的信访事项已受理，现答复如下：经嘉呈社区居委会核处，已安排物业保洁人员对小区的底楼周边及绿化带进行清理，目前已清理全部垃圾。同时对于高空抛物的情况，因未安装摄像头未发现涉事住户，已在宣传栏和楼道张贴温馨提示，做好宣传引导，加大普法宣传力度，避免高空抛物的情况发生。感谢您对我们工作的理解和支持。嘉定区菊园新区管理委员会2023年8月15日
早锻炼声音大,上海市嘉定区菊园新区管理委员会,2023-09-11,https://xfb.sh.gov.cn/xinfang/yjzj/feedback/feedbackshow?id=5D16E73AE25A4ED79D5FE63993945B13,早锻炼声音大,2023-08-14,本人反映，一大早阿姨们在50号前的小广场上早锻炼，音乐声、说话声太大了，影响晚班回家的居民休息。希望帮忙解决。,2023-09-11,上海市嘉定区菊园新区管理委员会,您反映的信访事项已受理，现答复如下：经嘉呈社区居委会核处，安排社工至现场协调，告知早锻炼的阿姨们在锻炼时注意控制音量，避免影响其他居民的休息，阿姨们表示知晓并注意。同时，居委也经常组织志愿者至现场提醒阿姨们降低音量，防止扰民。感谢您对我们工作的理解和支持。嘉定区菊园新区管理委员会2023年8月15日
投诉车子停消防通道,上海市嘉定区菊园新区管理委员会,2023-09-11,https://xfb.sh.gov.cn/xinfang/yjzj/feedback/feedbackshow?id=66ABE27A46114FBE85D0809CA851F9F3,投诉车子停消防通道,2023-08-16,本人反映，小区内有车子停在消防通道，不仅影响到车辆的进出，还存在消防隐患，多次向物业反映，无果，请处理。,2023-09-11,上海市嘉定区菊园新区管理委员会,庄同志：您反映的信访事项已受理，现答复如下：经嘉铭居委会核处，与消防通道乱停车的车主进行沟通，车主表示知晓并表示今后会按序停放在车位。小区内也将加强消防安全的宣传，提高安全意识，物业加强巡查，及时制止，减少车辆占用消防通道的情况发生。感谢您对我们工作的理解和支持。嘉定区菊园新区管理委员会2023年8月18日
门口有僵尸自行车,上海市嘉定区菊园新区管理委员会,2023-09-11,https://xfb.sh.gov.cn/xinfang/yjzj/feedback/feedbackshow?id=A6DF89E9B8BF48C0AF5D834E342CE5A9,门口有僵尸自行车,2023-08-14,本人反映，本人居住的5号楼门口有好多僵尸自行车，一直没人处理，导致居民来往诸多不便，望能尽快解决。,2023-09-11,上海市嘉定区菊园新区管理委员会,倪同志：您反映的信访事项已受理，现答复如下：经嘉汇社区居委会核处，居委工作人员与物业上门查看，确有长期无人使用的自行车停放在此。居委在楼道粘贴告知，请居民认领清理，对于无人认领的自行车，由物业统一清运存放。目前5号楼前无人认领车辆已清理完毕。感谢您对我们工作的理解和支持。嘉定区菊园新区管理委员会2023年8月15日
空调机漏水,上海市嘉定区菊园新区管理委员会,2023-09-11,https://xfb.sh.gov.cn/xinfang/yjzj/feedback/feedbackshow?id=E8809053D34846FCAE150E1474669479,空调机漏水,2023-08-21,本人反映，楼上有空调机漏水，已经几个礼拜了，和楼上住户沟通过一直没有修，希望帮助协调解决。,2023-09-11,上海市嘉定区菊园新区管理委员会,张同志：您反映的信访事项已受理。经研究，现答复如下：经嘉邦居委会核处，工作人员已与居民沟通协调，并帮助找维修师傅进行了修复。感谢您对我们工作的理解和支持。嘉定区菊园新区管理委员会2023年8月22日
在招商银行四川北路支行门口的僵尸共享单车,上海市虹口区人民政府四川北路街道办事处,2023-09-11,https://xfb.sh.gov.cn/xinfang/yjzj/feedback/feedbackshow?id=77E89752E9D94BE79320CF2897CD6ABD,在招商银行四川北路支行门口的僵尸共享单车,2023-08-14,"本人反映,在四川北路1689号招商银行四川北路支行门口的非机动车停车位上长期被一辆黄色的僵尸共享单车占据希望四川北路街道能够派人立刻处理掉。",2023-09-11,上海市虹口区人民政府四川北路街道办事处,陈同志：接到您反映的情况后，我街道工作人员已将上述地址的僵尸车辆处理到位，并要求市容巡查员加强管理共享单车停放秩序维护的同时，定期上报老旧单车并及时清运，已电话联系您，您表示理解。感谢您对社区工作的关心、理解和支持。四川北路街道办事处2023年8月15日
