title,agency,date,links,标题,来信日期,信件内容,回复日期,回复单位,回复内容
反映小区公共通道规划建设问题,上海市宝山区大场镇人民政府,2023-10-11,https://xfb.sh.gov.cn/xinfang/yjzj/feedback/feedbackshow?id=92A5F1C5880E4361A75C4BA71D8DABC0,反映小区公共通道规划建设问题,2023-09-07,反映宝山区大场镇大华悦庭项目即将交房，但通往小区的道路被周边小区的居民私设停车杆停满车辆难以通行，且现行路况糟糕，下雨天积水严重，。认为该项目在销售时，房屋预售合同上明示小区西侧道路为场文路（规划路），也是进出该小区的唯一通道，目前的情况远未达到通路的标准，且当下正在被他人占用为停车场。原国土资源部《闲置土地处置办法》21条明文规定要求“净地”出让，即实现通水通电通路土地平整，土地方可出让。要求大场镇政府立即更正违法行为，尽快落实该地块的通路条件。,2023-10-11,上海市宝山区大场镇人民政府,王同志：您好！       您于2023年9月7日反映大华悦庭小区公共通道规划建设问题的来信已收悉。经研究，现答复如下：       经了解，我镇与房产开发公司将根据小区周边现状，尽快出具小区周边通道的整治修缮设计方案并组织施工，最大程度的满足业主通行需求。同时兼顾好小区与周边小区居民美好生活的愿望，完善共建共治共享机制，加强管理以求得和谐美好生活的最大公约数。       特此回复。                                                            上海市宝山区大场镇人民政府                                                                       2023年9月14日
反映小区公共通道规划建设问题,上海市宝山区大场镇人民政府,2023-10-11,https://xfb.sh.gov.cn/xinfang/yjzj/feedback/feedbackshow?id=C9843F12E4A7484D85852A1283CE1EC6,反映小区公共通道规划建设问题,2023-09-07,反映宝山区大场镇南大路38弄9支弄（规划场文路）公共道路被占，私画停车位，乱停车，设立收费杆问题。认为场文路既然是大华悦庭城中村改造项目的市政配套项目，作为大华悦庭车辆进出口的唯一道路，理应在交房前和主体工程一起完工，真正实现城中村改造而不是只改造红线内。要求场文路路口撤销收费杆，终止停车场用途，发挥市政道路作用，真正改善民生。,2023-10-11,上海市宝山区大场镇人民政府,漆同志：您好！       您于2023年9月7日反映大华悦庭小区公共通道规划建设问题的来信已收悉。经研究，现答复如下：       经了解，我镇与房产开发公司将根据小区周边现状，尽快出具小区周边通道的整治修缮设计方案并组织施工，最大程度的满足业主通行需求。同时兼顾好小区与周边小区居民美好生活的愿望，完善共建共治共享机制，加强管理以求得和谐美好生活的最大公约数。       特此回复。                                                      上海市宝山区大场镇人民政府                                                                 2023年9月14日
关于学校问题,上海市浦东新区教育局,2023-10-11,https://xfb.sh.gov.cn/xinfang/yjzj/feedback/feedbackshow?id=03061D0EECF8416EB002B2568F9E451B,关于学校问题,2023-09-06,本人反映：小区对口初中学区办学质量让居民感到担忧，希望教育主管部门、教育集团能与居民面对面沟通交流，就学校共同发展、加大集团优质教学资源投入、为孩子提供家门口优质的教育资源共同努力。,2023-10-11,上海市浦东新区教育局,徐同志：您反映的信访事项本机关已受理。现答复如下：您来信建议学校办学的问题。浦东新区积极推进学区化集团化办学、新优质学校集群发展、初中强校工程、城乡学校互助成长等举措，努力办好每一所家门口的学校，促进区域义务教育优质均衡发展。新区教育局高度重视该中学的发展，已将该中学加入教育集团，通过促进该中学与集团内优质资源紧密共享，推动学校实现更高水平的发展。学校将进一步健全家长、社区参与办学的有效机制，合理吸纳各方的建议和诉求，有效改进学校办学。您的建议将留作参考，感谢您对浦东教育工作的关心、理解和支持。此复。上海市浦东新区教育局2023年9月21日
学校门口秩序混乱,上海市普陀区教育局,2023-10-11,https://xfb.sh.gov.cn/xinfang/yjzj/feedback/feedbackshow?id=3EF6D0A8F2B3453DBC40FA95374E68AF,学校门口秩序混乱,2023-09-12,本人反映，某中学早晨门口秩序混乱，车辆随意停放；本人认为，要重视并合理安排；本人要求，尽快妥善处理。,2023-10-11,上海市普陀区教育局,苏同志：您好！您反映的信访事项已受理。经研究，现答复如下：经了解，学校正门靠近交通主干道。为保障上下学时段校门口的秩序与安全，学校目前每天安排2名保安、1名教师、1名特保人员负责管理。普陀区教育局将继续督促指导学校做好上下学期间的秩序管理，为师生、家长提供一个安全、有序的校园周边环境。上海市普陀区教育局2023年9月12日
咨询关于2024年中考，报考学生资格审查问题,上海市普陀区教育局,2023-10-11,https://xfb.sh.gov.cn/xinfang/yjzj/feedback/feedbackshow?id=0055E3AF500E4CC09840C835BDC62F61,咨询关于2024年中考，报考学生资格审查问题,2023-09-06,您好：    我想了解一下，明年中考学生报名时，学生报考资格审查以及关于学生参与到校名额分配资格的审查问题是如何规定的？报名时间大概在什么时候，审查结果是否公示，如公示，是教委还是学校为主体负责公示，以何种方式进行，公示多久，期间如发现问题，如何反馈。麻烦帮忙解答。谢谢！,2023-10-11,上海市普陀区教育局,黄同志：您好！您于2023年9月6日信访反映的事项收悉。经了解，现答复如下：1.中招报名时间由上海市教育考试院公布，您可在上海招考热线查询高中阶段学校招生报名工作的通知（一般在考试前一年年底12月发布）。2.报考资格在通知中同步公布，在校学生由学校统一组织网上报名和信息确认。3.名额分配资格由考生学籍所在学校根据考试招生工作规定进行认定，公示时间5个工作日。4.如发现问题可向学校招生热线或普陀区教育考试中心中招专线反馈。感谢您对普陀教育工作的关心、理解和支持。特此告知。上海市普陀区教育局2023年9月18日
一封感谢信,上海市普陀区教育局,2023-10-11,https://xfb.sh.gov.cn/xinfang/yjzj/feedback/feedbackshow?id=860F5F7513334A4CB4BA170028350C1B,一封感谢信,2023-09-26,周书记您好，我是普陀区某幼儿园某班杨某某小朋友的家长。给您来信是因为带班杨老师和朱老师对孩子倾注了心血，孩子也有了巨大的成长变化和明显的进步。2022年9月份，孩子入园时，正好两岁半，虽然已经两岁多了，但是我家孩子与其他同龄孩子在某些方面上有一定的差距。注意力不集中，自理能力差。这些问题一直困扰着我们，平日里也一直在想尽一切办法解决，但是效果并不是很明显。我曾经把孩子的问题跟班主任杨老师交涉过，老师很有耐心地了解我们的情况。除了班主任杨老师，这个集体中的朱老师也对孩子们都非常有爱心，有亲和力，我家孩子特别喜欢这几位老师。随着入园的时间越来越久，我们感受到了孩子的点滴变化。每天放学回到家，都给我们讲很多班里的学习生活，说出很多小朋友的名字，讲一讲同学之间发生的事，跟我们说一说每个老师等。孩子的语言表达能力和思维能力有了显著的提升。不仅如此，在生活自理方面，洗手、大小便、穿衣服等，也有了很大的进步，我们家长感到甚是欣慰。感谢每一位老师的辛苦付出，也谢谢周书记百忙中抽出时间听一下一个孩子家长的唠叨。,2023-10-11,上海市普陀区教育局,简复告知书杨同志：您好！您于2023年9月26日信访反映的事项收悉。感谢您的来信，也谢谢您对普陀区教育工作者的肯定，我们广大教师深受鼓舞，将继续努力，力求做得更好，为普陀教育事业建设更美好的明天。感谢您对普陀教育工作的理解和支持。上海市普陀区教育局2023年9月28日
小区车位问题,上海市普陀区长征镇人民政府,2023-10-11,https://xfb.sh.gov.cn/xinfang/yjzj/feedback/feedbackshow?id=18E58AF9F9DF4B27A5D0BAC91C17E228,小区车位问题,2023-08-31,本人反映，小区有208户，地上画线的停车位不到100个，在停车位紧缺的情况下，小区业主委员会和物业开始单方面进行部分业主固定车位的举措，且固定车位名单不公开不公示，其他有车的业主无法申请，在无法保证停车位的情况下，还需支付比固定车位业主贵两倍的停车费，认为不公平，要求小区重新制定机动车停车规则。,2023-10-11,上海市普陀区长征镇人民政府,告知书沈同志：您好！您反映的信访事项已收悉，经研究，现答复如下：经核实，该小区停车管理条例于2022年12月由小区业委会决议通过。因小区车位有限，针对新进业主、外来租房户（租房一年以上）及业主新购置的车辆，按登记先后顺序安排停车位，对所有业主一视同仁。目前小区业委会正在重新改选，您可待小区新业委会成立后，向新业委会提议召开业主大会，并就停车管理的有关事项提出建议。感谢您对我们工作的理解与支持。上海市普陀区长征镇人民政府2023年9月21日
楼道内照明灯损坏,上海市普陀区人民政府甘泉路街道办事处,2023-10-11,https://xfb.sh.gov.cn/xinfang/yjzj/feedback/feedbackshow?id=404B2698712C47BBB8072B8639B04690,楼道内照明灯损坏,2023-10-09,本人反映，西乡路某弄某号楼栋内的感应照明灯有好几个都损坏了，导致夜间上下楼看不清，有一定隐患。本人要求，街道相关部门尽快协调解决。,2023-10-11,上海市普陀区人民政府甘泉路街道办事处,信访事项处理意见书杨同志：您好！您反映的信访事项已受理。经研究，现答复如下：甘泉路街道社区管理办了解到您反映的情况后，立即与该小区物业进行了沟通，物业表示会立即联系相关工作人员对损坏的感应灯进行更换，目前已更换完毕。感谢您对我们工作的理解与支持。上海市普陀区人民政府甘泉路街道办事处2023年10月10日
适龄儿童上学问题,上海市闵行区教育局,2023-10-11,https://xfb.sh.gov.cn/xinfang/yjzj/feedback/feedbackshow?id=E7C3D8470AD1433083B0B189B65D2443,适龄儿童上学问题,2023-09-15,本人反映，小区按户均2人推算，小区将有100名适龄幼儿、儿童需要教育资源配套。加上已交付的小区，未来2年将陆续有3个小区、超过400位学龄幼儿、儿童产生强烈的入学需求。按照本区统筹区域分组情况以及就近入学原则，九星文来和碧林湾文来属于一校两区，九星文来未建立之前，针对我们小区优先统筹碧林湾校区属于合理安排。针对现在入学的整体需求，我们提出如下诉求:诉求1:更新适龄幼儿学前教育配套规划，保障2024年入园需求。2:加快落实地块教育规划，按原有官方公布信息建设9年制九星校区，并于2025年前建设完成；3:针对2024年拿到预售合同的业主，安排优先统筹碧林湾文来校区。,2023-10-11,上海市闵行区教育局,时同志：您好！您关于小区配套学校建设和入学安排问题的来信收悉。现告知如下：九年制学校目前正在进行地块规划调整工作，由七宝镇实施。我局同步推进前期方案研究工作。待规划调整工作完成后，我局将启动项目前期手续办理工作，尽快推进项目开工。关于入学问题的相关诉求，已告知我局相关部门，供其在后续工作中参考。感谢您对闵行教育工作的理解和支持。特此告知。
教育问题,上海市闵行区教育局,2023-10-11,https://xfb.sh.gov.cn/xinfang/yjzj/feedback/feedbackshow?id=B184D46443E34C78AFAEE8963BFECDF9,教育问题,2023-09-14,本人反映，小区按户均2人推算，小区将有100名适龄幼儿、儿童需要教育资源配套。加上已交付的小区，未来2年将陆续有3个小区、超过400位学龄幼儿、儿童产生强烈的入学需求。按照本区统筹区域分组情况以及就近入学原则，九星文来和碧林湾文来属于一校两区，九星文来未建立之前，针对我们小区优先统筹碧林湾校区属于合理安排。针对现在入学的整体需求，我们提出如下诉求:诉求1:更新适龄幼儿学前教育配套规划，保障2024年入园需求。2:加快落实地块教育规划，按原有官方公布信息建设9年制九星校区，并于2025年前建设完成；3:针对2024年拿到预售合同的业主，安排优先统筹碧林湾文来校区。,2023-10-11,上海市闵行区教育局,阳同志：您好！您关于小区配套学校建设和入学安排问题的来信收悉。现告知如下：九年制学校目前正在进行地块规划调整工作，由七宝镇实施。我局同步推进前期方案研究工作。待规划调整工作完成后，我局将启动项目前期手续办理工作，尽快推进项目开工。关于入学问题的相关诉求，已告知我局相关部门，供其在后续工作中参考。感谢您对闵行教育工作的理解和支持。特此告知。
消防设施,上海市闵行区住房保障和房屋管理局,2023-10-11,https://xfb.sh.gov.cn/xinfang/yjzj/feedback/feedbackshow?id=7EC615BFF8B64ACF9E1EEAC2E561E80F,消防设施,2023-09-19,"本人反映,小区消防设施不合格，封闭玻璃长期玻璃尺寸不符合，框架不严实很多就是一块活动的玻璃，导致小孩手腕筋腱受伤。且小区多个楼栋消防均存在很大问题。本人认为,小区物业不作为，使得很多消防设施存在重大安全隐患，且不是救人的工具，反而变成伤害业主的道具。本人要求,相关单位，对小区的消防设施进行排查，对相关责任单位严惩。",2023-10-11,上海市闵行区住房保障和房屋管理局,毛同志：您网信反映要求对小区消防设施进行排查的事项已收悉，现告知如下：经查，小区现在管物业为上海杰帅物业管理有限公司。经颛桥镇房管所了解反馈，关于您的孩子受伤事项，物业公司愿意帮助您申请公共责任险理赔，并给予一定的补偿，近期将由小区居委组织双方调解，若调解不成，建议您通过司法途径维护自己的权益。关于消防设施安全隐患问题，已督促小区物业针对类似问题开展全面梳理排摸，并汇总报送至业委会，如有隐患的组织维修。特此告知。
交通安全隐患,上海市闵行区七宝镇人民政府,2023-10-11,https://xfb.sh.gov.cn/xinfang/yjzj/feedback/feedbackshow?id=30A11AECC36E4010AFAC0FCBBA86D633,交通安全隐患,2023-09-19,交通道路配套设施施工进程缓慢，往来人员，车流量大。路口无灯光，人员警示与指示，交通事故频发。希望督促加快配套设施，道路修筑速度。,2023-10-11,上海市闵行区七宝镇人民政府,王同志：你于2023年9月19日写给市信访办的网上信访件（编号：网[2023]000231xxx）已转至七宝镇。你反映：宝文路虹莘路口交通道路配套设施进程缓慢存在安全隐患的问题。经本机关调查了解，现答复如下:关于你信访反映的问题，经了解，九星转型改造指挥部已协调世纪古美物业公司，将虹莘路施工围挡更换为栅栏式。同时，在路口增设反光镜以及路灯，以减少视野盲区保障通行安全，并要求九星场域管理单位在早晚高峰时段安排安保人员指挥交通。如有其他相关问题，本机关建议你向九星转型改造指挥部予以咨询。特此告知。
堵塞返水房屋物损,上海市闵行区七宝镇人民政府,2023-10-11,https://xfb.sh.gov.cn/xinfang/yjzj/feedback/feedbackshow?id=D8FEF1FFEEA94761BFB47CD3C8206ED1,堵塞返水房屋物损,2023-09-01,"我是闵行区七宝镇宝南路55弄九星家园居民，家里马桶污水总管堵塞粪水返水造成屋内地面粪水满地浸泡达6小时（卫生间，厨房，客厅），经过物业疏通，堵塞点位置位于整栋房污水总管竖管与横管转角交叉点堵塞。该小区是动迁安置房2022年入住，我房屋已经有三次返水事件了，每一次返水家里水漫金山。本人要求,追究物业公司管理责任并经济赔偿屋内财产物损。",2023-10-11,上海市闵行区七宝镇人民政府,阮同志：你于2023年9月1日写给市信访办的网上信访件（编号：网[2023]000214xxx）已转至七宝镇。你反映：污水返水导致房屋受损，现要求物业公司予以赔偿的问题。经本机关调查了解，现答复如下:关于你反映的污水返水问题。目前，小区居委会及物业公司已针对性地安装新的水泵缓解污水排水问题。同时，物业公司已安排保洁人员至你家中进行管道疏通及清理，物业公司也会继续关注，为你提供服务。关于你要求物业公司承担赔偿的问题，本机关建议你可以与物业公司进行协商，如协商不成，你可以向有管辖权的人民法院提起诉讼。特此告知。
松江叶榭姚王村我们***号和***号的房屋面对被他人损坏,上海市松江区叶榭镇人民政府,2023-10-11,https://xfb.sh.gov.cn/xinfang/yjzj/feedback/feedbackshow?id=3B61CCC922DD4DA1AA1A04EB382D6373,松江叶榭姚王村我们***号和***号的房屋面对被他人损坏,2023-09-01,本人反映，2020年9月份，某施工方在其房屋附近施工后疑似引起地基倾斜和墙体开裂。本人认为，其房屋受损系由施工方野蛮施工引起。本人要求，对受损房屋地基打桩加固，按照现状面积原地重建，室内简单装修。,2023-10-11,上海市松江区叶榭镇人民政府,信访事项处理意见书刘*同志：您信访反映的房屋受损事项收悉。经了解，经属地叶榭镇人民调解委员会搭建平台，您已与施工方进行了沟通协商，现已就房屋受损事宜后续达成一致意见，签订调解协议书。感谢您对党和政府工作的支持！上海市松江区叶榭镇人民政府2023年9月25日
蒲汇塘河水发黑发臭,上海市徐汇区建设和管理委员会,2023-10-11,https://xfb.sh.gov.cn/xinfang/yjzj/feedback/feedbackshow?id=3B1D8A89A7C04D8182C5CBDCA68B5189,蒲汇塘河水发黑发臭,2023-08-17,"本人反映, 徐汇区漕河泾蒲汇塘（康健路桥下），每当下雨天成或者退潮，河水发黑目散发出阵阵恶臭，影响河边小区居民健康。",2023-10-11,上海市徐汇区建设和管理委员会,黄**同志：您反映的信访事项本机关已受理。经研究，现答复如下：您反映漕河泾蒲汇塘（康健路桥下）每当下雨或退潮时，河水会散发异味，影响周边居民的身心健康。经现场核查，您反映的问题为市政泵站放江所导致。由于我市近期降水较多，按照上海市防汛指挥部办公室、上海市河长制办公室《关于进一步加强防汛排水工作的通知》（沪汛办〔2017〕54号）文件相关要求，我区区域范围内的市政泵站服务范围内发生降雨且达到所设定的水位后需进行开泵放江。放江后，短时间内会对蒲汇塘的水质造成一定影响，并散发异味。结束放江后，我区已第一时间派遣河道保洁队伍对该处河道进行了应急处置。当日，该段河道已无明显漂浮物，现场无明显异味。目前我区已配合涉及街道，向周边居民做好市政泵站放江问题的宣传、解释工作。同时继续强化市政泵站放江后的应急保洁处置能力，以最快速度消除市政泵站放江的负面影响。感谢您对我委工作的关心、理解和支持。 上海市徐汇区建设和管理委员会2023年9月18日	
请加快徐家汇地区城市改造的步伐,上海市徐汇区建设和管理委员会,2023-10-11,https://xfb.sh.gov.cn/xinfang/yjzj/feedback/feedbackshow?id=A89BD6774B14499899AD183B520E9CAF,请加快徐家汇地区城市改造的步伐,2023-09-11,"本人反映,由于历史原因，徐家汇地区还保留了大量上世纪90年代前落成的小区，这些落后小区存在很多问题，首先，由于艰造年代久远，小区拥挤不堪，设施也跟不上时代发展步伐。其次，由于当时财力有限，这些老破小小区，楼层低，导致居住的户数少，却占有了大量优质地段，土地级差地租没有有效发挥，黄金地段老破小大量占据。第三，由于大量老破小导致徐家汇地区城市面貌十分落后。第四、老小区成了贫民窟，老百姓购买力十分疲软，导致徐家汇地区的大型商厦，营业员比顾客多的怪现象。本人认为,要彻底改变徐家汇地区老破小集中的旧貌，需要将老破小地区都艰设成30层、40层的中高档小区，提高土地使用效率，动迁老破小地区居民。",2023-10-11,上海市徐汇区建设和管理委员会,阮**同志：您反映的信访事项本机关已受理。经研究，现答复如下：您反映希望加快对徐家汇地区城市改造步伐，对该地区老破小居民实施动迁。本机关认为，目前我区零星旧改及旧城区改建工作均根据市“两旧一村”改造实施意见和相关支持政策开展，根据政策要求，优先将二级旧里、小梁薄板房屋改造以及中心城区周边和五个新城等区域的“城中村”纳入改造计划。徐家汇地区目前暂无老旧小区列入旧改政策支持范围。感谢您对我委工作的关心、理解和支持。上海市徐汇区建设和管理委员会2023年9月22日
海韵馨苑缺少电瓶车充电桩,上海市奉贤区柘林镇人民政府,2023-10-11,https://xfb.sh.gov.cn/xinfang/yjzj/feedback/feedbackshow?id=2C25CB9ECDBD466AB845970409460037,海韵馨苑缺少电瓶车充电桩,2023-09-26,"居住海韵馨苑高层小区电瓶车多，充电桩少，下班回家没地方充电，影响第二天上班。小区内缺少电瓶车充电桩,希望新增电瓶车充电桩。",2023-10-11,上海市奉贤区柘林镇人民政府,张同志：您好！经与海韵居委协调，综合考虑海韵馨苑实际情况，现已计划年内增加9个充电棚，待后续相关申请通过后，进入实施建造流程。通过电话联系向您告知后，您表示知晓。感谢您对党和政府工作的关心、理解和支持。
海畔家园中央广场灯光太暗,上海市奉贤区柘林镇人民政府,2023-10-11,https://xfb.sh.gov.cn/xinfang/yjzj/feedback/feedbackshow?id=CDF55E70E3CE4196AFE508808F9CE57C,海畔家园中央广场灯光太暗,2023-09-26,海畔家园中央活动广场夜间灯光太暗，影响晚间散步、锻炼、游玩。建议在广场四周适量增加照明。,2023-10-11,上海市奉贤区柘林镇人民政府,瞿同志：您好！经与海畔居委协调，根据海畔家园小区实际情况，计划今年年内在中央广场周围增加6处夜间照明灯。相关工作正有序推进中。通过电话联系向您告知后，您表示知晓。感谢您对党和政府工作的关心、理解和支持。
咨询学前教育数据,上海市教育委员会,2023-10-11,https://xfb.sh.gov.cn/xinfang/yjzj/feedback/feedbackshow?id=86489CFEA8AE420F8CC6C6E8425DF91E,咨询学前教育数据,2023-09-26,出于科研需求，想要咨询一下2018-2020年三年间关于学前教育毛入园率和普惠性幼儿园覆盖率的数据。,2023-10-11,上海市教育委员会,王先生/女士：        您好！        您于2023年9月26日信访反映的事项收悉。        根据《上海市教育委员会政府信息公开指南》规定，您可以通过以下方式向我委申请获取政府信息：        1.当面提交。申请人可以到上海市教育委员会填写《上海市教育委员会政府信息公开申请表》（以下简称《申请表》），当场提出申请。上海市教育委员会地址：上海市大沽路100号3224室；办公时间：工作日9:00-11:30，13:30-17:00；联系电话：021-23116650。        2.信函或传真提交。申请人可通过邮政寄送或传真方式向本机关提交申请。来信请寄：上海市大沽路100号3224室，上海市教育委员会政府信息公开申请受理点（收），同时须在信封上注明“政府信息公开申请”字样；邮政编码：200003；传真号码：021-23116800。        3.网上申请。申请人可登陆“上海教育”门户网站，在政务公开专栏“依申请公开”页面，在线填写提交申请。       特此告知。                                                                                      上海市教育委员会                                                                                        2023年9月28日
