title,agency,date,links,标题,来信日期,信件内容,回复日期,回复单位,回复内容
退押金,上海市普陀区文化和旅游局,2023-11-08,https://xfb.sh.gov.cn/xinfang/yjzj/feedback/feedbackshow?id=F6F7E605D9424EA9BDB596FA85BA6BCC,退押金,2023-10-19,多年以前，我在曹杨路的普陀区图书馆办的借书卡，有押金。后来图书馆搬走了，离我现在的住址很远，由于现在眼睛也不好，不太借书看，想要退卡并退回押金，之前去附近的图书馆退证，却说不能退，还是要跑到普陀区图书馆退卡，还说要提供这个证那个证，这不是为难人吗？希望区长百忙之中抽空听听民声，为何要把退卡的事情搞的那么复杂，现在要如何拿回押金？,2023-11-08,上海市普陀区文化和旅游局,信访事项处理意见书杨同志：您好！您反映的事项已收悉。经研究，现答复如下：收到您的来信后，我局第一时间联系普陀区图书馆了解情况。经核实，根据上海图书馆《办证须知》，读者退证（即终止外借功能）时，可退还押金。普通外借证退办押金，可至初始申办点办理有关手续。参考外借功能需前往上海图书馆办理。退押金时所需证件：本人身份证、押金凭证及读者证，若委托他人代办者须出示代办人身份证。10月19日下午，区图书馆联系您告知相关政策，并请您或委托人带好证件前往大渡河路1800号普陀区图书馆（初始申办点）办理退卡事宜。经了解，您于10月20日上午至区图书馆办理了退卡，并成功退回了押金。感谢您对我们工作的理解与支持。上海市普陀区文化和旅游局2023年10月20日
小区车位问题,上海市普陀区长征镇人民政府,2023-11-08,https://xfb.sh.gov.cn/xinfang/yjzj/feedback/feedbackshow?id=38F14A1FB3674517904B9D05C61E1F5E,小区车位问题,2023-10-16,本人反映，怒江路某弄小区和某弄小区因为年限比较久，所以小区内车位规划不合理，导致小区居民汽车没有办法做到应停尽停。两个小区之间的主干道因为不是交通要道，一些车主选择将车停在没有停车位的路边，也会招来交警贴罚单。本人认为，可以适当在某弄小区以及某弄小区之间的路合理规划一些车位，解决两小区的车位难题。,2023-11-08,上海市普陀区长征镇人民政府,简复告知书都同志：您好！您于2023年10月16日信访反映的事项收悉。经了解，怒江路某弄和某弄都属于售后公房，两个小区各占地2万平方米，共918户。小区车辆共160辆，目前还有35位业主车辆正登记排队中，车位确实非常紧张。原业委会和居委物业多次进行了商议都未找到适合小区的解决办法。目前由于小区业委会正在换届改选中，待新业委会成立后将会同居委、物业及相关部门进行协商和研究处理，您提出的马路停车问题也将一并研究讨论，相关部门已要求物业加强停车管理，尤其在高峰时段增加保安力量，维持车辆进出次序，减少矛盾产生。特此告知。上海市普陀区长征镇人民政府2023年10月19日
楼盘交付问题,上海市嘉定区建设和管理委员会,2023-11-08,https://xfb.sh.gov.cn/xinfang/yjzj/feedback/feedbackshow?id=2925D8682C1140EB86D0CC08C0B3EF21,楼盘交付问题,2023-09-19,"本人反映,南翔镇融信海纳印象印象小区，现在房子已经建好，各方面评估也已经通过，三期四期已经通知9月23号可以交房，但是一期二期一直不给消息。",2023-11-08,上海市嘉定区建设和管理委员会,陈同志：您信访反映的事项我委已受理。经研究，现答复如下：目前，本项目已完成全部工程量，正处于综合竣工验收收尾中。接您的信访件以后，我委领导及工作专班已充分了解本项目竣备验收情况与问题，提报区级专班协商，并连续两周多次约谈开发商融嘉公司及总包单位元迅公司，协调督促双方，争取使双方达成一致意见，推进完成竣工备案。截止目前，在我委及区级专班各部门的共同努力下，本项目开发商融嘉公司及总包单位元迅公司已达成一致意见，元迅公司已经承诺全力配合竣备，并于9月22日开始上传竣备验收资料。截至10月10日，已完成竣工备案。特此回复。上海市嘉定区建设和管理委员会2023年10月19日
一再延期交房,上海市嘉定区建设和管理委员会,2023-11-08,https://xfb.sh.gov.cn/xinfang/yjzj/feedback/feedbackshow?id=1A3521E68FAC4B4DB1C150BB1DE7C444,一再延期交房,2023-09-19,一期业主不能同意第三次延期交付，开发商需尽快完成竣备验收，安排一期先行交付；对于此次一期预看房所发现的问题，开发商需出具整改进度，对于问题需应改尽改，由开发商出具承诺书，政府加以监管；对于项目竣备及交付，请政府帮忙加以推进尽快交付。,2023-11-08,上海市嘉定区建设和管理委员会,张同志：您信访反映的事项已受理。经研究，现答复如下：经核实，我委于9月27日、10月6日两次到项目现场进行抽查，未发现存在结构性、功能性质量缺陷，仅存在部分一般质量问题（第二、第三、第四批次待交付房屋）。结合该项目第一批次待交付房屋的质量问题已经整改到位，而第二、第三、第四批次待交付房屋的一般质量问题。经区级专班讨论决定，建设单位已书面承诺整改完成，随后我委向其发放了《建筑工程综合竣工验收合格通知书》。我委将持续跟踪并督促建设单位履行书面承诺内容，按时完成第二、三、四批次待交付房屋一般质量问题的整改闭合。感谢您对我委工作的理解和支持！上海市嘉定区建设和管理委员会2023年10月19日
关于噪声问题,上海市浦东新区航头镇人民政府,2023-11-08,https://xfb.sh.gov.cn/xinfang/yjzj/feedback/feedbackshow?id=F600EFB934854B66A67AFF80BC0CCD4D,关于噪声问题,2023-10-14,"本人反映，公共场所有人将卡拉OK晚上搬到此处，音乐声音巨大而且嗓音巨难听。本人认为,此行为扰乱公共秩序。本人要求,还居民一个良好的休息环境。",2023-11-08,上海市浦东新区航头镇人民政府,张同志：您反映的信访事项本机关已受理。经研究，现答复如下：您反映公共场所存在唱歌扰民。经查，该公共场所移动唱k点已被清除，文化中心点位已告知属地派出所和城管中队，加强对该地块的管理。感谢您对政府工作的关心、理解和支持。上海市浦东新区航头镇人民政府2023年10月23日
关于停车位问题,上海市浦东新区航头镇人民政府,2023-11-08,https://xfb.sh.gov.cn/xinfang/yjzj/feedback/feedbackshow?id=D85E7E1908424784B441891540190136,关于停车位问题,2023-10-17,本人反映，小区的公用车位被私装地锁和用杂物占用，希望有关部门督促物业加强管理并协助解决。,2023-11-08,上海市浦东新区航头镇人民政府,信访事项处理意见书顾同志：您反映的信访事项已受理。经研究，现答复如下：您反映小区公用车位被私装地锁和用杂物占用。您要求予以解决。经向居委核实，该小区地锁已整改完成，后续已告知物业对小区内私装地锁的情况加强巡查。关于车位内居民堆放杂物的情况，已联系镇房办要求物业对乱堆乱放杂物的情况，加强巡查，发现存在堆放的情况，及时将杂物清走，居委会也会根据相应情况，邀请职能部门进行联合执法，同时对小区内居民加强宣传引导。感谢您对政府工作的关心、理解和支持。上海市浦东新区航头镇人民政府2023年10月23日
关于扰民问题,上海市浦东新区航头镇人民政府,2023-11-08,https://xfb.sh.gov.cn/xinfang/yjzj/feedback/feedbackshow?id=3AFB8CD8B3764220B6A6DFBE9232E89E,关于扰民问题,2023-10-21,路上每天晚上六点到九点半有人拿着话筒音响唱歌直播，十分扰民，希望能得到有关部门重视。,2023-11-08,上海市浦东新区航头镇人民政府,张同志：您反映的信访事项本机关已受理。经研究，现答复如下：您反映小区附近噪音扰民的情况。经核实，您反映的地块确实存在晚上唱k的情况，该处社区已派驻志愿者及军保辅助力量，现场劝导，针对该区域扰民的情况，后期将研讨联合执法或寻找合适的点位，供居民晚上娱乐。您表示知悉。感谢您对政府工作的关心、理解和支持。上海市浦东新区航头镇人民政府2023年10月25日
关于杂物堆放问题,上海市浦东新区人民政府花木街道办事处,2023-11-08,https://xfb.sh.gov.cn/xinfang/yjzj/feedback/feedbackshow?id=8CD5DF2F2DA8470B9D2BB9C24A5694AD,关于杂物堆放问题,2023-09-24,"本人反映,小区19号楼天楼顶杂物堆积，电梯也需要清洁。本人认为,这对于居住在这里的老百姓十分不利。本人要求,希望责令有关部门整改，给我们一个美好的家。",2023-11-08,上海市浦东新区人民政府花木街道办事处,谭同志：您好！2023年9月27日，我单位受理您提出的信访事项。您来信反映小区19号楼楼顶杂物堆积，电梯内脏乱，要求物业定期清洁。经调查研究，现答复如下：经协调，关于您反映的楼顶杂物堆积等情况，物业已对相关情况进行了整治清理，今后也将加强巡视保持小区环境整洁。另关于您反映的电梯内部环境的情况，经核实小区因尚有20%未入户，为避免居民入户装修时对电梯桥厢造成损坏，故小区物业在电梯内设置木板加以保护。目前，小区物业对电梯桥厢的清扫频率为每日一次，后续物业会继续督促保洁做好电梯桥厢的清洁工作。谢谢您的来信，并请一如既往关心、关注和支持花木社区工作！上海市浦东新区人民政府花木街道办事处2023年10月13日
七浦路168号兴旺服饰市场的安危,上海市虹口区建设和管理委员会,2023-11-08,https://xfb.sh.gov.cn/xinfang/yjzj/feedback/feedbackshow?id=F49766D922D24E2CBCAFDD49385E6051,七浦路168号兴旺服饰市场的安危,2023-10-30,七浦路168号兴旺服饰市场（以下简称老兴旺）的业主，反映老兴旺旁边由海泰房地产开发公司开发大型的综合性高楼 ，由于该建筑离我们市场距离非常近，我们十分担心会带来地基倾斜、下沉、地下室渗水等安全隐患，这关系到商场里面人员和顾客的生命安危。迫切需要上级领导调查核实，解决问题，希望领导引起重视。,2023-11-08,上海市虹口区建设和管理委员会,张同志：您于2023年10月30日反映的“七浦路168号兴旺服饰市场的安危”事项已收悉，涉及我委事项现告知如下：您反映的项目是虹口区107号地块旧区改造及新建综合开发项目，目前正处于设计方案公示阶段，尚未开始施工。后续进入实施阶段，针对建设工程对周边小区造成的影响，区建管委将要求参建单位在基坑施工前做好应急预案，委托有资质的房屋检测单位对影响范围内房屋开展检测，同时在施工过程中加强监测，根据监测数据，采取切实有效的预防和修缮措施，确保周边房屋安全。感谢您对我们工作的理解和支持。特此告知。上海市虹口区建设和管理委员会2023年11月6日
申诉,上海市虹口区建设和管理委员会,2023-11-08,https://xfb.sh.gov.cn/xinfang/yjzj/feedback/feedbackshow?id=44AF00FACD22474297C8D5AFF4506B2D,申诉,2023-10-30,我是七浦路168号老兴旺服饰市场的业主，反映老兴旺旁边由海泰房地产开发公司开发大型的综合性高楼 ，由于该建筑离我们市场距离非常近，我们十分担心会带来地基倾斜、下沉、地下室渗水等安全隐患，希望领导引起重视。,2023-11-08,上海市虹口区建设和管理委员会,方同志：您于2023年10月30日反映的“虹口区107号地块旧区改造及新建综合开发项目影响七浦路老兴旺商场”事项已收悉，涉及我委事项现告知如下：您反映的项目是虹口区107号地块旧区改造及新建综合开发项目，目前正处于设计方案公示阶段，尚未开始施工。后续进入实施阶段，针对建设工程对周边小区造成的影响，区建管委将要求参建单位在基坑施工前做好应急预案，委托有资质的房屋检测单位对影响范围内房屋开展检测，同时在施工过程中加强监测，根据监测数据，采取切实有效的预防和修缮措施，确保周边房屋安全。感谢您对我们工作的理解和支持。特此告知。上海市虹口区建设和管理委员会2023年11月6日
控制广场舞音量,上海市闵行区人民政府浦锦街道办事处,2023-11-08,https://xfb.sh.gov.cn/xinfang/yjzj/feedback/feedbackshow?id=193466DDED7D45AAB53480A3C1DA4BD4,控制广场舞音量,2023-10-11,"本人反映,小区广场舞声音非常大，在中楼层关上窗户及卧室阳台门，然后打开抽油烟机，外面的歌声都清晰可闻。本人认为,小区环境需要大家维护，平时物业把绿化和路面整洁都保持的很好，很辛苦。十几个老人想活动筋骨也无可厚非，但是声音太大了，严重影响小区氛围。本人要求,至少降低一半音量，广场上能听见就够了，为什么要别人上一天班，回家吃个饭还不得安宁呢。",2023-11-08,上海市闵行区人民政府浦锦街道办事处,朱同志：您于2023年10月11日来信反映小区广场舞声音大的信访事项已收悉，编号：网[2023]000248xxx。现回复如下：经了解，居委已让晚间保安展开巡逻，如遇声音较大情况及时劝阻。居委工作人员也会向居民宣传合理控制广场舞音乐声量，合理规划跳舞时间。特此告知。
地砖损坏,上海市闵行区颛桥镇人民政府,2023-11-08,https://xfb.sh.gov.cn/xinfang/yjzj/feedback/feedbackshow?id=59A814F3455C4BF9BBA9D6DCC9E4559B,地砖损坏,2023-10-18,"本人反映,颛盛路从颛卫路到中沟路花箱缺失，导致卡车压坏地砖。本人要求,花箱摆放的方案，请统一协调下，增加或调整花箱，合理摆放花箱既阻挡卡车上人行道压坏铺装地砖又避免夜间卡车卸货噪音扰民。",2023-11-08,上海市闵行区颛桥镇人民政府,龚同志：您好！您于2023年10月18日反映颛盛路从颛卫路到中沟路因花箱缺失，卡车上人行道压坏铺装地砖的事项已收悉。经相关部门了解，颛盛路沿线不允许长时间停车，商铺又存在需要卸货的需求，虽然在颛盛路道路改造时由相关部门在沿线放置了花箱，但该处花箱被卸货车辆多次撞坏，无法使用，遂移除了2只，以便货车临停卸货。其他空档处已由相关部门划线后用于非机动车停放。我们将加强管理与维护，减少地砖损耗。特此告知。
小区改造中绿植墙面问题,上海市静安区人民政府临汾街道办事处,2023-11-08,https://xfb.sh.gov.cn/xinfang/yjzj/feedback/feedbackshow?id=161601008FE543ECAB829AA4AE52D144,小区改造中绿植墙面问题,2023-10-27,本人反映：小区改造中，在场中路大门外围、小区内墙面、健身器场地建了绿化墙。但验收结束后，就再没看到有专人定期给绿植维护浇水了。本人认为：小区改造用的都是小区房屋维修基金，如今绿植已几乎枯萎凋谢，毫无美感可言。本人要求：小区要做好该处绿化管理维护，不要造成浪费。,2023-11-08,上海市静安区人民政府临汾街道办事处,居民同志：您好！您信访反映的事项已收悉。我单位第一时间将小区绿化墙的问题反馈至所在居委会，小区综合改造单位已经对该处绿化进行了更换，现该处绿化墙环境已经得到很好的改善。同时综合改造单位会继续做好质保期间的维护。感谢您对社区工作的关心、理解和支持。
窗户护栏被拆除,上海市静安区人民政府临汾街道办事处,2023-11-08,https://xfb.sh.gov.cn/xinfang/yjzj/feedback/feedbackshow?id=F00178B881114EA7B74EC6300B196B6C,窗户护栏被拆除,2023-10-15,本人反映，建设公司在施工过程中，私自拆住户窗户护栏。认为在本人不知情的情况下，没有任何通知，私自拆住户窗户护栏影响我家防盗安全侵犯了个人财产安全。本人要求进行整改。,2023-11-08,上海市静安区人民政府临汾街道办事处,居民同志：您好！您信访反映的事项已收悉。我单位将您反映及时反馈至街道相关部门转加梯施工单位，期间我单位已与您当面沟通，听取您的意见，并协调施工单位与您共同协商沟通。经双方协商，现已经达成一致意见，得到您的认可。感谢您对我们工作的关心、理解和支持。
关于公交时刻问题,上海市浦东新区南汇新城镇人民政府,2023-11-08,https://xfb.sh.gov.cn/xinfang/yjzj/feedback/feedbackshow?id=FE5E9DC6879B40DE87AC86337ED7846A,关于公交时刻问题,2023-09-26,近期，常坐的公交车作了时刻表的调整。调整后，每周五早晨7点50分的那班车取消了，改成7点40分发车。这给我带来巨大不便。我写这封信的目的：要求恢复7点50分这班车。,2023-11-08,上海市浦东新区南汇新城镇人民政府,信访事项答复意见书张女士：您反映的信访事项本机关已受理。经研究，现答复如下：您提出关于调整公交时刻表，方便师生出行的建议。公共交通是城市运行保障的重要组成部分，我镇非常重视城市公交的出行服务，今年来，已多次走访五大高校和相关社区，对相关涉及公交线路进行了优化调整。9月初，职能部门根据客流情况对相关线路包括您所乘坐公交的时刻表进行了部分调整。考虑到师生上课出行需求，在下次公交线网调整时，将再次征询相关部门意见，统筹考虑进一步优化该公交班次，并由临港公交会同校方做好宣传工作。下一步，职能部门将根据校方师生和社区的动态需求进一步完善整体公交线网布局，感谢您对临港公共交通的支持。上海市浦东新区南汇新城镇人民政府2023年10月23日
关于噪音扰民问题,上海市浦东新区高行镇人民政府,2023-11-08,https://xfb.sh.gov.cn/xinfang/yjzj/feedback/feedbackshow?id=F6A93E54F238469EBEF0B1E9F50B7534,关于噪音扰民问题,2023-10-10,"本人反映,建材家具市场每日很早开始切割钢材，南侧印刷厂机械噪音污染，西侧集卡停放半夜卸货作业，维修车辆等。各种噪音十分扰民，请求政府解决！",2023-11-08,上海市浦东新区高行镇人民政府,李同志：您来信反映的相关问题已收悉。现答复如下：关于建材市场施工噪音扰民问题。镇相关执法部门找到并告知该施工单位负责人，要求其在施工过程中不得在居民区附近进行切割作业，且施工时间不得过早，工作日上午8点后进行施工，双休日不得有噪音施工。关于印刷厂集装箱卡车噪音扰民问题。镇相关执法部门已前往该厂执法，并约谈行政值班经理，要求其优化卡车卸货时间，管理好厂内卡车司机，倡导文明驾车，尽力减少噪音扰民。我们将继续加强对噪音污染的监管治理。感谢您对我们工作的支持。特此告知。上海市浦东新区高行镇人民政府2023年10月26日
关于噪音扰民问题,上海市浦东新区航头镇人民政府,2023-11-08,https://xfb.sh.gov.cn/xinfang/yjzj/feedback/feedbackshow?id=5C4DB32AF4F84CFAB123B0531CAEC6E0,关于噪音扰民问题,2023-10-22,一群老头老太在住宅区附近话筒音响唱歌直播，小区居民十分困扰，希望有关部门能够重视。另外，建议社区专门搞个区域让他们唱。,2023-11-08,上海市浦东新区航头镇人民政府,张同志：您反映的信访事项本机关已受理。经研究，现答复如下：您反映小区附近噪音扰民的情况。经查，该处社区已派驻志愿者及军保辅助力量，现场劝导，针对该区域扰民的情况，后期将研讨联合执法或寻找合适的点位，供居民晚上娱乐。您表示知悉。感谢您对政府工作的关心、理解和支持。上海市浦东新区航头镇人民政府2023年10月25日
关于焚烧问题,上海市浦东新区周浦镇人民政府,2023-11-08,https://xfb.sh.gov.cn/xinfang/yjzj/feedback/feedbackshow?id=BF1BAB1B12F64728AC6C856AF8517443,关于焚烧问题,2023-10-17,最近已经入秋，本人反映在地铁16号线周浦东站地铁站为圆心大概方圆5公里左右范围附近，一直有焚烧桔梗以及一些不明物品。请有关部门重视。,2023-11-08,上海市浦东新区周浦镇人民政府,简复告知书陈同志：您好！您于2023年10月17日信访反映的事项收悉。经了解：在接到您的信访件后，村委人员及时深入村内进行排查，发现确实有村民在焚烧桔梗，村委工作人员及时上门进行劝阻，同时，村委派出志愿者对整个辖区进行巡查，发现有类似情况及时上报。特此告知。上海市浦东新区周浦镇人民政府2023年10月24日
关于帮困问题,上海市浦东新区人民政府塘桥街道办事处,2023-11-08,https://xfb.sh.gov.cn/xinfang/yjzj/feedback/feedbackshow?id=2130AB70B4AF40219A31351F10B01CB2,关于帮困问题,2023-09-19,本人残疾，妻子体弱多病，希望得到帮助。,2023-11-08,上海市浦东新区人民政府塘桥街道办事处,信访事项处理意见书同志：您反映的信访事项已受理。经研究，现答复如下：经查，您的家庭存在一定困难，相关居委帮助您的家庭申请办理长护险。考虑到您父亲年事已高，您行走不便，居委安排专人去社区事务中心为您二人代办长护险手续，对于您家中的情况，居委一直比较关注，提供力所能及的帮助。感谢您对塘桥街道信访工作的关心、理解和支持。上海市浦东新区人民政府塘桥街道办事处2023年10月9日
关于公园虫害问题,上海市浦东新区南汇新城镇人民政府,2023-11-08,https://xfb.sh.gov.cn/xinfang/yjzj/feedback/feedbackshow?id=19A21EAE40694CBC9905ECA01AD64076,关于公园虫害问题,2023-09-27,"本人反映,公园夏园荷花塘，意思福寿螺入侵。本人认为,应该及时处理病虫害。本人要求,抓紧处理。",2023-11-08,上海市浦东新区南汇新城镇人民政府,信访事项答复意见书张先生：您反映的信访事项本机关已受理。经研究，现答复如下：您反映公园夏园荷花塘中荷花有虫害的问题。我镇受理您的信访件后，相关职能部门十分重视，立即进行调查核实。经职能部门派员现场查看，夏园荷花塘发现福寿螺卵，遂安排人员现场采取措施，人工清除福寿螺卵，目前荷塘福寿螺发生情况得到初步控制，可见福寿螺卵已经清除，后续职能部门将重点关注，加大巡查力度，并采取防治措施：1、不定期清除岸边螺卵，人工捞除成螺，压低母螺在河道驳岸和水生植物上的产卵基数。2、未有水产养殖的浅水塘可用杀螺胺、茶籽饼灭杀。3、荷塘清理受害植物残叶残枝，保持荷塘整洁保证市民有个优美的环境。感谢您对我们工作的理解与支持。上海市浦东新区南汇新城镇人民政府2023年10月23日
关于噪音扰民问题,上海市浦东新区高行镇人民政府,2023-11-08,https://xfb.sh.gov.cn/xinfang/yjzj/feedback/feedbackshow?id=B7844CA2D6F247ED91C5C57C5AF1A96B,关于噪音扰民问题,2023-09-30,"本人反映,小区东面空调外机噪音扰民。本小区南侧印刷厂夜间机械噪音呈扰民现象，影响本小区居民夜间休息。",2023-11-08,上海市浦东新区高行镇人民政府,李同志：您来信反映的相关问题已收悉。现答复如下：关于空调外机噪音扰民问题。目前正在对外墙面统一进行环境美化，针对空调外机噪音问题，将对空调外机进行格栅处理，从而达到降噪的效果。关于印刷厂噪音扰民问题。镇相关执法部门已前往该厂执法，要求该厂负责人完善相关环保措施，将噪音影响降到最低。感谢您对我们工作的支持。特此告知。上海市浦东新区高行镇人民政府2023年10月26日
道路施工扬尘,上海市闵行区颛桥镇人民政府,2023-11-08,https://xfb.sh.gov.cn/xinfang/yjzj/feedback/feedbackshow?id=04C3C606263747AF965C0AEE8735B313,道路施工扬尘,2023-10-18,闵行区联农路近颛乐路一段近日施工，扬尘严重，特别是有车开过时，灰蒙蒙的一片像雾霾。早晚学生上学时，车很多，边上走路的学生被迫呼吸扬尘的空气，能否采取一些措施，避免扬尘。,2023-11-08,上海市闵行区颛桥镇人民政府,沈同志：您好！您于2023年10月18日反映颛乐路道路施工扬尘严重的事项已收悉。经了解，您反映的问题相关部门已督促施工单位严格做好文明施工措施，具体如下：临时堆放的施工材料采取围挡、遮盖等防尘措施。做好清运车辆维护措施，确保运输途中的物料不泄露、洒落或飞扬。施工区域内委派清扫班每日进行定时清扫、洒水，确保路面清洁。对可能产生扬尘的情况，采取先洒水或在施工中喷水的办法减少粉尘的产生。特此告知。
